novelle08_09_pirandello_f000150|si fermasse davanti al posto di guardia e coi tre soldi nella mano insanguinata si denunziasse da sé|si fermasse davanti al posto di guardia e coi tre soldi nella mano insanguinata si denunziasse da sé
novelle08_09_pirandello_f000151|come se parlasse un altro per bocca sua. — Vedete che può Dio? — gli disse allora la Poponè.|come se parlasse un altro per bocca sua. - Vedete che può Dio? - gli disse allora la Poponè.
novelle08_09_pirandello_f000152|— E perciò io non ho paura! Zi’ Lisi insistette per accompagnarla; ma lei tenne duro;|- E perciò io non ho paura! Zi Lisi insistette per accompagnarla; ma lei tenne duro;
novelle08_09_pirandello_f000153|gli disse che avrebbe preso in affitto l’asino da qualche altro;|gli disse che avrebbe preso in affitto lasino da qualche altro;
novelle08_09_pirandello_f000154|e allora egli cedette e le promise che il giorno appresso, all’alba|e allora egli cedette e le promise che il giorno appresso, allalba
novelle08_09_pirandello_f000155|l’asinella sarebbe stata davanti alla porta di lei, con la bardella e tutto.|lasinella sarebbe stata davanti alla porta di lei, con la bardella e tutto.
novelle08_09_pirandello_f000156|Ora avvenne, che di notte zi’ Lisi, col pensiero dell’asina da approntare per l’alba, si svegliò.|Ora avvenne, che di notte zi Lisi, col pensiero dellasina da approntare per lalba, si svegliò.
novelle08_09_pirandello_f000157|C’era un gran chiaro di luna, e gli parve giorno.|Cera un gran chiaro di luna, e gli parve giorno.
novelle08_09_pirandello_f000158|Saltò dal letto, sellò l’asina in un amen e la condusse alla casa della Poponè.|Saltò dal letto, sellò lasina in un amen e la condusse alla casa della Poponè.
novelle08_09_pirandello_f000159|Bussò alla porta e disse: — L’asina è qua, gna’ Poponè. L’ho legata all’anello.|Bussò alla porta e disse: - Lasina è qua, gna Poponè. Lho legata allanello.
novelle08_09_pirandello_f000160|Il Signore e la bella Madre vi accompagnino.|Il Signore e la bella Madre vi accompagnino.
novelle08_09_pirandello_f000161|La Poponè, zitta zitta, per non svegliare la nuora, il figliuolo e i nipotini, prese a vestirsi.|La Poponè, zitta zitta, per non svegliare la nuora, il figliuolo e i nipotini, prese a vestirsi.
novelle08_09_pirandello_f000162|Ma solita di levarsi alla punta dell’alba, non si capacitava, col silenzio che regnava tutt’intorno,|Ma solita di levarsi alla punta dellalba, non si capacitava, col silenzio che regnava tuttintorno,
novelle08_09_pirandello_f000163|che quella fosse l’ora di partire. — Sarà! — disse. — M’avrà gabbata il sonno.|che quella fosse lora di partire. - Sarà! - disse. - Mavrà gabbata il sonno.
novelle08_09_pirandello_f000164|E uscí col fagottello sotto la mantellina.|E uscí col fagottello sotto la mantellina.
novelle08_09_pirandello_f000165|S’accorse subito, guardando il cielo, che quella non era alba, ma chiaro di luna.|Saccorse subito, guardando il cielo, che quella non era alba, ma chiaro di luna.
novelle08_09_pirandello_f000166|Tutto il paesello dormiva tranquillo;|Tutto il paesello dormiva tranquillo;
novelle08_09_pirandello_f000167|dormiva anche l’asinella in piedi, legata lí, all’anello accanto alla porta.|dormiva anche lasinella in piedi, legata lí, allanello accanto alla porta.
novelle08_09_pirandello_f000168|— O Gesú mio, — disse la Poponè.|- O Gesú mio, - disse la Poponè.
novelle08_09_pirandello_f000169|— Che stolido, quello zi’ Lisi! Debbo mettermi in cammino, di notte?|- Che stolido, quello zi Lisi! Debbo mettermi in cammino, di notte?
novelle08_09_pirandello_f000170|Mah! Sono vecchia, c’è la luna; e non ho niente da perdere.|Mah! Sono vecchia, cè la luna; e non ho niente da perdere.
novelle08_09_pirandello_f000171|Le animucce sante del Purgatorio mi accompagneranno.|Le animucce sante del Purgatorio mi accompagneranno.
novelle08_09_pirandello_f000172|Montò su l’asinella, si fece il segno della croce e s’incamminò.|Montò su lasinella, si fece il segno della croce e sincamminò.
novelle08_09_pirandello_f000173|Quando fu un buon tratto lontana dal paese, nello stradone, tra le campagne sotto la luna, andando lentamente su l’asinella|Quando fu un buon tratto lontana dal paese, nello stradone, tra le campagne sotto la luna, andando lentamente su lasinella
novelle08_09_pirandello_f000174|si mise a pensare a quel ragazzino sgozzato e buttato lí, dietro la siepe polverosa, povera creaturina di Dio;|si mise a pensare a quel ragazzino sgozzato e buttato lí, dietro la siepe polverosa, povera creaturina di Dio;
novelle08_09_pirandello_f000175|a tanti altri ammazzamenti e male vendette pensò, che si raccontavano della Favara|a tanti altri ammazzamenti e male vendette pensò, che si raccontavano della Favara
novelle08_09_pirandello_f000176|e intanto proseguiva con la mantellina in capo tirata fin su gli occhi per impedirsi di guardare le ombre paurose della campagna di qua e di là dello stradone|e intanto proseguiva con la mantellina in capo tirata fin su gli occhi per impedirsi di guardare le ombre paurose della campagna di qua e di là dello stradone
novelle08_09_pirandello_f000177|ove la polvere era cosí alta, che non faceva neanche sentire il rumore degli zoccoli dell’asinella.|ove la polvere era cosí alta, che non faceva neanche sentire il rumore degli zoccoli dellasinella.
novelle08_09_pirandello_f000178|Tutto quel silenzio e quel suo andare, e la luna e quella via lunga e bianca le parevano un sogno.|Tutto quel silenzio e quel suo andare, e la luna e quella via lunga e bianca le parevano un sogno.
novelle08_09_pirandello_f000179|— O Animucce sante del Purgatorio, — diceva tra sé, — a voi mi raccomando! E non smetteva un momento di pregare.|- O Animucce sante del Purgatorio, - diceva tra sé, - a voi mi raccomando! E non smetteva un momento di pregare.
novelle08_09_pirandello_f000180|Ma, o fosse la lentezza del cammino, o la sua debolezza, o che, o come, a un certo punto, forse la vinse il sonno.|Ma, o fosse la lentezza del cammino, o la sua debolezza, o che, o come, a un certo punto, forse la vinse il sonno.
novelle08_09_pirandello_f000181|La Poponè non lo seppe mai dire;|La Poponè non lo seppe mai dire;
novelle08_09_pirandello_f000182|ma il fatto è che ai due lati dello stradone, a un certo punto, svegliandosi, si trovò due lunghe file di soldati.|ma il fatto è che ai due lati dello stradone, a un certo punto, svegliandosi, si trovò due lunghe file di soldati.
novelle08_09_pirandello_f000183|In testa, nel mezzo dello stradone, andava a cavallo il capitano.|In testa, nel mezzo dello stradone, andava a cavallo il capitano.
novelle08_09_pirandello_f000184|La Poponè, appena li vide, si sentí riconfortare, e ringraziò Dio|La Poponè, appena li vide, si sentí riconfortare, e ringraziò Dio
novelle08_09_pirandello_f000185|che proprio in quella notte del suo viaggio aveva disposto che quei militari dovessero recarsi anch’essi alla Favara.|che proprio in quella notte del suo viaggio aveva disposto che quei militari dovessero recarsi anchessi alla Favara.
novelle08_09_pirandello_f000186|Le faceva però una certa meraviglia che tanti giovinotti di vent’anni non dicessero nulla vedendo in mezzo a loro una vecchia come lei|Le faceva però una certa meraviglia che tanti giovinotti di ventanni non dicessero nulla vedendo in mezzo a loro una vecchia come lei
novelle08_09_pirandello_f000187|su un’asina vecchia più di lei, che non doveva fare certamente una bella figura, per lo stradone a quell’ora.|su unasina vecchia più di lei, che non doveva fare certamente una bella figura, per lo stradone a quellora.
novelle08_09_pirandello_f000188|Perché cosí in silenzio, tutti quei soldati?|Perché cosí in silenzio, tutti quei soldati?
novelle08_09_pirandello_f000189|Non si sentivano nemmeno camminare e non sollevavano neanche un po’ di polvere.|Non si sentivano nemmeno camminare e non sollevavano neanche un po di polvere.
novelle08_09_pirandello_f000190|La Poponè ora li mirava sbigottita, non sapendo che pensarne.|La Poponè ora li mirava sbigottita, non sapendo che pensarne.
novelle08_09_pirandello_f000191|Le parevano ombre, sotto la luna;|Le parevano ombre, sotto la luna;
novelle08_09_pirandello_f000192|eppure erano veri, soldati veri, sí, col loro capitano là, a cavallo. Ma perché cosí silenziosi?|eppure erano veri, soldati veri, sí, col loro capitano là, a cavallo. Ma perché cosí silenziosi?
novelle08_09_pirandello_f000193|Il perché lo seppe, quando fu in vista del paese, sul primo albeggiare.|Il perché lo seppe, quando fu in vista del paese, sul primo albeggiare.
novelle08_09_pirandello_f000194|Il capitano a un certo punto fermò il cavallo e aspettò ch’ella lo raggiungesse.|Il capitano a un certo punto fermò il cavallo e aspettò chella lo raggiungesse.
novelle08_09_pirandello_f000195|— Maragrazia Ajello, — le disse allora, — io sono l’Angelo Centuno, di cui sei tanto divota|- Maragrazia Ajello, - le disse allora, - io sono lAngelo Centuno, di cui sei tanto divota
novelle08_09_pirandello_f000196|e queste che ti hanno scortata fin qui sono anime del Purgatorio.|e queste che ti hanno scortata fin qui sono anime del Purgatorio.
novelle08_09_pirandello_f000197|Appena arrivata, mettiti in regola con Dio, ché prima di mezzogiorno tu morrai.|Appena arrivata, mettiti in regola con Dio, ché prima di mezzogiorno tu morrai.
novelle08_09_pirandello_f000198|Disse e scomparve con la santa scorta.|Disse e scomparve con la santa scorta.
novelle08_09_pirandello_f000199|Quando la sorella, alla Favara, si vide arrivare in casa la Poponè, bianca, come di cera, e stralunata:|Quando la sorella, alla Favara, si vide arrivare in casa la Poponè, bianca, come di cera, e stralunata:
novelle08_09_pirandello_f000200|— Maragrà, che hai? — le gridò.|- Maragrà, che hai? - le gridò.
novelle08_09_pirandello_f000201|E lei con un filo di voce: — Chiamami un confessore. — Ti senti male?|E lei con un filo di voce: - Chiamami un confessore. - Ti senti male?
novelle08_09_pirandello_f000202|— Devo farmi le cose di Dio. Prima di mezzogiorno morirò. E cosí fu, difatti. Prima di mezzogiorno morí.|- Devo farmi le cose di Dio. Prima di mezzogiorno morirò. E cosí fu, difatti. Prima di mezzogiorno morí.
novelle08_09_pirandello_f000203|E tutto il popolo di Favara scasò a vedere la santa che l’Angelo Centuno|E tutto il popolo di Favara scasò a vedere la santa che lAngelo Centuno
novelle08_09_pirandello_f000204|e le anime del Purgatorio avevano scortata quella notte fino alle porte del paese».|e le anime del Purgatorio avevano scortata quella notte fino alle porte del paese.
novelle08_09_pirandello_f000205|Donna Gesa tacque. Tacemmo, ammirati, io e il Gaglio e Monsignore, suo padrone.|Donna Gesa tacque. Tacemmo, ammirati, io e il Gaglio e Monsignore, suo padrone.
novelle08_09_pirandello_f000206|Ma Sebastiano Terilli, scrollandosi, esclamò: — All’anima del miracolo! è questo il miracolo?|Ma Sebastiano Terilli, scrollandosi, esclamò: - Allanima del miracolo! è questo il miracolo?
novelle08_09_pirandello_f000207|E che miracolo è questo? Ma scusate… Miracolo? Perché miracolo?|E che miracolo è questo? Ma scusate Miracolo? Perché miracolo?
novelle08_09_pirandello_f000208|Ammettiamo tutto: ammettiamo che la poveretta non sia morta veramente di paura|Ammettiamo tutto: ammettiamo che la poveretta non sia morta veramente di paura
novelle08_09_pirandello_f000209|e che quella non sia stata un’allucinazione spiegabilissima in una che credeva di parlare ogni notte con le anime del Purgatorio e con quest’Angelo Centuno;|e che quella non sia stata unallucinazione spiegabilissima in una che credeva di parlare ogni notte con le anime del Purgatorio e con questAngelo Centuno;
novelle08_09_pirandello_f000210|ammettiamo che l’angelo le sia apparso per davvero e le abbia parlato. Ebbene?|ammettiamo che langelo le sia apparso per davvero e le abbia parlato. Ebbene?
novelle08_09_pirandello_f000211|Altro che miracolo! Questa è crudeltà feroce.|Altro che miracolo! Questa è crudeltà feroce.
novelle08_09_pirandello_f000212|Annunziare imminente la morte a una poverina!|Annunziare imminente la morte a una poverina!
novelle08_09_pirandello_f000213|Ma noi tutti, scusate, noi tutti possiamo vivere solo a patto che… Celestino Calandra protese le mani per rispondergli|Ma noi tutti, scusate, noi tutti possiamo vivere solo a patto che Celestino Calandra protese le mani per rispondergli
novelle08_09_pirandello_f000214|e l’eterna discussione si riaccese più calorosa che mai.|e leterna discussione si riaccese più calorosa che mai.
novelle08_09_pirandello_f000215|Ma la fede, la fede! non si doveva tener conto della fede, di cui si nutre e s’appaga la povera gente?|Ma la fede, la fede! non si doveva tener conto della fede, di cui si nutre e sappaga la povera gente?
novelle08_09_pirandello_f000216|Gli uomini cosí detti intellettuali non vedono, non sanno veder altro che la vita, e non pensano mai alla morte.|Gli uomini cosí detti intellettuali non vedono, non sanno veder altro che la vita, e non pensano mai alla morte.
novelle08_09_pirandello_f000217|La scienza, le scoperte, la gloria|La scienza, le scoperte, la gloria
novelle08_09_pirandello_f000218|il dominio! E si domandano come faccia a vivere senza tutte queste belle e grandi cose la gente del popolo|il dominio! E si domandano come faccia a vivere senza tutte queste belle e grandi cose la gente del popolo
novelle08_09_pirandello_f000219|quella che zappa la terra e che appare loro condannata alle più dure e umili fatiche;|quella che zappa la terra e che appare loro condannata alle più dure e umili fatiche;
novelle08_09_pirandello_f000220|come faccia a vivere e perché viva;|come faccia a vivere e perché viva;
novelle08_09_pirandello_f000221|e la stimano bruta, perché non pensano che una ben più grande idealità|e la stimano bruta, perché non pensano che una ben più grande idealità
novelle08_09_pirandello_f000222|di fronte alla quale diventano vane e ridicole miserie tutte le scoperte della scienza e il dominio del mondo e la gloria delle arti|di fronte alla quale diventano vane e ridicole miserie tutte le scoperte della scienza e il dominio del mondo e la gloria delle arti
novelle08_09_pirandello_f000223|vive come certezza irrefragabile in quelle povere anime e rende loro desiderabile come un giusto premio la morte.|vive come certezza irrefragabile in quelle povere anime e rende loro desiderabile come un giusto premio la morte.
novelle08_09_pirandello_f000224|Chi sa quanto si sarebbe protratta quella discussione sul miracolo dell’Angelo Centuno|Chi sa quanto si sarebbe protratta quella discussione sul miracolo dellAngelo Centuno
novelle08_09_pirandello_f000225|se un altro miracolo, e questo vero, autentico, indiscutibile, non la avesse a un tratto troncata.|se un altro miracolo, e questo vero, autentico, indiscutibile, non la avesse a un tratto troncata.
novelle08_09_pirandello_f000226|Stefano Traína, col fucile da caccia in pugno, si precipitò nella sala da pranzo tutto ansante|Stefano Traína, col fucile da caccia in pugno, si precipitò nella sala da pranzo tutto ansante
novelle08_09_pirandello_f000227|esultante, col volto paonazzo, congestionato, sgraffiato, affumicato.|esultante, col volto paonazzo, congestionato, sgraffiato, affumicato.
novelle08_09_pirandello_f000228|Era finalmente riuscito a uccidere uno storno!|Era finalmente riuscito a uccidere uno storno!
novelle08_10_pirandello_f000001|Novelle per un anno di luigi pirandello|Novelle per un anno di luigi pirandello
novelle08_10_pirandello_f000002|«SUPERIOR STABAT LUPUS»|SUPERIOR STABAT LUPUS
novelle08_10_pirandello_f000003|Corrado Tranzi, fino a ventiquattr’anni disprezzatore implacabile di tutte le donne,|Corrado Tranzi, fino a ventiquattranni disprezzatore implacabile di tutte le donne,
novelle08_10_pirandello_f000004|implacabile derisore di tutti gli uomini che se n’innamoravano|implacabile derisore di tutti gli uomini che se ninnamoravano
novelle08_10_pirandello_f000005|appena presa la laurea di dottore in medicina|appena presa la laurea di dottore in medicina
novelle08_10_pirandello_f000006|chiamato per un caso d’urgenza mentre di buon mattino stava a concertare una partita di caccia nella farmacia d’un amico – (il bel cielo?|chiamato per un caso durgenza mentre di buon mattino stava a concertare una partita di caccia nella farmacia dun amico - il bel cielo?
novelle08_10_pirandello_f000007|il tepore della primavera imminente? qualche sogno della notte?|il tepore della primavera imminente? qualche sogno della notte?
novelle08_10_pirandello_f000008|) – s’innamorò anche lui tutt’a un tratto, proprio in quella sua prima visita di medico.| - sinnamorò anche lui tutta un tratto, proprio in quella sua prima visita di medico.
novelle08_10_pirandello_f000009|Che pregi straordinarii e doti scoprisse in quella fanciulla che venne ad aprirgli la porta|Che pregi straordinarii e doti scoprisse in quella fanciulla che venne ad aprirgli la porta
novelle08_10_pirandello_f000010|spettinata, mezzo discinta, tutta affannata tra le lagrime, l’avrà saputo lui che li scoperse.|spettinata, mezzo discinta, tutta affannata tra le lagrime, lavrà saputo lui che li scoperse.
novelle08_10_pirandello_f000011|Certo è che, fin dal primo vederla, restò abbagliato a guardarla in bocca|Certo è che, fin dal primo vederla, restò abbagliato a guardarla in bocca
novelle08_10_pirandello_f000012|mentr’ella affollatamente gli parlava della zia trovata a letto, un quarto d’ora addietro, rantolante e senza conoscenza.|mentrella affollatamente gli parlava della zia trovata a letto, un quarto dora addietro, rantolante e senza conoscenza.
novelle08_10_pirandello_f000013|Introdotto nella camera della colpita, vide accanto al letto un giovinotto che forse, anzi certo|Introdotto nella camera della colpita, vide accanto al letto un giovinotto che forse, anzi certo
novelle08_10_pirandello_f000014|era il figlio, e un uomo e una donna che forse erano il padre e la madre della fanciulla.|era il figlio, e un uomo e una donna che forse erano il padre e la madre della fanciulla.
novelle08_10_pirandello_f000015|Il Tranzi notò subito che questa, mentr’egli dichiarava il male (caso indubbio e irrimediabile d’embolia cerebrale)|Il Tranzi notò subito che questa, mentregli dichiarava il male caso indubbio e irrimediabile dembolia cerebrale
novelle08_10_pirandello_f000016|s’era messa a carezzare i capelli del giovinotto|sera messa a carezzare i capelli del giovinotto
novelle08_10_pirandello_f000017|del cuginetto che piangeva con la faccia affondata nel guanciale proprio accanto al capo della madre agonizzante, e se ne stizzí tanto|del cuginetto che piangeva con la faccia affondata nel guanciale proprio accanto al capo della madre agonizzante, e se ne stizzí tanto
novelle08_10_pirandello_f000018|che improvvisamente s’interruppe per ordinare che, perdio, quel figliuolo se ne poteva andare a piangere di là.|che improvvisamente sinterruppe per ordinare che, perdio, quel figliuolo se ne poteva andare a piangere di là.
novelle08_10_pirandello_f000019|Aria! aria! un po’ d’aria attorno al letto! L’inferma morí tre giorni dopo.|Aria! aria! un po daria attorno al letto! Linferma morí tre giorni dopo.
novelle08_10_pirandello_f000020|In quei tre giorni Corrado Tranzi riuscí a sapere tante cose: che la fanciulla si chiamava Ebe;|In quei tre giorni Corrado Tranzi riuscí a sapere tante cose: che la fanciulla si chiamava Ebe;
novelle08_10_pirandello_f000021|che era figliuola d’un tal De Vitti, professore di fisica al Collegio Nautico;|che era figliuola dun tal De Vitti, professore di fisica al Collegio Nautico;
novelle08_10_pirandello_f000022|che la defunta era cognata del professore, vedova da tanti anni e accolta in casa col figliuolo che si chiamava Marco Perla;|che la defunta era cognata del professore, vedova da tanti anni e accolta in casa col figliuolo che si chiamava Marco Perla;
novelle08_10_pirandello_f000023|che questi, già impiegato modestamente alla Dogana|che questi, già impiegato modestamente alla Dogana
novelle08_10_pirandello_f000024|aveva chiesto col piacere dei parenti la mano della cuginetta, la quale però aveva rifiutato con molto dolore|aveva chiesto col piacere dei parenti la mano della cuginetta, la quale però aveva rifiutato con molto dolore
novelle08_10_pirandello_f000025|confessando candidamente che le sarebbe stato impossibile sposarlo, perché, fin da bambina cresciuta con lui|confessando candidamente che le sarebbe stato impossibile sposarlo, perché, fin da bambina cresciuta con lui
novelle08_10_pirandello_f000026|lo amava come fratello, e solamente come tale e non altrimenti avrebbe potuto amarlo.|lo amava come fratello, e solamente come tale e non altrimenti avrebbe potuto amarlo.
novelle08_10_pirandello_f000027|Sapute queste cose, Corrado Tranzi si fece avanti, senza perder tempo.|Sapute queste cose, Corrado Tranzi si fece avanti, senza perder tempo.
novelle08_10_pirandello_f000028|Tra pochi mesi si sarebbe deciso il concorso a tre posti di assistente nell’ospedale maggiore della città|Tra pochi mesi si sarebbe deciso il concorso a tre posti di assistente nellospedale maggiore della città
novelle08_10_pirandello_f000029|a cui egli aveva preso parte: era sicuro di vincere; sicurissimo;|a cui egli aveva preso parte: era sicuro di vincere; sicurissimo;
novelle08_10_pirandello_f000030|aveva poi qualcosa di suo e la professione di medico: poteva sposare.|aveva poi qualcosa di suo e la professione di medico: poteva sposare.
novelle08_10_pirandello_f000031|Il professor De Vitti rimase dapprima costernato di tanta furia e della stranezza dei modi e del dire del giovine medico|Il professor De Vitti rimase dapprima costernato di tanta furia e della stranezza dei modi e del dire del giovine medico
novelle08_10_pirandello_f000032|ricciuto e barbuto, tutto scatti e schizzi tra sprezzature sbrigative; esitò;|ricciuto e barbuto, tutto scatti e schizzi tra sprezzature sbrigative; esitò;
novelle08_10_pirandello_f000033|si provò a prender tempo con la scusa del lutto recentissimo;|si provò a prender tempo con la scusa del lutto recentissimo;
novelle08_10_pirandello_f000034|ma Corrado Tranzi, che giusto per questo lutto recentissimo temeva|ma Corrado Tranzi, che giusto per questo lutto recentissimo temeva
novelle08_10_pirandello_f000035|che l’amor fraterno della fanciulla per il cugino potesse da un momento all’altro cangiar natura col lievito della pietà|che lamor fraterno della fanciulla per il cugino potesse da un momento allaltro cangiar natura col lievito della pietà
novelle08_10_pirandello_f000036|or che lo sapeva orfano anche di madre e bisognoso di conforto, tenne duro: o sí o no|or che lo sapeva orfano anche di madre e bisognoso di conforto, tenne duro: o sí o no
novelle08_10_pirandello_f000037|subito! Ebe accettò e in pochissimo tempo si fecero le nozze.|subito! Ebe accettò e in pochissimo tempo si fecero le nozze.
novelle08_10_pirandello_f000038|Fu una furia, una frenesia d’amore, che durò appena un anno. Ebe morí di parto.|Fu una furia, una frenesia damore, che durò appena un anno. Ebe morí di parto.
novelle08_10_pirandello_f000039|La sera stessa della sciagura, Corrado Tranzi, senza voler neanche vedere la bambina che|La sera stessa della sciagura, Corrado Tranzi, senza voler neanche vedere la bambina che
novelle08_10_pirandello_f000040|nascendo, aveva ucciso la madre, scappò via di casa come un pazzo; scomparve.|nascendo, aveva ucciso la madre, scappò via di casa come un pazzo; scomparve.
novelle08_10_pirandello_f000041|Si venne poi a sapere che, incontrato per caso un giovane collega|Si venne poi a sapere che, incontrato per caso un giovane collega
novelle08_10_pirandello_f000042|il quale quella sera stessa doveva imbarcarsi come medico di bordo su un transatlantico|il quale quella sera stessa doveva imbarcarsi come medico di bordo su un transatlantico
novelle08_10_pirandello_f000043|ne aveva preso il posto col piacere di lui, ed era rimasto in America, senza lasciar tracce di sé.|ne aveva preso il posto col piacere di lui, ed era rimasto in America, senza lasciar tracce di sé.
novelle08_10_pirandello_f000044|La bambina, orfana di madre e abbandonata cosí dal padre, crebbe in casa dei nonni, che la chiamarono Ebe come la loro figliuola.|La bambina, orfana di madre e abbandonata cosí dal padre, crebbe in casa dei nonni, che la chiamarono Ebe come la loro figliuola.
novelle08_10_pirandello_f000045|E sembrò ad essi che veramente la loro Ebe ricominciasse a vivere in quella bimba, dapprima tra le loro braccia|E sembrò ad essi che veramente la loro Ebe ricominciasse a vivere in quella bimba, dapprima tra le loro braccia
novelle08_10_pirandello_f000046|custodita con l’anima e col fiato, poi tra le loro cure piene di palpiti e di sgomenti.|custodita con lanima e col fiato, poi tra le loro cure piene di palpiti e di sgomenti.
novelle08_10_pirandello_f000047|A mano a mano, crescendo, Bebè somigliò sempre più alla mamma: ne ripeté tutte le grazie infantili, le mosse, i sorrisi|A mano a mano, crescendo, Bebè somigliò sempre più alla mamma: ne ripeté tutte le grazie infantili, le mosse, i sorrisi
novelle08_10_pirandello_f000048|i primi giuochi, tra lo stupore accorato de’ due vecchi che credevano d’assistere a una prodigiosa resurrezione.|i primi giuochi, tra lo stupore accorato de due vecchi che credevano dassistere a una prodigiosa resurrezione.
novelle08_10_pirandello_f000049|Il nipote, Marco Perla, nel vederla anche lui crescere cosí simile in tutto alla cuginetta ch’egli avrebbe voluto far sua|Il nipote, Marco Perla, nel vederla anche lui crescere cosí simile in tutto alla cuginetta chegli avrebbe voluto far sua
