novelle08_12_pirandello_f000146|— Creda che le merita… — Tienla qua, — troncò il dottore, rimettendo in tasca il portafogli.|- Creda che le merita - Tienla qua, - troncò il dottore, rimettendo in tasca il portafogli.
novelle08_12_pirandello_f000147|— Se viene la serva, non gliela dare. Verrò a prenderla io. E uscí dalla pagoda; scese per il viale; svoltò;|- Se viene la serva, non gliela dare. Verrò a prenderla io. E uscí dalla pagoda; scese per il viale; svoltò;
novelle08_12_pirandello_f000148|appena si vide solo, nascosto, si fermò|appena si vide solo, nascosto, si fermò
novelle08_12_pirandello_f000149|strinse le pugna e contrasse tutto il volto in uno spasimo di riso:|strinse le pugna e contrasse tutto il volto in uno spasimo di riso:
novelle08_12_pirandello_f000150|— Gliel’ho pagata io… Che doveva fare adesso?|- Glielho pagata io Che doveva fare adesso?
novelle08_12_pirandello_f000151|Prendere la moglie, senza farle male, e ricondurla alla casa del padre: ecco, sí|Prendere la moglie, senza farle male, e ricondurla alla casa del padre: ecco, sí
novelle08_12_pirandello_f000152|questo si meritava! E che andasse a piangere lontano quel suo ragazzo morto|questo si meritava! E che andasse a piangere lontano quel suo ragazzo morto
novelle08_12_pirandello_f000153|senza rubar cosí l’amore d’un galantuomo, ch’ella aveva, se non altro, il dovere di rispettare. Né amore, né rispetto?|senza rubar cosí lamore dun galantuomo, chella aveva, se non altro, il dovere di rispettare. Né amore, né rispetto?
novelle08_12_pirandello_f000154|Ah, ella aveva rifiutato i giovani e s’era preso uno, per lei vecchio, perché costui l’amore, via!|Ah, ella aveva rifiutato i giovani e sera preso uno, per lei vecchio, perché costui lamore, via!
novelle08_12_pirandello_f000155|non si sarebbe neppur sognato di pretenderlo, coi capelli già grigi, con la barba già brizzolata;|non si sarebbe neppur sognato di pretenderlo, coi capelli già grigi, con la barba già brizzolata;
novelle08_12_pirandello_f000156|ma avrebbe anche chiuso un occhio, e anche tutti e due, su la sua pena antica;|ma avrebbe anche chiuso un occhio, e anche tutti e due, su la sua pena antica;
novelle08_12_pirandello_f000157|non si sarebbe avuto a male di nulla, il vecchio! Però di soppiatto gliela mandava|non si sarebbe avuto a male di nulla, il vecchio! Però di soppiatto gliela mandava
novelle08_12_pirandello_f000158|la corona! Meno male! Eh già, moglie d’un altro, non aveva stimato conveniente andar lei, di persona.|la corona! Meno male! Eh già, moglie dun altro, non aveva stimato conveniente andar lei, di persona.
novelle08_12_pirandello_f000159|Per quanto vecchio il marito, via, sarebbe stato un po’ troppo!|Per quanto vecchio il marito, via, sarebbe stato un po troppo!
novelle08_12_pirandello_f000160|Aveva mandato la serva a ordinar la corona, in prova del costante amore;|Aveva mandato la serva a ordinar la corona, in prova del costante amore;
novelle08_12_pirandello_f000161|e la avrebbe fatta appendere dalla serva alla tomba di quel suo povero amore.|e la avrebbe fatta appendere dalla serva alla tomba di quel suo povero amore.
novelle08_12_pirandello_f000162|Ah, com’era stata ingiusta veramente la morte di quel ragazzo!|Ah, comera stata ingiusta veramente la morte di quel ragazzo!
novelle08_12_pirandello_f000163|Se fosse vissuto, quel ragazzo, se avesse avuto il tempo di divenire uomo|Se fosse vissuto, quel ragazzo, se avesse avuto il tempo di divenire uomo
novelle08_12_pirandello_f000164|di divenire esperto e istrutto anche lui di tutte le sagge perfidie della vita,|di divenire esperto e istrutto anche lui di tutte le sagge perfidie della vita,
novelle08_12_pirandello_f000165|e la avesse sposata lui, la sua cara fanciulla innamorata;|e la avesse sposata lui, la sua cara fanciulla innamorata;
novelle08_12_pirandello_f000166|si sarebbe accorta bene costei, che altro è fare all’amore dalla finestra,|si sarebbe accorta bene costei, che altro è fare allamore dalla finestra,
novelle08_12_pirandello_f000167|a diciott’anni, altro è vivere nella dura realtà quotidiana|a diciottanni, altro è vivere nella dura realtà quotidiana
novelle08_12_pirandello_f000168|quando già le prime fiamme si sono ammorzate e comincia il tedio dei giorni uguali, e la stanchezza, e nascono i primi dissapori|quando già le prime fiamme si sono ammorzate e comincia il tedio dei giorni uguali, e la stanchezza, e nascono i primi dissapori
novelle08_12_pirandello_f000169|e il giovane marito comincia a esser sazio e stufo della moglie e pensa già di tradirla…|e il giovane marito comincia a esser sazio e stufo della moglie e pensa già di tradirla
novelle08_12_pirandello_f000170|Ah, come avrebbe desiderato ch’ella avesse potuto fare per qualche tempo|Ah, come avrebbe desiderato chella avesse potuto fare per qualche tempo
novelle08_12_pirandello_f000171|con quel ragazzo là, una siffatta esperienza! Allora sí, questo vecchio…|con quel ragazzo là, una siffatta esperienza! Allora sí, questo vecchio
novelle08_12_pirandello_f000172|Serrò più volte le pugna fino ad affondarsi le unghie nelle palme;|Serrò più volte le pugna fino ad affondarsi le unghie nelle palme;
novelle08_12_pirandello_f000173|poi si guardò le mani che gli tremolavano, e alla fine si riscosse traendo un lungo sospiro.|poi si guardò le mani che gli tremolavano, e alla fine si riscosse traendo un lungo sospiro.
novelle08_12_pirandello_f000174|L’impeto della prima impressione era caduto.|Limpeto della prima impressione era caduto.
novelle08_12_pirandello_f000175|Stette un pezzo a guardare innanzi a sé, vide poco discosto un sediletto e andò a sedervisi meccanicamente.|Stette un pezzo a guardare innanzi a sé, vide poco discosto un sediletto e andò a sedervisi meccanicamente.
novelle08_12_pirandello_f000176|Ebbene, e questo vecchio, – seguitò a pensare,|Ebbene, e questo vecchio, - seguitò a pensare,
novelle08_12_pirandello_f000177|– non intendeva forse di regolarsi anche lui come un ragazzaccio? fare una scenata? uno scandalo?|- non intendeva forse di regolarsi anche lui come un ragazzaccio? fare una scenata? uno scandalo?
novelle08_12_pirandello_f000178|Oh, allora tutti quelli che avevano indovinato cosí facilmente la ragione per cui egli era stato subito accolto:|Oh, allora tutti quelli che avevano indovinato cosí facilmente la ragione per cui egli era stato subito accolto:
novelle08_12_pirandello_f000179|— Uno scandalo? — avrebbero esclamato.|- Uno scandalo? - avrebbero esclamato.
novelle08_12_pirandello_f000180|— Eh, via, in fin dei conti perché? Per una corona da morto…|- Eh, via, in fin dei conti perché? Per una corona da morto
novelle08_12_pirandello_f000181|Certo ogni anno la poverina, per il giorno dodici, aveva mandato una corona al camposanto.|Certo ogni anno la poverina, per il giorno dodici, aveva mandato una corona al camposanto.
novelle08_12_pirandello_f000182|Il nuovo giardiniere non lo sapeva.|Il nuovo giardiniere non lo sapeva.
novelle08_12_pirandello_f000183|Quell’anno, anche quell’anno ella, naturalmente, se n’era ricordata… Naturalmente|Quellanno, anche quellanno ella, naturalmente, se nera ricordata Naturalmente
novelle08_12_pirandello_f000184|sí, perché il povero dottore, via, non aveva potuto farglielo dimenticare.|sí, perché il povero dottore, via, non aveva potuto farglielo dimenticare.
novelle08_12_pirandello_f000185|Se n’era ricordata, e non aveva saputo resistere alla tentazione.|Se nera ricordata, e non aveva saputo resistere alla tentazione.
novelle08_12_pirandello_f000186|Certo, oh, certo aveva fatto male… Ma il sentimento non ragiona! Si trattava d’un morto, alla fin fine!|Certo, oh, certo aveva fatto male Ma il sentimento non ragiona! Si trattava dun morto, alla fin fine!
novelle08_12_pirandello_f000187|Cosí tutti avrebbero pensato. E allora che doveva far lui? Lasciar correre? fingere di non saper nulla?|Cosí tutti avrebbero pensato. E allora che doveva far lui? Lasciar correre? fingere di non saper nulla?
novelle08_12_pirandello_f000188|ritornar sú, dal giardiniere, a dirgli che desse alla serva quella corona, trattenuta lí perché gli servisse da prova?|ritornar sú, dal giardiniere, a dirgli che desse alla serva quella corona, trattenuta lí perché gli servisse da prova?
novelle08_12_pirandello_f000189|Ah, no, questo no! Avrebbe dovuto anche farsi restituire il danaro pagato, raccomandare a colui di star zitto… E allora?|Ah, no, questo no! Avrebbe dovuto anche farsi restituire il danaro pagato, raccomandare a colui di star zitto E allora?
novelle08_12_pirandello_f000190|andare a casa, a domandare inutili spiegazioni alla moglie?|andare a casa, a domandare inutili spiegazioni alla moglie?
novelle08_12_pirandello_f000191|rinfacciarle il sotterfugio, l’inganno, e punirla?|rinfacciarle il sotterfugio, linganno, e punirla?
novelle08_12_pirandello_f000192|Come sarebbe stato meschino! più meschino ancora che a far lo scandalo…|Come sarebbe stato meschino! più meschino ancora che a far lo scandalo
novelle08_12_pirandello_f000193|Era grave, il fatto, ma per il suo cuore che n’era rimasto ferito;|Era grave, il fatto, ma per il suo cuore che nera rimasto ferito;
novelle08_12_pirandello_f000194|grave anche per il ridicolo che gliene sarebbe potuto venire, se il caso si fosse risaputo|grave anche per il ridicolo che gliene sarebbe potuto venire, se il caso si fosse risaputo
novelle08_12_pirandello_f000195|perché provava il poco rispetto che sua moglie aveva per lui.|perché provava il poco rispetto che sua moglie aveva per lui.
novelle08_12_pirandello_f000196|Egli doveva vincere il proprio cuore, dirgli che aveva un bel sentirsi giovane, quando tutti lo credevano vecchio.|Egli doveva vincere il proprio cuore, dirgli che aveva un bel sentirsi giovane, quando tutti lo credevano vecchio.
novelle08_12_pirandello_f000197|Un giovanotto, sí, avrebbe potuto anche fare uno scandalo; lui, vecchio, no;|Un giovanotto, sí, avrebbe potuto anche fare uno scandalo; lui, vecchio, no;
novelle08_12_pirandello_f000198|doveva mostrarsi superiore, lui, e imporre altrimenti alla moglie il rispetto.|doveva mostrarsi superiore, lui, e imporre altrimenti alla moglie il rispetto.
novelle08_12_pirandello_f000199|Si alzò, con gran calma, ma con un senso d’indolenzimento in tutte le membra.|Si alzò, con gran calma, ma con un senso dindolenzimento in tutte le membra.
novelle08_12_pirandello_f000200|Gli uccelletti della villa seguitavano a cinguettare, festanti.|Gli uccelletti della villa seguitavano a cinguettare, festanti.
novelle08_12_pirandello_f000201|Dov’era più l’incanto di poco prima?|Dovera più lincanto di poco prima?
novelle08_12_pirandello_f000202|Il dottore lasciò la villa e s’avviò per ritornare a casa.|Il dottore lasciò la villa e savviò per ritornare a casa.
novelle08_12_pirandello_f000203|Quando giunse al portone, però, addio calma! Aveva un affanno da cavallo;|Quando giunse al portone, però, addio calma! Aveva un affanno da cavallo;
novelle08_12_pirandello_f000204|e non sapeva come avrebbe fatto a salir la scala, con quelle gambe che gli tremavano.|e non sapeva come avrebbe fatto a salir la scala, con quelle gambe che gli tremavano.
novelle08_12_pirandello_f000205|L’idea di riveder la moglie, adesso… Doveva esser più triste del solito, ella|Lidea di riveder la moglie, adesso Doveva esser più triste del solito, ella
novelle08_12_pirandello_f000206|in quel giorno… Ma forse avrebbe saputo dissimular bene la tristezza: era già abituata, rassegnata.|in quel giorno Ma forse avrebbe saputo dissimular bene la tristezza: era già abituata, rassegnata.
novelle08_12_pirandello_f000207|Ed egli la amava, oh miseria! la amava tanto, tanto… e sentiva, in fondo, ch’ella meritava d’essere amata;|Ed egli la amava, oh miseria! la amava tanto, tanto e sentiva, in fondo, chella meritava dessere amata;
novelle08_12_pirandello_f000208|sí, perché era buona anche, buona come appariva da quelle pure fattezze delicate|sí, perché era buona anche, buona come appariva da quelle pure fattezze delicate
novelle08_12_pirandello_f000209|da quei profondi occhi neri, vellutati, nel pallor bruno del volto. Venne ad aprirgli la serva.|da quei profondi occhi neri, vellutati, nel pallor bruno del volto. Venne ad aprirgli la serva.
novelle08_12_pirandello_f000210|La vista di costei lo sconcertò.|La vista di costei lo sconcertò.
novelle08_12_pirandello_f000211|Era a parte del segreto, quella vecchia, complice dell’inganno.|Era a parte del segreto, quella vecchia, complice dellinganno.
novelle08_12_pirandello_f000212|Stava da tanti anni a servizio nella casa paterna della moglie, era affezionatissima a questa; e forse non avrebbe parlato;|Stava da tanti anni a servizio nella casa paterna della moglie, era affezionatissima a questa; e forse non avrebbe parlato;
novelle08_12_pirandello_f000213|certo però non avrebbe saputo apprezzare né fors’anche comprendere ciò che egli aveva già divisato di fare.|certo però non avrebbe saputo apprezzare né forsanche comprendere ciò che egli aveva già divisato di fare.
novelle08_12_pirandello_f000214|Sarebbe stata a ogni modo una testimonia volgare.|Sarebbe stata a ogni modo una testimonia volgare.
novelle08_12_pirandello_f000215|Ed egli voleva che quanto stava per fare rimanesse segreto tra lui e la moglie.|Ed egli voleva che quanto stava per fare rimanesse segreto tra lui e la moglie.
novelle08_12_pirandello_f000216|Entrò diviato alla camera di lei.|Entrò diviato alla camera di lei.
novelle08_12_pirandello_f000217|La moglie era davanti la specchiera a pettinarsi.|La moglie era davanti la specchiera a pettinarsi.
novelle08_12_pirandello_f000218|Di tra le braccia alzate sul capo, le scorse nello specchio il volto|Di tra le braccia alzate sul capo, le scorse nello specchio il volto
novelle08_12_pirandello_f000219|incontrò lo sguardo di lei, che esprimeva sorpresa di vederlo in casa a quell’ora insolita.|incontrò lo sguardo di lei, che esprimeva sorpresa di vederlo in casa a quellora insolita.
novelle08_12_pirandello_f000220|— Sono ritornato, — disse, — per invitarti a uscire con me. — Ora?|- Sono ritornato, - disse, - per invitarti a uscire con me. - Ora?
novelle08_12_pirandello_f000221|— domandò lei, voltandosi, senz’abbassare le braccia che reggevano sul capo il volume dei bellissimi capelli neri,|- domandò lei, voltandosi, senzabbassare le braccia che reggevano sul capo il volume dei bellissimi capelli neri,
novelle08_12_pirandello_f000222|ancora sciolti; e gli sorrise languidamente.|ancora sciolti; e gli sorrise languidamente.
novelle08_12_pirandello_f000223|Egli si turbò, quasi fino alle lagrime a quel pallido sorriso, come se vi avesse scorto una profonda pietà di lui|Egli si turbò, quasi fino alle lagrime a quel pallido sorriso, come se vi avesse scorto una profonda pietà di lui
novelle08_12_pirandello_f000224|dell’amore che le portava, del dolore ch’ella ancora non indovinava, ma che tra poco avrebbe saputo. — Sí, ora, — rispose.|dellamore che le portava, del dolore chella ancora non indovinava, ma che tra poco avrebbe saputo. - Sí, ora, - rispose.
novelle08_12_pirandello_f000225|— È tanto bello, fuori… Sbrígati.|- È tanto bello, fuori Sbrígati.
novelle08_12_pirandello_f000226|Andremo alla villetta, anche più lontano, in campagna… Prenderemo una vettura… — Perché?|Andremo alla villetta, anche più lontano, in campagna Prenderemo una vettura - Perché?
novelle08_12_pirandello_f000227|— domandò lei, quasi senza volerlo. — Giusto oggi?|- domandò lei, quasi senza volerlo. - Giusto oggi?
novelle08_12_pirandello_f000228|Egli temette, a questa domanda, che lo sguardo lo tradisse.|Egli temette, a questa domanda, che lo sguardo lo tradisse.
novelle08_12_pirandello_f000229|Stentava già tanto a mantenere calma la voce. — Non ti andrebbe, oggi? — disse.|Stentava già tanto a mantenere calma la voce. - Non ti andrebbe, oggi? - disse.
novelle08_12_pirandello_f000230|— Ma ti farà bene, vedrai. Sbrígati, sbrígati. Voglio cosí.|- Ma ti farà bene, vedrai. Sbrígati, sbrígati. Voglio cosí.
novelle08_12_pirandello_f000231|Si mosse per uscire dalla camera.|Si mosse per uscire dalla camera.
novelle08_12_pirandello_f000232|Sulla soglia si voltò: — T’aspetto nello studio. Poco dopo, ella era pronta.|Sulla soglia si voltò: - Taspetto nello studio. Poco dopo, ella era pronta.
novelle08_12_pirandello_f000233|Ah, per questo, lo ubbidiva sempre, buona buona;|Ah, per questo, lo ubbidiva sempre, buona buona;
novelle08_12_pirandello_f000234|faceva sempre ciò che egli voleva e com’egli voleva: soltanto sul cuore di lei, eh, lí no, egli non aveva alcun potere.|faceva sempre ciò che egli voleva e comegli voleva: soltanto sul cuore di lei, eh, lí no, egli non aveva alcun potere.
novelle08_12_pirandello_f000235|Una timida opposizione aveva tentato appena: — Giusto oggi?|Una timida opposizione aveva tentato appena: - Giusto oggi?
novelle08_12_pirandello_f000236|— ma pure, ecco, con tutta l’angoscia che in quel giorno doveva aver dentro|- ma pure, ecco, con tutta langoscia che in quel giorno doveva aver dentro
novelle08_12_pirandello_f000237|aveva ubbidito, era pronta ad andare a passeggio, in campagna, dove lui voleva. Uscirono;|aveva ubbidito, era pronta ad andare a passeggio, in campagna, dove lui voleva. Uscirono;
novelle08_12_pirandello_f000238|attraversarono per un tratto a piedi il paese, poi egli prese a nolo una vettura|attraversarono per un tratto a piedi il paese, poi egli prese a nolo una vettura
novelle08_12_pirandello_f000239|e ordinò al vetturino di fermarsi davanti la villetta comunale.|e ordinò al vetturino di fermarsi davanti la villetta comunale.
novelle08_12_pirandello_f000240|Qua, smontò lui solo, pregando la moglie d’attenderlo un poco.|Qua, smontò lui solo, pregando la moglie dattenderlo un poco.
novelle08_12_pirandello_f000241|Quando, dopo circa un quarto d’ora, ella, già turbata e costernata, lo vide ridiscendere dalla villetta|Quando, dopo circa un quarto dora, ella, già turbata e costernata, lo vide ridiscendere dalla villetta
novelle08_12_pirandello_f000242|seguito dal giardiniere che reggeva su le braccia la corona, fu per mancare.|seguito dal giardiniere che reggeva su le braccia la corona, fu per mancare.
novelle08_12_pirandello_f000243|Ma egli la sostenne con lo sguardo.|Ma egli la sostenne con lo sguardo.
novelle08_12_pirandello_f000244|— Al camposanto! — ordinò al vetturino, rimontando subito in carrozza.|- Al camposanto! - ordinò al vetturino, rimontando subito in carrozza.
novelle08_12_pirandello_f000245|Appena questa si mosse, ella ruppe in un pianto irrefrenabile, recandosi il fazzoletto sugli occhi e sulla bocca.|Appena questa si mosse, ella ruppe in un pianto irrefrenabile, recandosi il fazzoletto sugli occhi e sulla bocca.
novelle08_12_pirandello_f000246|— Non piangere, — diss’egli allora, piano.|- Non piangere, - dissegli allora, piano.
novelle08_12_pirandello_f000247|— Non ho voluto dirti nulla a casa;|- Non ho voluto dirti nulla a casa;
novelle08_12_pirandello_f000248|non vorrei dirti nulla neanche adesso. Ti prego, non piangere. L’ho saputo per caso.|non vorrei dirti nulla neanche adesso. Ti prego, non piangere. Lho saputo per caso.
novelle08_12_pirandello_f000249|M’ero recato là alla villetta a passeggiare;|Mero recato là alla villetta a passeggiare;
novelle08_12_pirandello_f000250|e il giardiniere me l’ha detto, credendo che l’avessi ordinata io, questa corona.|e il giardiniere me lha detto, credendo che lavessi ordinata io, questa corona.
novelle08_12_pirandello_f000251|Non piangere, sú! Andiamo a deporla insieme, vedi?|Non piangere, sú! Andiamo a deporla insieme, vedi?
novelle08_12_pirandello_f000252|Ella stette con gli occhi nascosti nel fazzoletto, finché la vettura non si fermò davanti al cancello del camposanto.|Ella stette con gli occhi nascosti nel fazzoletto, finché la vettura non si fermò davanti al cancello del camposanto.
novelle08_12_pirandello_f000253|Egli la ajutò a scendere, poi prese la corona ed entrò con lei nel recinto. — Sai, dov’è?|Egli la ajutò a scendere, poi prese la corona ed entrò con lei nel recinto. - Sai, dovè?
novelle08_12_pirandello_f000254|Ella fe’ cenno di no, col capo.|Ella fe cenno di no, col capo.
novelle08_12_pirandello_f000255|— Vieni! — diss’egli, incamminandosi per il primo viale a manca, e guardando a una a una tutte le tombe, che vi erano allineate.|- Vieni! - dissegli, incamminandosi per il primo viale a manca, e guardando a una a una tutte le tombe, che vi erano allineate.
novelle08_12_pirandello_f000256|Era la penultima di quel viale.|Era la penultima di quel viale.
novelle08_12_pirandello_f000257|Egli allora si scoprí il capo, depose la corona su la pietra tombale, si ritrasse pian piano e|Egli allora si scoprí il capo, depose la corona su la pietra tombale, si ritrasse pian piano e
novelle08_12_pirandello_f000258|senza farsi scorgere da lei, s’allontanò, come per darle tempo di recitare una preghiera.|senza farsi scorgere da lei, sallontanò, come per darle tempo di recitare una preghiera.
novelle08_12_pirandello_f000259|Ma ella restò lí, muta, senza poter nemmeno staccare il fazzoletto dagli occhi.|Ma ella restò lí, muta, senza poter nemmeno staccare il fazzoletto dagli occhi.
novelle08_12_pirandello_f000260|Non un pensiero, non una lagrima per il morto.|Non un pensiero, non una lagrima per il morto.
novelle08_12_pirandello_f000261|Come smarrita, si voltò a un tratto a cercare il marito, lo chiamò, come finora non l’aveva mai chiamato;|Come smarrita, si voltò a un tratto a cercare il marito, lo chiamò, come finora non laveva mai chiamato;
novelle08_12_pirandello_f000262|gli s’appese al braccio, convulsa: — Perdonami! Perdonami! Portami via!|gli sappese al braccio, convulsa: - Perdonami! Perdonami! Portami via!
novelle08_13_pirandello_f000001|Novelle per un anno di luigi pirandello|Novelle per un anno di luigi pirandello
novelle08_13_pirandello_f000002|JERI E OGGI|JERI E OGGI
novelle08_13_pirandello_f000003|La guerra era scoppiata da pochi giorni.|La guerra era scoppiata da pochi giorni.
novelle08_13_pirandello_f000004|Marino Lerna, volontario del primo corso accelerato di allievi ufficiali, avuta la nomina a sottotenente di fanteria|Marino Lerna, volontario del primo corso accelerato di allievi ufficiali, avuta la nomina a sottotenente di fanteria
novelle08_13_pirandello_f000005|dopo una licenza di otto giorni trascorsa in famiglia, partí per Macerata|dopo una licenza di otto giorni trascorsa in famiglia, partí per Macerata
novelle08_13_pirandello_f000006|ov’era il deposito del reggimento a cui era stato assegnato: il dodici. mo, brigata Casale.|overa il deposito del reggimento a cui era stato assegnato: il dodici. mo, brigata Casale.
novelle08_13_pirandello_f000007|Contava di passar lí qualche mese per l’istruzione delle reclute, prima d’esser mandato al fronte.|Contava di passar lí qualche mese per listruzione delle reclute, prima desser mandato al fronte.
novelle08_13_pirandello_f000008|Invece tre giorni dopo, mentre si trovava nel cortile della caserma, fu improvvisamente chiamato, non seppe da chi;|Invece tre giorni dopo, mentre si trovava nel cortile della caserma, fu improvvisamente chiamato, non seppe da chi;
novelle08_13_pirandello_f000009|e sú per le scale si trovò insieme con gli altri undici sottotenenti arrivati con lui a Macerata dai diversi plotoni.|e sú per le scale si trovò insieme con gli altri undici sottotenenti arrivati con lui a Macerata dai diversi plotoni.
novelle08_13_pirandello_f000010|— Ma dove? Perché? Sú, in sala. Dal colonnello.|- Ma dove? Perché? Sú, in sala. Dal colonnello.
novelle08_13_pirandello_f000011|Rigido sull’attenti, coi compagni, davanti una tavola massiccia|Rigido sullattenti, coi compagni, davanti una tavola massiccia
novelle08_13_pirandello_f000012|ingombra d’incartamenti, fin dalle prime parole di quel colonnello dei carabinieri|ingombra dincartamenti, fin dalle prime parole di quel colonnello dei carabinieri
novelle08_13_pirandello_f000013|che teneva in sostituzione il comando della caserma, comprese poco dopo che doveva esser giunto un ordine di partenza per loro.|che teneva in sostituzione il comando della caserma, comprese poco dopo che doveva esser giunto un ordine di partenza per loro.
novelle08_13_pirandello_f000014|Con gli occhi ancora abbagliati dal sole di giugno che splendeva giú nell’ampio cortile|Con gli occhi ancora abbagliati dal sole di giugno che splendeva giú nellampio cortile
novelle08_13_pirandello_f000015|non riuscí in prima a discernere, nel bujo di quella tetra sala|non riuscí in prima a discernere, nel bujo di quella tetra sala
novelle08_13_pirandello_f000016|se non l’argento della montura al collo della divisa del signor colonnello|se non largento della montura al collo della divisa del signor colonnello
novelle08_13_pirandello_f000017|il roseo d’una lunga faccia cavallina tagliato da un grosso paio di baffi, e il biancheggiar delle carte sulla tavola.|il roseo duna lunga faccia cavallina tagliato da un grosso paio di baffi, e il biancheggiar delle carte sulla tavola.
novelle08_13_pirandello_f000018|Per un tratto, smarrí nello scompiglio tumultuoso dei pensieri e dei sentimenti il senso delle parole proferite con voce dura e urtante.|Per un tratto, smarrí nello scompiglio tumultuoso dei pensieri e dei sentimenti il senso delle parole proferite con voce dura e urtante.
novelle08_13_pirandello_f000019|Si sforzò di prestar attenzione e, sissignori, era proprio cosí: l’ordine di partenza era per la sera del giorno appresso.|Si sforzò di prestar attenzione e, sissignori, era proprio cosí: lordine di partenza era per la sera del giorno appresso.
