novelle08_05_pirandello_f000127|Ma come dicono le campane di Raffadali? Dicono: Con che? con che? con che?|Ma come dicono le campane di Raffadali? Dicono: Con che? con che? con che?
novelle08_05_pirandello_f000128|Mi sono spogliato di tutto, e sono come Cristo alla colonna. Non posso più niente. Lo schietto idoneo, e basta.|Mi sono spogliato di tutto, e sono come Cristo alla colonna. Non posso più niente. Lo schietto idoneo, e basta.
novelle08_05_pirandello_f000129|Se venite voi, parenti della sposa, Pitrinu Cinquemani pretenderà che vengano anche i suoi parenti|Se venite voi, parenti della sposa, Pitrinu Cinquemani pretenderà che vengano anche i suoi parenti
novelle08_05_pirandello_f000130|che sono dalla parte di Tresa, lo sapete; e tra voi non c’è buon sangue.|che sono dalla parte di Tresa, lo sapete; e tra voi non cè buon sangue.
novelle08_05_pirandello_f000131|Cosí abbiamo stabilito che non venga nessuno, né essi né voi.|Cosí abbiamo stabilito che non venga nessuno, né essi né voi.
novelle08_05_pirandello_f000132|Saremo io e Tresa per la sposa e il padre e la madre dello sposo. Lo schietto idoneo, e basta.|Saremo io e Tresa per la sposa e il padre e la madre dello sposo. Lo schietto idoneo, e basta.
novelle08_05_pirandello_f000133|Saru ascoltò, con gli occhi bassi anche lui, e la mano sul mento, il discorso del padre, evidentemente studiato;|Saru ascoltò, con gli occhi bassi anche lui, e la mano sul mento, il discorso del padre, evidentemente studiato;
novelle08_05_pirandello_f000134|alla fine disse: — Pa’, badiamo bene. Voi siete il padrone;|alla fine disse: - Pa, badiamo bene. Voi siete il padrone;
novelle08_05_pirandello_f000135|siamo sangue vostro, e noi faremo come volete voi.|siamo sangue vostro, e noi faremo come volete voi.
novelle08_05_pirandello_f000136|Ma non facciamo che la proibizione di venire debba essere soltanto per noi! Pa’, ve l’avverto: finirebbe male.|Ma non facciamo che la proibizione di venire debba essere soltanto per noi! Pa, ve lavverto: finirebbe male.
novelle08_05_pirandello_f000137|Il vecchio, senza alzar gli occhi, restò ancora un pezzo a raschiarsi le gote, aggrondato.|Il vecchio, senza alzar gli occhi, restò ancora un pezzo a raschiarsi le gote, aggrondato.
novelle08_05_pirandello_f000138|— Io per me, figli miei, ho fatto dire a quelli che non vengano, come dico a voi di non venire.|- Io per me, figli miei, ho fatto dire a quelli che non vengano, come dico a voi di non venire.
novelle08_05_pirandello_f000139|— E se qualcuno di quelli viene? Il vecchio non rispose.|- E se qualcuno di quelli viene? Il vecchio non rispose.
novelle08_05_pirandello_f000140|Il suo silenzio lasciava intendere chiaramente che,|Il suo silenzio lasciava intendere chiaramente che,
novelle08_05_pirandello_f000141|se qualcuno dell’altra parte fosse venuto, egli non avrebbe saputo come regolarsi.|se qualcuno dellaltra parte fosse venuto, egli non avrebbe saputo come regolarsi.
novelle08_05_pirandello_f000142|— Va bene, pa’, — disse allora Saru. — Andate, andate. Ci penseremo noi.|- Va bene, pa, - disse allora Saru. - Andate, andate. Ci penseremo noi.
novelle08_05_pirandello_f000143|E seguí con gli occhi il padre che se ne andava, stirandosi con due dita il lobo dell’orecchia manca.|E seguí con gli occhi il padre che se ne andava, stirandosi con due dita il lobo dellorecchia manca.
novelle08_05_pirandello_f000144|Rientrato nella roba, trasse dal fondo d’una bisaccia appesa a un chiodo un coltellaccio lungo, di quelli chiamati trincialardo;|Rientrato nella roba, trasse dal fondo duna bisaccia appesa a un chiodo un coltellaccio lungo, di quelli chiamati trincialardo;
novelle08_05_pirandello_f000145|prese da terra, sotto la tavola, la pietra d’affilare;|prese da terra, sotto la tavola, la pietra daffilare;
novelle08_05_pirandello_f000146|bagnò la lama del coltello: andò a sedere sulla soglia dell’uscio con quella pietra fra le ginocchia e si diede ad affilar la lama.|bagnò la lama del coltello: andò a sedere sulla soglia delluscio con quella pietra fra le ginocchia e si diede ad affilar la lama.
novelle08_05_pirandello_f000147|La moglie, spaventata, lo chiamò tre volte, senza ottener risposta;|La moglie, spaventata, lo chiamò tre volte, senza ottener risposta;
novelle08_05_pirandello_f000148|alla fine, con le mani nei capelli e gli occhi pieni di lagrime, scongiurò:|alla fine, con le mani nei capelli e gli occhi pieni di lagrime, scongiurò:
novelle08_05_pirandello_f000149|— Oh Madre santa, Saru mio, che pensi di fare?|- Oh Madre santa, Saru mio, che pensi di fare?
novelle08_05_pirandello_f000150|Saru balzò in piedi come un tigre, col coltello levato:|Saru balzò in piedi come un tigre, col coltello levato:
novelle08_05_pirandello_f000151|— Corpo di Dio, non fiatare, o comincio da te! La moglie allora|- Corpo di Dio, non fiatare, o comincio da te! La moglie allora
novelle08_05_pirandello_f000152|per soffocare il pianto, si tirò sul volto con le due mani il grembiule e andò a rintanarsi in un angolo.|per soffocare il pianto, si tirò sul volto con le due mani il grembiule e andò a rintanarsi in un angolo.
novelle08_05_pirandello_f000153|Saru si rimise ad affilar il coltellaccio sotto gli occhi dei tre figliuoli, seduti attorno, silenziosi.|Saru si rimise ad affilar il coltellaccio sotto gli occhi dei tre figliuoli, seduti attorno, silenziosi.
novelle08_05_pirandello_f000154|Dal cortile della chiusa della zâ Tresa cantò il gallo, e subito il gallo di qua gli rispose|Dal cortile della chiusa della za Tresa cantò il gallo, e subito il gallo di qua gli rispose
novelle08_05_pirandello_f000155|con una zampa levata, squassando la cresta sanguigna.|con una zampa levata, squassando la cresta sanguigna.
novelle08_05_pirandello_f000156|— Una… due… tre… quattro!… cinque!… sei!… Già sei mule bardate,|- Una due tre quattro! cinque! sei! Già sei mule bardate,
novelle08_05_pirandello_f000157|nella mangiatoja sotto il tettuccio del cortile della chiusa dirimpetto.|nella mangiatoja sotto il tettuccio del cortile della chiusa dirimpetto.
novelle08_05_pirandello_f000158|Eccole là: si discernevano bene al lume della luna, tutt’e sei, l’una accanto all’altra.|Eccole là: si discernevano bene al lume della luna, tutte sei, luna accanto allaltra.
novelle08_05_pirandello_f000159|Davanti all’uscio della sua roba, Saru le contava,|Davanti alluscio della sua roba, Saru le contava,
novelle08_05_pirandello_f000160|piegando il collo di qua e di là, per vedere di tra gli alberi, e fremeva.|piegando il collo di qua e di là, per vedere di tra gli alberi, e fremeva.
novelle08_05_pirandello_f000161|Già sei. E forse altre ne sarebbero venute.|Già sei. E forse altre ne sarebbero venute.
novelle08_05_pirandello_f000162|Il festino voleva esser grande.|Il festino voleva esser grande.
novelle08_05_pirandello_f000163|Tutti i figliuoli della matrigna e le loro donne e i loro figliuoli,|Tutti i figliuoli della matrigna e le loro donne e i loro figliuoli,
novelle08_05_pirandello_f000164|tutti, tutti quelli dell’altra parte erano stati invitati.|tutti, tutti quelli dellaltra parte erano stati invitati.
novelle08_05_pirandello_f000165|Loro soli, i parenti più stretti, i fratelli e la sorella della sposa, erano esclusi.|Loro soli, i parenti più stretti, i fratelli e la sorella della sposa, erano esclusi.
novelle08_05_pirandello_f000166|Forse adesso banchettavano di là, più tardi sarebbero cominciati il suono e i balli.|Forse adesso banchettavano di là, più tardi sarebbero cominciati il suono e i balli.
novelle08_05_pirandello_f000167|S’era tolta la giacca e se l’era messa al braccio per nascondere il coltello affilato.|Sera tolta la giacca e se lera messa al braccio per nascondere il coltello affilato.
novelle08_05_pirandello_f000168|Dall’interno della roba, la moglie e Niluzzu, il maggiore dei figliuoli, stavano a spiarlo, intenti e tremanti.|Dallinterno della roba, la moglie e Niluzzu, il maggiore dei figliuoli, stavano a spiarlo, intenti e tremanti.
novelle08_05_pirandello_f000169|Poc’anzi, aveva ordinato alla moglie di accendere il fuoco e di metter sú il caldajo grosso a bollire.|Pocanzi, aveva ordinato alla moglie di accendere il fuoco e di metter sú il caldajo grosso a bollire.
novelle08_05_pirandello_f000170|E la moglie, imbalordita dallo sgomento, aveva ubbidito, senza capire che volesse fare di quel caldajo d’acqua bollente.|E la moglie, imbalordita dallo sgomento, aveva ubbidito, senza capire che volesse fare di quel caldajo dacqua bollente.
novelle08_05_pirandello_f000171|— Oh Madre santa, — pregava ora, — fate venire qualcuno! Oh Madre santa, quietategli il sangue e la mente.|- Oh Madre santa, - pregava ora, - fate venire qualcuno! Oh Madre santa, quietategli il sangue e la mente.
novelle08_05_pirandello_f000172|Fuori nell’aria chiara di luna, eran zighi sommessi di grilli,|Fuori nellaria chiara di luna, eran zighi sommessi di grilli,
novelle08_05_pirandello_f000173|fili di suono lunghi, acuti, quasi luminosi.|fili di suono lunghi, acuti, quasi luminosi.
novelle08_05_pirandello_f000174|— Niluzzu, — chiamò a un tratto il padre.|- Niluzzu, - chiamò a un tratto il padre.
novelle08_05_pirandello_f000175|— Corri da tua zia Sidora qua presso;|- Corri da tua zia Sidora qua presso;
novelle08_05_pirandello_f000176|poi da tuo zio Luzzu, e di’ loro che vengano qua da me, subito:|poi da tuo zio Luzzu, e di loro che vengano qua da me, subito:
novelle08_05_pirandello_f000177|marito, moglie, figliuoli, tutti qua da me. Hai capito? Va’.|marito, moglie, figliuoli, tutti qua da me. Hai capito? Va.
novelle08_05_pirandello_f000178|Niluzzu, invece di muoversi, rimase a mirare il padre, sbigottito|Niluzzu, invece di muoversi, rimase a mirare il padre, sbigottito
novelle08_05_pirandello_f000179|con un braccio levato a riparo della testa, come se si aspettasse uno scapaccione.|con un braccio levato a riparo della testa, come se si aspettasse uno scapaccione.
novelle08_05_pirandello_f000180|— Pa’, ho paura, pa’… — Paura?|- Pa, ho paura, pa - Paura?
novelle08_05_pirandello_f000181|Carognone! — gli gridò il padre, scrollandolo.|Carognone! - gli gridò il padre, scrollandolo.
novelle08_05_pirandello_f000182|Si rivolse alla moglie: — Va’ anche tu;|Si rivolse alla moglie: - Va anche tu;
novelle08_05_pirandello_f000183|accompagnalo! E tornate qua presto, tutti insieme! La moglie s’arrischiò a chiedergli ancora una volta|accompagnalo! E tornate qua presto, tutti insieme! La moglie sarrischiò a chiedergli ancora una volta
novelle08_05_pirandello_f000184|con voce di pianto: — Ma tu che vuoi fare, Saru mio?|con voce di pianto: - Ma tu che vuoi fare, Saru mio?
novelle08_05_pirandello_f000185|Per carità! Saru si pose un dito sulla bocca e poi, con la stessa mano, fe’ cenno imperioso alla moglie d’ubbidire.|Per carità! Saru si pose un dito sulla bocca e poi, con la stessa mano, fe cenno imperioso alla moglie dubbidire.
novelle08_05_pirandello_f000186|Poco dopo si mosse anche lui, cauto, verso il cortile della chiusa dirimpetto|Poco dopo si mosse anche lui, cauto, verso il cortile della chiusa dirimpetto
novelle08_05_pirandello_f000187|facendosi riparo, nel procedere sotto la luna, ora di questo, ora di quell’albero.|facendosi riparo, nel procedere sotto la luna, ora di questo, ora di quellalbero.
novelle08_05_pirandello_f000188|Giunse cosí all’ultimo alberetto di fico, proprio davanti il cortile.|Giunse cosí allultimo alberetto di fico, proprio davanti il cortile.
novelle08_05_pirandello_f000189|Il cuore gli ballava in petto e le tempie gli martellavano.|Il cuore gli ballava in petto e le tempie gli martellavano.
novelle08_05_pirandello_f000190|Diede un balzo allo sbruffare d’una delle mule nella mangiatoja vicinissima.|Diede un balzo allo sbruffare duna delle mule nella mangiatoja vicinissima.
novelle08_05_pirandello_f000191|Gli arrivava alle narici il lezzo caldo e grasso del letame, e agli orecchi il suono confuso delle grida|Gli arrivava alle narici il lezzo caldo e grasso del letame, e agli orecchi il suono confuso delle grida
novelle08_05_pirandello_f000192|delle risa, e l’acciottolío dei piatti dei banchettanti dentro la roba della matrigna.|delle risa, e lacciottolío dei piatti dei banchettanti dentro la roba della matrigna.
novelle08_05_pirandello_f000193|Sporse il capo oltre i rami del fico, a spiare.|Sporse il capo oltre i rami del fico, a spiare.
novelle08_05_pirandello_f000194|Nel cortile non c’era nessuno, oltre le sei cavalcature ancora bardate,|Nel cortile non cera nessuno, oltre le sei cavalcature ancora bardate,
novelle08_05_pirandello_f000195|e più là, presso l’entrata della roba, la troja gigantesca.|e più là, presso lentrata della roba, la troja gigantesca.
novelle08_05_pirandello_f000196|Questa se ne stava col grifo allungato su le zampe anteriori, le orecchie abbattute e gli occhi socchiusi|Questa se ne stava col grifo allungato su le zampe anteriori, le orecchie abbattute e gli occhi socchiusi
novelle08_05_pirandello_f000197|come in una languida contemplazione del fresco, dolcissimo chiaro di luna. Di tratto in tratto sospirava;|come in una languida contemplazione del fresco, dolcissimo chiaro di luna. Di tratto in tratto sospirava;
novelle08_05_pirandello_f000198|ma era sospiro di soddisfazione per la sua sicura plenitudine beata.|ma era sospiro di soddisfazione per la sua sicura plenitudine beata.
novelle08_05_pirandello_f000199|Saru le andò dietro, cheto e chinato;|Saru le andò dietro, cheto e chinato;
novelle08_05_pirandello_f000200|le allungò adagio adagio una mano alla fronte e lievemente si mise a grattargliela.|le allungò adagio adagio una mano alla fronte e lievemente si mise a grattargliela.
novelle08_05_pirandello_f000201|Come la bestia, al solletico, si stirò, torcendo il grifo, quasi volesse sorridere alla consueta carezza della padrona|Come la bestia, al solletico, si stirò, torcendo il grifo, quasi volesse sorridere alla consueta carezza della padrona
novelle08_05_pirandello_f000202|e alla fine presentò da sé la gola, Saru, pronto, con l’altra mano le affondò il coltello fino al cuore.|e alla fine presentò da sé la gola, Saru, pronto, con laltra mano le affondò il coltello fino al cuore.
novelle08_05_pirandello_f000203|Ritornò con l’enorme carico alla roba, quasi a un tempo con la moglie e il figliuolo, seguiti da tutto il parentado in allarme.|Ritornò con lenorme carico alla roba, quasi a un tempo con la moglie e il figliuolo, seguiti da tutto il parentado in allarme.
novelle08_05_pirandello_f000204|— Zitti, per la Madonna! — intimò a tutti, liberandosi del carico con un gran respiro, ansante e insanguinato da capo a piedi.|- Zitti, per la Madonna! - intimò a tutti, liberandosi del carico con un gran respiro, ansante e insanguinato da capo a piedi.
novelle08_05_pirandello_f000205|— Faremo festa anche noi, qua, meglio di loro! Un quarto per uno a voi, e due quarti a me|- Faremo festa anche noi, qua, meglio di loro! Un quarto per uno a voi, e due quarti a me
novelle08_05_pirandello_f000206|che me li merito! Ma prima aspettate! Qua, qua, ajutatemi a sparar la bestia! Luzzu, tieni fermo qua! Tu, Sidora, di qua.|che me li merito! Ma prima aspettate! Qua, qua, ajutatemi a sparar la bestia! Luzzu, tieni fermo qua! Tu, Sidora, di qua.
novelle08_05_pirandello_f000207|E tu, Niluzzu, piglia il piatto grande, quello tondo, dallo stipo! Il fegato|E tu, Niluzzu, piglia il piatto grande, quello tondo, dallo stipo! Il fegato
novelle08_05_pirandello_f000208|il fegato lo voglio dare alla vecchia! Zitti tutti! Il fegato alla vecchia! Sparò per lungo la bestia;|il fegato lo voglio dare alla vecchia! Zitti tutti! Il fegato alla vecchia! Sparò per lungo la bestia;
novelle08_05_pirandello_f000209|ne trasse il fegato e corse a lavarlo in una conca, poi lo compose|ne trasse il fegato e corse a lavarlo in una conca, poi lo compose
novelle08_05_pirandello_f000210|lucido compatto tremolante, nel piatto e lo porse al figliuolo: — Va’ da tuo nonno|lucido compatto tremolante, nel piatto e lo porse al figliuolo: - Va da tuo nonno
novelle08_05_pirandello_f000211|Niluzzu, e digli cosí: Mi manda papà Saru, con questo regalo per Mamma Tresa, e con la preghiera che gli saluti la troja!|Niluzzu, e digli cosí: Mi manda papà Saru, con questo regalo per Mamma Tresa, e con la preghiera che gli saluti la troja!
novelle08_06_pirandello_f000001|Novelle per un anno di luigi pirandello|Novelle per un anno di luigi pirandello
novelle08_06_pirandello_f000002|BENEDIZIONE|BENEDIZIONE
novelle08_06_pirandello_f000003|— Io non so com’è la gente! — soleva ripetere don Marchino per lo meno una ventina di volte al giorno|- Io non so comè la gente! - soleva ripetere don Marchino per lo meno una ventina di volte al giorno
novelle08_06_pirandello_f000004|insaccandosi nelle spalle e aprendo le mani a ventaglio davanti al petto|insaccandosi nelle spalle e aprendo le mani a ventaglio davanti al petto
novelle08_06_pirandello_f000005|con gli angoli della bocca contratti in giú: — Io non so com’è la gente!|con gli angoli della bocca contratti in giú: - Io non so comè la gente!
novelle08_06_pirandello_f000006|Perché la gente in tanti e tanti casi non si regolava com’egli si sarebbe regolato;|Perché la gente in tanti e tanti casi non si regolava comegli si sarebbe regolato;
novelle08_06_pirandello_f000007|o anche perché la gente spessissimo trovava da ridire su tutto ciò che faceva lui e che a lui pareva ben fatto.|o anche perché la gente spessissimo trovava da ridire su tutto ciò che faceva lui e che a lui pareva ben fatto.
novelle08_06_pirandello_f000008|Ma, santo cielo, per qual mai ragione fin da principio lo avevano veduto cosí male a Stravignano, i suoi parrocchiani?|Ma, santo cielo, per qual mai ragione fin da principio lo avevano veduto cosí male a Stravignano, i suoi parrocchiani?
novelle08_06_pirandello_f000009|Non gli perdonavano d’aver ridotto a podere (col beneplacito dei superiori|Non gli perdonavano daver ridotto a podere col beneplacito dei superiori
novelle08_06_pirandello_f000010|s’intende!) il querceto che prima sorgeva dietro la chiesetta a valle e prendeva tutto il beneficio della cura.|sintende! il querceto che prima sorgeva dietro la chiesetta a valle e prendeva tutto il beneficio della cura.
novelle08_06_pirandello_f000011|Eh, quel benedetto podere ancora non lo mandavano giú|Eh, quel benedetto podere ancora non lo mandavano giú
novelle08_06_pirandello_f000012|e neanche il quartierino di quattro stanze che aveva fatto fabbricare coi denari ricavati dalla vendita degli alberi|e neanche il quartierino di quattro stanze che aveva fatto fabbricare coi denari ricavati dalla vendita degli alberi
novelle08_06_pirandello_f000013|attaccato alla chiesetta, come di là era attaccata la casuccia a terreno per sé e per la sorella Marianna.|attaccato alla chiesetta, come di là era attaccata la casuccia a terreno per sé e per la sorella Marianna.
novelle08_06_pirandello_f000014|Ma con parte di quei denari non s’era fors’anche riattata la chiesetta?|Ma con parte di quei denari non sera forsanche riattata la chiesetta?
novelle08_06_pirandello_f000015|E che male c’era, se ogni anno d’estate affittava quel quartierino a qualche famiglia che veniva a villeggiare a Stravignano?|E che male cera, se ogni anno destate affittava quel quartierino a qualche famiglia che veniva a villeggiare a Stravignano?
novelle08_06_pirandello_f000016|Gli stravignanesi volevano per forza più povero di Santo Giobbe il loro curato.|Gli stravignanesi volevano per forza più povero di Santo Giobbe il loro curato.
novelle08_06_pirandello_f000017|E il bello era questo: che, da un canto, egli doveva essere il servitore di tutti;|E il bello era questo: che, da un canto, egli doveva essere il servitore di tutti;
novelle08_06_pirandello_f000018|ma guaj, dall’altro, se lo vedevano con la zappa in mano o badare alle bestie.|ma guaj, dallaltro, se lo vedevano con la zappa in mano o badare alle bestie.
novelle08_06_pirandello_f000019|Perché non si sporcasse la zimarra, eh?|Perché non si sporcasse la zimarra, eh?
novelle08_06_pirandello_f000020|perché non gli s’incallissero le mani che dovevano toccar l’Ostia Consacrata?|perché non gli sincallissero le mani che dovevano toccar lOstia Consacrata?
novelle08_06_pirandello_f000021|Ma la coscienza, la coscienza non doveva essere sporca o incallita;|Ma la coscienza, la coscienza non doveva essere sporca o incallita;
novelle08_06_pirandello_f000022|non le mani! Don Marchino aveva ragione, ma, se pur si vedeva, non s’accorgeva più che, tanto lui quanto la sorella Marianna|non le mani! Don Marchino aveva ragione, ma, se pur si vedeva, non saccorgeva più che, tanto lui quanto la sorella Marianna
novelle08_06_pirandello_f000023|avevano le gambe a modo delle papere, su le quali, andando, si dimenavano proprio come due papere;|avevano le gambe a modo delle papere, su le quali, andando, si dimenavano proprio come due papere;
novelle08_06_pirandello_f000024|tutt’e due della stessa statura, grassottelli e senza collo.|tutte due della stessa statura, grassottelli e senza collo.
novelle08_06_pirandello_f000025|Don Marchino non si sentiva parlare, o seppur si sentiva|Don Marchino non si sentiva parlare, o seppur si sentiva
novelle08_06_pirandello_f000026|non aveva l’impressione che la sua voce, oppressa dal naso sempre intasato, fosse miagolante.|non aveva limpressione che la sua voce, oppressa dal naso sempre intasato, fosse miagolante.
novelle08_06_pirandello_f000027|Ora l’antipatia che i suoi parrocchiani avevano per lui dipendeva anche, e non per poco, da queste cose|Ora lantipatia che i suoi parrocchiani avevano per lui dipendeva anche, e non per poco, da queste cose
novelle08_06_pirandello_f000028|di cui egli non si poteva render conto: la figura, la voce e anche il suo particolar modo di parlare.|di cui egli non si poteva render conto: la figura, la voce e anche il suo particolar modo di parlare.
novelle08_06_pirandello_f000029|Per esempio, gli andavano a chiedere in prestito la somara, in un caso d’urgenza|Per esempio, gli andavano a chiedere in prestito la somara, in un caso durgenza
novelle08_06_pirandello_f000030|come sarebbe di andare a chiamare a un bisogno di notte il medico a Nocera?|come sarebbe di andare a chiamare a un bisogno di notte il medico a Nocera?
novelle08_06_pirandello_f000031|Don Marchino rispondeva invariabilmente: — Non ti ci fa arrivare.|Don Marchino rispondeva invariabilmente: - Non ti ci fa arrivare.
novelle08_06_pirandello_f000032|Ti accadrà di romperti due o tre volte il collo, bello mio;|Ti accadrà di romperti due o tre volte il collo, bello mio;
novelle08_06_pirandello_f000033|mi contento di tre e non di più.|mi contento di tre e non di più.
novelle08_06_pirandello_f000034|Parlava cosí, ripetendo spesso di queste frasucce argute, che aveva sentito dire chi sa quando e da chi;|Parlava cosí, ripetendo spesso di queste frasucce argute, che aveva sentito dire chi sa quando e da chi;
novelle08_06_pirandello_f000035|ma le ripeteva ormai come se fossero un modo di dire naturale, senz’alcuna intenzione d’arguzia.|ma le ripeteva ormai come se fossero un modo di dire naturale, senzalcuna intenzione darguzia.
novelle08_06_pirandello_f000036|Quella somara poi era viziosa davvero: cosí viziosa che, a prestarla|Quella somara poi era viziosa davvero: cosí viziosa che, a prestarla
novelle08_06_pirandello_f000037|don Marchino credeva in coscienza di non potersi arrischiare a cuor leggero.|don Marchino credeva in coscienza di non potersi arrischiare a cuor leggero.
novelle08_06_pirandello_f000038|Se tante volte, santo cielo, essa non permetteva neanche a lui di far montare qualcuno sul biroccio|Se tante volte, santo cielo, essa non permetteva neanche a lui di far montare qualcuno sul biroccio
novelle08_06_pirandello_f000039|E per non farsi mordere o calciare|E per non farsi mordere o calciare
novelle08_06_pirandello_f000040|quando doveva sellarla o attaccarla|quando doveva sellarla o attaccarla
novelle08_06_pirandello_f000041|gli toccava usarle le maniere più garbate e dirle tante dolci paroline e ammonirla paternamente d’aver pazienza e rassegnazione|gli toccava usarle le maniere più garbate e dirle tante dolci paroline e ammonirla paternamente daver pazienza e rassegnazione
novelle08_06_pirandello_f000042|poiché Dio aveva voluto farla nascere somara.|poiché Dio aveva voluto farla nascere somara.
novelle08_06_pirandello_f000043|Ma sfido! — dicevano a Stravignano.|Ma sfido! - dicevano a Stravignano.
novelle08_06_pirandello_f000044|Quella somara, a cui attendeva quasi sempre don Marchino;|Quella somara, a cui attendeva quasi sempre don Marchino;
novelle08_06_pirandello_f000045|le galline e i tre majali, a cui attendeva sempre la sorella Marianna;|le galline e i tre majali, a cui attendeva sempre la sorella Marianna;
novelle08_06_pirandello_f000046|le due vacche, a cui attendeva Rosa, la serva scalza;|le due vacche, a cui attendeva Rosa, la serva scalza;
novelle08_06_pirandello_f000047|nel vedere in mezzo a loro quel padrone lí, e la sorella,|nel vedere in mezzo a loro quel padrone lí, e la sorella,
novelle08_06_pirandello_f000048|come due papere, dovevano sentire per forza una certa affinità bestiale con essi|come due papere, dovevano sentire per forza una certa affinità bestiale con essi
novelle08_06_pirandello_f000049|per cui si pigliavano confidenze che, certamente, con altri padroni non si sarebbero permesse.|per cui si pigliavano confidenze che, certamente, con altri padroni non si sarebbero permesse.
novelle08_06_pirandello_f000050|E ridevano tutti del poco rispetto che quelle bestie maleducate portavano al loro curato e alla sorella;|E ridevano tutti del poco rispetto che quelle bestie maleducate portavano al loro curato e alla sorella;
