grune_haus_09_f000030|Sein flacher Rücken ist mit Moos bewachsen. Man sagt, er sei ein Überbleibsel der alten Brücke, die vor viel hundert Jahren die Römer hier gebaut hatten,|Sein flacher Rücken ist mit Moos bewachsen. Man sagt, er sei ein Überbleibsel der alten Brücke, die vor viel hundert Jahren die Römer hier gebaut hatten,
grune_haus_09_f000031|und nennt ihn den Römerstein.|und nennt ihn den Römerstein.
grune_haus_09_f000032|Auf diesem Stein, eine Viertelstunde vor der Stadt, da, wo die hohen Berge dicht am Wasser stehn, saßen wir beide oft und spielten unsre wunderlichen Spiele.|Auf diesem Stein, eine Viertelstunde vor der Stadt, da, wo die hohen Berge dicht am Wasser stehn, saßen wir beide oft und spielten unsre wunderlichen Spiele.
grune_haus_09_f000033|Wir brachten die Schürze voll Blumen mit und warfen sie in den Fluß.|Wir brachten die Schürze voll Blumen mit und warfen sie in den Fluß.
grune_haus_09_f000034|Wenn sie richtig gebunden wären und der Nixe gefielen, würde sie sie herunterziehen und uns was Schönes dafür schenken,|Wenn sie richtig gebunden wären und der Nixe gefielen, würde sie sie herunterziehen und uns was Schönes dafür schenken,
grune_haus_09_f000035|oder sie würde uns eins von den Nixenliedern vorsingen, die so herrlich traurig klangen, daß man weinen mußte, wenn man sie zu hören bekam;|oder sie würde uns eins von den Nixenliedern vorsingen, die so herrlich traurig klangen, daß man weinen mußte, wenn man sie zu hören bekam;
grune_haus_09_f000036|und mit heißen Backen sahn wir den schwimmenden Blumen nach.|und mit heißen Backen sahn wir den schwimmenden Blumen nach.
grune_haus_09_f000037|Oder wir warfen Nüsse in die Nahe; die sollte der arme Wassermann haben, den niemand lieb hatte, und der so gern Nüsse aß.|Oder wir warfen Nüsse in die Nahe; die sollte der arme Wassermann haben, den niemand lieb hatte, und der so gern Nüsse aß.
grune_haus_09_f000038|Immer neue Dinge wußte die Tine und sagte alles so eindringlich und heilig, daß mir oft das Herz schlug, als wäre Weihnachtsabend und die Lichter sollten angesteckt werden.|Immer neue Dinge wußte die Tine und sagte alles so eindringlich und heilig, daß mir oft das Herz schlug, als wäre Weihnachtsabend und die Lichter sollten angesteckt werden.
grune_haus_09_f000039|Bei dem Römerstein war es auch, daß sie mir zum erstenmal von den Rauschegeistern erzählte.|Bei dem Römerstein war es auch, daß sie mir zum erstenmal von den Rauschegeistern erzählte.
grune_haus_09_f000040|Es war im August und das Tal roch nach frischem Heu, als wir die Nahe entlang auf unsern Lieblingsplatz zugingen.|Es war im August und das Tal roch nach frischem Heu, als wir die Nahe entlang auf unsern Lieblingsplatz zugingen.
grune_haus_09_f000041|Du, Tine, sagte ich, ich glaube, im Heu stecken die Träume, ich werde immer müde, wenn ich's rieche, und ich fühle,|Du, Tine, sagte ich, ich glaube, im Heu stecken die Träume, ich werde immer müde, wenn ich's rieche, und ich fühle,
grune_haus_09_f000042|wie's in meiner Nase krabbelt und auf den Augen hockt, das sind doch gewiß die Träume.|wie's in meiner Nase krabbelt und auf den Augen hockt, das sind doch gewiß die Träume.
grune_haus_09_f000043|Ja, sagte die Tine, im Heu wohnen Träume, aber bloß die kleinen; die großen sind im Himmel und im Wasser, und im Wasser wohnen die schönsten!|Ja, sagte die Tine, im Heu wohnen Träume, aber bloß die kleinen; die großen sind im Himmel und im Wasser, und im Wasser wohnen die schönsten!
grune_haus_09_f000044|Gestern habe ich die Rauschegeister gehört, das war aber mal.|Gestern habe ich die Rauschegeister gehört, das war aber mal.
grune_haus_09_f000045|Die Rauschegeister? fragte ich. Ja, in der Nahe; sie faßten sich an den Händen und tanzten.|Die Rauschegeister? fragte ich. Ja, in der Nahe; sie faßten sich an den Händen und tanzten.
grune_haus_09_f000046|Sie hatten graue Röckchen aus Mull an, und ganz weiße Locken hatten sie, und sie tanzten so schön!|Sie hatten graue Röckchen aus Mull an, und ganz weiße Locken hatten sie, und sie tanzten so schön!
grune_haus_09_f000047|Ein Lied sangen sie auch, das konnte ich aber nicht verstehn, der Wind ging so sehr.|Ein Lied sangen sie auch, das konnte ich aber nicht verstehn, der Wind ging so sehr.
grune_haus_09_f000048|Aber das nächstemal muß ich besser hören, ich muß das Zauberlied wissen;|Aber das nächstemal muß ich besser hören, ich muß das Zauberlied wissen;
grune_haus_09_f000049|denn wenn ich das singen kann, kann ich auch im Wasser leben wie der Wassermann und die Nixen und die kleinen Rauschegeister.|denn wenn ich das singen kann, kann ich auch im Wasser leben wie der Wassermann und die Nixen und die kleinen Rauschegeister.
grune_haus_09_f000050|Mit stillem Eifer hatte ich zugehört. Darf ich auch mit und das Lied lernen? Nicht wahr, Tine, dann kann man doch nicht mehr ertrinken; ich habe immer so Angst vorm Ertrinken.|Mit stillem Eifer hatte ich zugehört. Darf ich auch mit und das Lied lernen? Nicht wahr, Tine, dann kann man doch nicht mehr ertrinken; ich habe immer so Angst vorm Ertrinken.
grune_haus_09_f000051|Tine schüttelte bedächtig den Kopf, kletterte auf den Römerstein und sah ins Wasser.|Tine schüttelte bedächtig den Kopf, kletterte auf den Römerstein und sah ins Wasser.
grune_haus_09_f000052|Heut kommen sie nicht, es ist alles still, wir müssen warten.|Heut kommen sie nicht, es ist alles still, wir müssen warten.
grune_haus_09_f000053|Wir saßen noch eine Weile schweigsam nebeneinander. Zu unserm Blumenspiel hatten wir keine Lust, und früher als sonst gingen wir nach Hause.|Wir saßen noch eine Weile schweigsam nebeneinander. Zu unserm Blumenspiel hatten wir keine Lust, und früher als sonst gingen wir nach Hause.
grune_haus_09_f000054|Ein paar Tage später trafen wir uns an einem trüben Nachmittag in dem Backofen.|Ein paar Tage später trafen wir uns an einem trüben Nachmittag in dem Backofen.
grune_haus_09_f000055|Wir flüsterten und hörten dem Regen zu, der leise auf das Dach klopfte.|Wir flüsterten und hörten dem Regen zu, der leise auf das Dach klopfte.
grune_haus_09_f000056|Er traut sich nicht herein, sagte mir die Tine ins Ohr.|Er traut sich nicht herein, sagte mir die Tine ins Ohr.
grune_haus_09_f000057|Wir sahen über die Stoppelfelder in den Wald. Zwischen den Bäumen hingen graue Schleiertücher; das sah traurig aus.|Wir sahen über die Stoppelfelder in den Wald. Zwischen den Bäumen hingen graue Schleiertücher; das sah traurig aus.
grune_haus_09_f000058|Tine, fragte ich, hast du die Rauschegeister wieder gesehn? Tine nickte.|Tine, fragte ich, hast du die Rauschegeister wieder gesehn? Tine nickte.
grune_haus_09_f000059|Ja, gestern, an der großen Brücke. Ich guckte über das Geländer; da lachten sie unten und tanzten wie toll um die dicken Pfeiler.|Ja, gestern, an der großen Brücke. Ich guckte über das Geländer; da lachten sie unten und tanzten wie toll um die dicken Pfeiler.
grune_haus_09_f000060|Als ich zu ihnen herunterging, sangen sie auch wieder das Lied, den Anfang hab ich verstanden, es war so sonderbar:|Als ich zu ihnen herunterging, sangen sie auch wieder das Lied, den Anfang hab ich verstanden, es war so sonderbar:
grune_haus_09_f000061|Aus heißem See über Sterne und Schnee rauschen die Schäume, lauschen die Träume.|Aus heißem See über Sterne und Schnee rauschen die Schäume, lauschen die Träume.
grune_haus_09_f000062|Dann waren sie weg und es wurde dunkel. Morgen geh ich wieder hin zum Römerstein; ich will das Ende wissen, das Ende von dem Liede!|Dann waren sie weg und es wurde dunkel. Morgen geh ich wieder hin zum Römerstein; ich will das Ende wissen, das Ende von dem Liede!
grune_haus_09_f000063|Tine, sagte ich, ich komme mit. Und wir faßten uns bei den Händen und saßen noch eine Weile still.|Tine, sagte ich, ich komme mit. Und wir faßten uns bei den Händen und saßen noch eine Weile still.
grune_haus_09_f000064|Wir zählten die Tropfen, die langsam, tipp – tipp – auf einen Topfscherben aufschlugen.|Wir zählten die Tropfen, die langsam, tipp - tipp - auf einen Topfscherben aufschlugen.
grune_haus_09_f000065|Ob er davon wohl kaput ging? Zuletzt fror uns; wir nahmen die Röcke über den Kopf und liefen nach Hause.|Ob er davon wohl kaput ging? Zuletzt fror uns; wir nahmen die Röcke über den Kopf und liefen nach Hause.
grune_haus_09_f000066|Unterwegs wiederholte ich den Vers, den die Rauschegeister gesungen hatten:|Unterwegs wiederholte ich den Vers, den die Rauschegeister gesungen hatten:
grune_haus_09_f000067|Aus heißem See über Sterne und Schnee rauschen die Schäume, lauschen die Träume, und schlief auch damit ein.|Aus heißem See über Sterne und Schnee rauschen die Schäume, lauschen die Träume, und schlief auch damit ein.
grune_haus_09_f000068|Als ich am andern Morgen aufstand und aus dem Fenster sah, lag ein dunkles Tuch über den Bergen, und die Sonne schien gestorben.|Als ich am andern Morgen aufstand und aus dem Fenster sah, lag ein dunkles Tuch über den Bergen, und die Sonne schien gestorben.
grune_haus_09_f000069|Trotzdem kam Tine um zehn Uhr, mich abholen.|Trotzdem kam Tine um zehn Uhr, mich abholen.
grune_haus_09_f000070|Wir stahlen uns heimlich davon, denn meine Mutter hätte uns sicher in dem Wetter keinen Spaziergang erlaubt.|Wir stahlen uns heimlich davon, denn meine Mutter hätte uns sicher in dem Wetter keinen Spaziergang erlaubt.
grune_haus_09_f000071|Mein Herz klopfte sehr; Tine war wie immer ruhig und ohne Eile.|Mein Herz klopfte sehr; Tine war wie immer ruhig und ohne Eile.
grune_haus_09_f000072|Unterwegs fing es an zu regnen, leise und durchdringend.|Unterwegs fing es an zu regnen, leise und durchdringend.
grune_haus_09_f000073|Ich war schon klug genug, um zu wissen, daß ein solcher Regen nicht bald aufhört, ging aber trotzdem mit bis an den Römerstein.|Ich war schon klug genug, um zu wissen, daß ein solcher Regen nicht bald aufhört, ging aber trotzdem mit bis an den Römerstein.
grune_haus_09_f000074|Die Nahe war schon so hoch, daß wir nicht mehr wie sonst über die kleineren Steine zum großen gelangen konnten; sie standen tief unter Wasser.|Die Nahe war schon so hoch, daß wir nicht mehr wie sonst über die kleineren Steine zum großen gelangen konnten; sie standen tief unter Wasser.
grune_haus_09_f000075|Tine überlegte nicht lange. In der Nähe hatte ihr Onkel eine Gärtnerei.|Tine überlegte nicht lange. In der Nähe hatte ihr Onkel eine Gärtnerei.
grune_haus_09_f000076|Sie wußte da Bescheid, und wir holten ein Brett von den Treibhauskästen.|Sie wußte da Bescheid, und wir holten ein Brett von den Treibhauskästen.
grune_haus_09_f000077|Niemand hatte uns gesehn, und wir waren nach zwanzig Minuten wieder zurück.|Niemand hatte uns gesehn, und wir waren nach zwanzig Minuten wieder zurück.
grune_haus_09_f000078|Die kleine Brücke war schnell fertig. Wir kletterten still auf unsern Stein.|Die kleine Brücke war schnell fertig. Wir kletterten still auf unsern Stein.
grune_haus_09_f000079|Der war heut naß und glibberig und unten ganz schwarz.|Der war heut naß und glibberig und unten ganz schwarz.
grune_haus_09_f000080|Wir mußten die Füße unter den Leib ziehen, so hoch schäumten die Wellen.|Wir mußten die Füße unter den Leib ziehen, so hoch schäumten die Wellen.
grune_haus_09_f000081|Jetzt darfst du aber nicht sprechen, sagte Tine und lehnte sich weit über den Stein vor, daß ihre braunen Zöpfe ins Wasser tauchten.|Jetzt darfst du aber nicht sprechen, sagte Tine und lehnte sich weit über den Stein vor, daß ihre braunen Zöpfe ins Wasser tauchten.
grune_haus_09_f000082|Ich zitterte vor Angst und Aufregung. Ich sah in das wilde, schwarze Wasser, das so furchtbaren Lärm um uns machte,|Ich zitterte vor Angst und Aufregung. Ich sah in das wilde, schwarze Wasser, das so furchtbaren Lärm um uns machte,
grune_haus_09_f000083|in die dunklen Berge, von denen immer noch mehr Wasser floß – da kam's mir in den Hals – nach Hause, nach Hause, schluchzte ich und faltete krampfhaft die Hände.|in die dunklen Berge, von denen immer noch mehr Wasser floß - da kam's mir in den Hals - nach Hause, nach Hause, schluchzte ich und faltete krampfhaft die Hände.
grune_haus_09_f000084|Tine sah auf. Geh, ich brauch dich nicht. Und als ich noch ärger heulte: Geh nur, ich sag dir nachher das Ende von dem Liede.|Tine sah auf. Geh, ich brauch dich nicht. Und als ich noch ärger heulte: Geh nur, ich sag dir nachher das Ende von dem Liede.
grune_haus_09_f000085|Tine, bat ich, komm mit, ich fürchte mich so, wenn du hier bleibst.|Tine, bat ich, komm mit, ich fürchte mich so, wenn du hier bleibst.
grune_haus_09_f000086|Sieh bloß, die Nahe wird immer breiter. Geh, ich komme gleich nach, sagte sie rasch, und ich ging.|Sieh bloß, die Nahe wird immer breiter. Geh, ich komme gleich nach, sagte sie rasch, und ich ging.
grune_haus_09_f000087|Ich stolperte über das Brett ans Ufer und atmete erst auf, als ich drüben war.|Ich stolperte über das Brett ans Ufer und atmete erst auf, als ich drüben war.
grune_haus_09_f000088|Ich wagte sie nicht mehr zu bitten, sah aber angstvoll nach meiner Freundin, die unbeweglich, vornübergebeugt, auf dem Steine lag.|Ich wagte sie nicht mehr zu bitten, sah aber angstvoll nach meiner Freundin, die unbeweglich, vornübergebeugt, auf dem Steine lag.
grune_haus_09_f000089|Auf das Brett achtete ich nicht, bis ich plötzlich mit einem Schreck sah, daß es nicht mehr da war, und daß es die Wellen mit fortgerissen hatten.|Auf das Brett achtete ich nicht, bis ich plötzlich mit einem Schreck sah, daß es nicht mehr da war, und daß es die Wellen mit fortgerissen hatten.
grune_haus_09_f000090|Tine, schrie ich, das Brett, das Brett. Hol ein andres, rief sie laut und ruhig, und ich rannte zur Gärtnerei so gut es ging,|Tine, schrie ich, das Brett, das Brett. Hol ein andres, rief sie laut und ruhig, und ich rannte zur Gärtnerei so gut es ging,
grune_haus_09_f000091|denn meine Knie zitterten und meine Zähne schlugen aufeinander.|denn meine Knie zitterten und meine Zähne schlugen aufeinander.
grune_haus_09_f000092|Man konnte mich erst gar nicht verstehen, so schluchzte und stotterte ich, bis sie sich endlich aus Tine und Römerstein was zusammenreimten.|Man konnte mich erst gar nicht verstehen, so schluchzte und stotterte ich, bis sie sich endlich aus Tine und Römerstein was zusammenreimten.
grune_haus_09_f000093|Ihr Onkel und ein Arbeiter nahmen die Obstleiter und einen Strick und folgten mir.|Ihr Onkel und ein Arbeiter nahmen die Obstleiter und einen Strick und folgten mir.
grune_haus_09_f000094|Wir kamen fast zu spät; sie war von dem Stein heruntergeglitten und hielt sich mit beiden Händen am Weidengebüsch fest.|Wir kamen fast zu spät; sie war von dem Stein heruntergeglitten und hielt sich mit beiden Händen am Weidengebüsch fest.
grune_haus_09_f000095|Ihr Onkel legte sich den Strick um den Leib, der Knecht mußte das Ende davon festhalten; so watete und schwamm er zu ihr hinüber und brachte sie ans Land.|Ihr Onkel legte sich den Strick um den Leib, der Knecht mußte das Ende davon festhalten; so watete und schwamm er zu ihr hinüber und brachte sie ans Land.
grune_haus_09_f000096|Sie lag mehrere Stunden bewußtlos. Als sie aufwachte und mich neben ihrer weinenden Mutter sah, lächelte sie mir zu.|Sie lag mehrere Stunden bewußtlos. Als sie aufwachte und mich neben ihrer weinenden Mutter sah, lächelte sie mir zu.
grune_haus_09_f000097|Siehst du, ich bin nicht ertrunken! Dann schmiegte sie sich an ihre Mutter und sang leise und ingründig:|Siehst du, ich bin nicht ertrunken! Dann schmiegte sie sich an ihre Mutter und sang leise und ingründig:
grune_haus_09_f000098|Aus heißem See über Sterne und Schnee rauschen die Schäume, lauschen die Träume, Himmel hinan, Himmel hinab in das Leben bringende, singende Grab.|Aus heißem See über Sterne und Schnee rauschen die Schäume, lauschen die Träume, Himmel hinan, Himmel hinab in das Leben bringende, singende Grab.
grune_haus_09_f000099|Acht Tage später haben wir sie doch begraben müssen. Ein schweres Fieber hatte ihrem sonderbaren Kinderleben ein Ende gemacht.|Acht Tage später haben wir sie doch begraben müssen. Ein schweres Fieber hatte ihrem sonderbaren Kinderleben ein Ende gemacht.
grune_haus_09_f000100|Das Lied, das ihr die kleinen Rauschegeister gesungen haben, habe ich noch lange Jahre nicht begriffen;|Das Lied, das ihr die kleinen Rauschegeister gesungen haben, habe ich noch lange Jahre nicht begriffen;
grune_haus_09_f000101|vergessen aber hab ich's auch nicht können, weder das Lied noch die Tine Brandhofer.|vergessen aber hab ich's auch nicht können, weder das Lied noch die Tine Brandhofer.
grune_haus_10_f000001|Weihnachten in der Speisekammer|Weihnachten in der Speisekammer
grune_haus_10_f000002|Unter der Türschwelle war ein kleines Loch. Dahinter saß die Maus Kiek und wartete.|Unter der Türschwelle war ein kleines Loch. Dahinter saß die Maus Kiek und wartete.
grune_haus_10_f000003|Sie wartete, bis der Hausherr die Stiefel aus- und die Uhr aufgezogen hatte;|Sie wartete, bis der Hausherr die Stiefel aus- und die Uhr aufgezogen hatte;
grune_haus_10_f000004|sie wartete, bis die Mutter ihr Schlüsselkörbchen auf den Nachttisch gestellt und die schlafenden Kinder noch einmal zugedeckt hatte;|sie wartete, bis die Mutter ihr Schlüsselkörbchen auf den Nachttisch gestellt und die schlafenden Kinder noch einmal zugedeckt hatte;
grune_haus_10_f000005|sie wartete auch noch, als alles dunkel war und tiefe Stille im Hause herrschte. Dann ging sie.|sie wartete auch noch, als alles dunkel war und tiefe Stille im Hause herrschte. Dann ging sie.
grune_haus_10_f000006|Bald wurde es in der Speisekammer lebendig. Kiek hatte die ganze Mäusefamilie benachrichtigt.|Bald wurde es in der Speisekammer lebendig. Kiek hatte die ganze Mäusefamilie benachrichtigt.
grune_haus_10_f000007|Da kam Miek die Mäusemutter mit den fünf Kleinen, und Onkel Grisegrau und Tante Fellchen stellten sich auch ein.|Da kam Miek die Mäusemutter mit den fünf Kleinen, und Onkel Grisegrau und Tante Fellchen stellten sich auch ein.
grune_haus_10_f000008|Frauchen, hier ist etwas Weiches, Süßes, sagte Kiek leise vom obersten Brett herunter zu Miek, das ist etwas für die Kinder, und er teilte von den Mohnpielen aus.|Frauchen, hier ist etwas Weiches, Süßes, sagte Kiek leise vom obersten Brett herunter zu Miek, das ist etwas für die Kinder, und er teilte von den Mohnpielen aus.
grune_haus_10_f000009|Komm hierher, Grisegrau, piepste Fellchen, und guckte hinter der Mehltonne vor, hier gibt's Gänsebraten, vorzüglich, sag ich dir, die reine Hafermast; wie Nuß knuspert sich's.|Komm hierher, Grisegrau, piepste Fellchen, und guckte hinter der Mehltonne vor, hier gibt's Gänsebraten, vorzüglich, sag ich dir, die reine Hafermast; wie Nuß knuspert sich's.
grune_haus_10_f000010|Grisegrau aber saß in der neuen Kiste in der Ecke, knabberte am Pfefferkuchen und ließ sich nicht stören.|Grisegrau aber saß in der neuen Kiste in der Ecke, knabberte am Pfefferkuchen und ließ sich nicht stören.
grune_haus_10_f000011|Die Mäusekinder balgten sich im Sandkasten und kriegten Mohnpielen.|Die Mäusekinder balgten sich im Sandkasten und kriegten Mohnpielen.
grune_haus_10_f000012|Papa, sagte das größte, meine Zähne sind schon scharf genug, ich möchte lieber knabbern, knabbern hört sich so hübsch an.|Papa, sagte das größte, meine Zähne sind schon scharf genug, ich möchte lieber knabbern, knabbern hört sich so hübsch an.
grune_haus_10_f000013|Ja, ja, wir wollen auch lieber knabbern, sagten alle Mäusekinder, Mohnpielen sind uns zu matschig, und bald hörte man sie am Gänsebraten und am Pfefferkuchen.|Ja, ja, wir wollen auch lieber knabbern, sagten alle Mäusekinder, Mohnpielen sind uns zu matschig, und bald hörte man sie am Gänsebraten und am Pfefferkuchen.
grune_haus_10_f000014|Verderbt euch nicht den Magen, rief Fellchen, die Angst hatte, selber nicht genug zu kriegen, an einem verdorbenen Magen kann man sterben.|Verderbt euch nicht den Magen, rief Fellchen, die Angst hatte, selber nicht genug zu kriegen, an einem verdorbenen Magen kann man sterben.
grune_haus_10_f000015|Die kleinen Mäuse sahen ihre Tante erschrocken an; sterben wollten sie ganz und gar nicht, das mußte schrecklich sein.|Die kleinen Mäuse sahen ihre Tante erschrocken an; sterben wollten sie ganz und gar nicht, das mußte schrecklich sein.
grune_haus_10_f000016|Vater Kiek beruhigte sie und erzählte ihnen von Gottlieb und Lenchen, die drinnen in ihren Betten lägen und ein hölzernes Pferdchen und eine Puppe im Arm hätten;|Vater Kiek beruhigte sie und erzählte ihnen von Gottlieb und Lenchen, die drinnen in ihren Betten lägen und ein hölzernes Pferdchen und eine Puppe im Arm hätten;
grune_haus_10_f000017|und daß in der großen Stube ein mächtiger Baum stände mit Lichtern und buntem Flimmerstaat, und daß es in der ganzen Wohnung herrlich nach frischem Kuchen röche,|und daß in der großen Stube ein mächtiger Baum stände mit Lichtern und buntem Flimmerstaat, und daß es in der ganzen Wohnung herrlich nach frischem Kuchen röche,
grune_haus_10_f000018|der aber im Glasschrank stände, und an den man nicht heran könnte.|der aber im Glasschrank stände, und an den man nicht heran könnte.
grune_haus_10_f000019|Ach, sagte Fellchen, erzähle nicht so viel, laß die Kinder lieber essen.|Ach, sagte Fellchen, erzähle nicht so viel, laß die Kinder lieber essen.
grune_haus_10_f000020|Die aber lachten die Tante mit dem dicken Bauch aus und wollten noch viel mehr wissen, mehr als der gute Kiek selbst wußte.|Die aber lachten die Tante mit dem dicken Bauch aus und wollten noch viel mehr wissen, mehr als der gute Kiek selbst wußte.
grune_haus_10_f000021|Zuletzt bestanden sie darauf, auch einen Weihnachtsbaum zu haben, und die zärtlichen Mäuseeltern liefen wirklich in die Küche und zerrten einen Ast herbei,|Zuletzt bestanden sie darauf, auch einen Weihnachtsbaum zu haben, und die zärtlichen Mäuseeltern liefen wirklich in die Küche und zerrten einen Ast herbei,
grune_haus_10_f000022|der von dem großen Tannenbaum abgeschnitten war.|der von dem großen Tannenbaum abgeschnitten war.
grune_haus_10_f000023|Das gab einen Hauptspaß. Die Mäusekinder quiekten vor Entzücken und fingen an, an dem grünen Tannenholz zu knabbern;|Das gab einen Hauptspaß. Die Mäusekinder quiekten vor Entzücken und fingen an, an dem grünen Tannenholz zu knabbern;
grune_haus_10_f000024|das schmeckte aber abscheulich nach Terpentin, und sie ließen es sein und kletterten lieber in dem Ast umher.|das schmeckte aber abscheulich nach Terpentin, und sie ließen es sein und kletterten lieber in dem Ast umher.
grune_haus_10_f000025|Schließlich machten sie die ganze Speisekammer zu ihrem Spielplatz.|Schließlich machten sie die ganze Speisekammer zu ihrem Spielplatz.
grune_haus_10_f000026|Sie huschten hierhin und dorthin, machten Männchen, lugten neugierig über die Bretter in alle Winkel hinein, und spielten Versteck hinter den Gemüsebüchsen und Einmachetöpfen;|Sie huschten hierhin und dorthin, machten Männchen, lugten neugierig über die Bretter in alle Winkel hinein, und spielten Versteck hinter den Gemüsebüchsen und Einmachetöpfen;
grune_haus_10_f000027|was sollten sie auch mit dem dummen Weihnachtsbaum, an dem es nichts zu essen gab!|was sollten sie auch mit dem dummen Weihnachtsbaum, an dem es nichts zu essen gab!
grune_haus_10_f000028|Als aber das kleinste ins Pflaumenmus gefallen war und von Mama Miek und Onkel Grisegrau abgeleckt werden mußte,|Als aber das kleinste ins Pflaumenmus gefallen war und von Mama Miek und Onkel Grisegrau abgeleckt werden mußte,
grune_haus_10_f000029|wurde ihnen das Umhertollen untersagt, und sie mußten wieder artig am Pfefferkuchen knabbern.|wurde ihnen das Umhertollen untersagt, und sie mußten wieder artig am Pfefferkuchen knabbern.
grune_haus_10_f000030|Am andern Morgen fand die alte Köchin kopfschüttelnd den Tannenast in der Speisekammer und viele Krümel und noch etwas,|Am andern Morgen fand die alte Köchin kopfschüttelnd den Tannenast in der Speisekammer und viele Krümel und noch etwas,
grune_haus_10_f000031|was nicht gerade in die Speisekammer gehört, ihr werdet euch schon denken können was!|was nicht gerade in die Speisekammer gehört, ihr werdet euch schon denken können was!
grune_haus_10_f000032|Als Gottlieb und Lenchen in die Küche kamen, um der alten Marie guten Morgen zu wünschen, zeigte sie ihnen die Bescherung und meinte: Die haben auch tüchtig Weihnachten gefeiert.|Als Gottlieb und Lenchen in die Küche kamen, um der alten Marie guten Morgen zu wünschen, zeigte sie ihnen die Bescherung und meinte: Die haben auch tüchtig Weihnachten gefeiert.
grune_haus_10_f000033|Die Kinder aber tuschelten und lachten und holten einen Blumentopf.|Die Kinder aber tuschelten und lachten und holten einen Blumentopf.
grune_haus_10_f000034|Sie pflanzten den Ast hinein und bekränzten ihn mit Zuckerwerk, aufgeknackten Nüssen, Honigkuchen und Speckstückchen.|Sie pflanzten den Ast hinein und bekränzten ihn mit Zuckerwerk, aufgeknackten Nüssen, Honigkuchen und Speckstückchen.
grune_haus_10_f000035|Die alte Marie brummte; da aber die Mutter lachend zuguckte, mußte sie schon klein beigeben.|Die alte Marie brummte; da aber die Mutter lachend zuguckte, mußte sie schon klein beigeben.
grune_haus_10_f000036|Sie stellte alles andre sicher und ließ den kleinen Naschtieren nur ihren Weihnachtsbaum.|Sie stellte alles andre sicher und ließ den kleinen Naschtieren nur ihren Weihnachtsbaum.
