grune_haus_06_f000085|Als das Spiel aus war, sagten die Kinder, sie wäre eine lustige Frau, wie sie denn hieße.|Als das Spiel aus war, sagten die Kinder, sie wäre eine lustige Frau, wie sie denn hieße.
grune_haus_06_f000086|Die Kinder kannten ihre Königin bloß von Bildern her, wo sie ihr Königingesicht machte, und das sieht ganz anders aus, als wenn man mit Kindern spielt.|Die Kinder kannten ihre Königin bloß von Bildern her, wo sie ihr Königingesicht machte, und das sieht ganz anders aus, als wenn man mit Kindern spielt.
grune_haus_06_f000087|Die Königin lachte und sagte: Ich bin eine Fee und will den Ärmsten von euch was schenken.|Die Königin lachte und sagte: Ich bin eine Fee und will den Ärmsten von euch was schenken.
grune_haus_06_f000088|Die Kinder waren verlegen, sie wußten nicht, wer der Ärmste sei.|Die Kinder waren verlegen, sie wußten nicht, wer der Ärmste sei.
grune_haus_06_f000089|Endlich sagte eines: Fritz und Lene sind die Ärmsten, die haben keinen Vater und keine Mutter.|Endlich sagte eines: Fritz und Lene sind die Ärmsten, die haben keinen Vater und keine Mutter.
grune_haus_06_f000090|Ja, das wären wohl die Ärmsten, meinten die andern auch.|Ja, das wären wohl die Ärmsten, meinten die andern auch.
grune_haus_06_f000091|Nun, so wünscht nur los, sagte die alte Königin und band sich ihren Purpurmantel wieder um; sie dachte gewiß, die Kinder würden sie dann eher für eine Fee halten.|Nun, so wünscht nur los, sagte die alte Königin und band sich ihren Purpurmantel wieder um; sie dachte gewiß, die Kinder würden sie dann eher für eine Fee halten.
grune_haus_06_f000092|Der kleine Fritz, derselbe Junge, der die Königin zum Mitspielen eingeladen hatte, sagte gleich: Ich möchte ein lebendiges Pferd haben.|Der kleine Fritz, derselbe Junge, der die Königin zum Mitspielen eingeladen hatte, sagte gleich: Ich möchte ein lebendiges Pferd haben.
grune_haus_06_f000093|Sollst du, sagte die Königin, und du, Lenchen? Das kleine Mädchen sah ihr forschend ins Gesicht:|Sollst du, sagte die Königin, und du, Lenchen? Das kleine Mädchen sah ihr forschend ins Gesicht:
grune_haus_06_f000094|Wenn du eine Fee bist, könntest du mir eine Mutter schenken, fast alle Kinder haben eine Mutter.|Wenn du eine Fee bist, könntest du mir eine Mutter schenken, fast alle Kinder haben eine Mutter.
grune_haus_06_f000095|Da wurde der alten Königin wunderlich zu Sinn; sie nahm das kleine Mädchen an die rechte und den Jungen an die linke Hand,|Da wurde der alten Königin wunderlich zu Sinn; sie nahm das kleine Mädchen an die rechte und den Jungen an die linke Hand,
grune_haus_06_f000096|nickte den andern Kindern noch freundlich zu und ging mit den beiden ins Schloß zurück.|nickte den andern Kindern noch freundlich zu und ging mit den beiden ins Schloß zurück.
grune_haus_06_f000097|Der dicke Koch sperrte seinen großen Mund noch größer auf, als sie mit den Kindern über den Schloßhof kam,|Der dicke Koch sperrte seinen großen Mund noch größer auf, als sie mit den Kindern über den Schloßhof kam,
grune_haus_06_f000098|und der Leibarzt machte vor Verlegenheit eine Verbeugung über die andere.|und der Leibarzt machte vor Verlegenheit eine Verbeugung über die andere.
grune_haus_06_f000099|Da sie aber Königin war, durfte ihr niemand dreinreden, und so blieben die Kinder im Schloß.|Da sie aber Königin war, durfte ihr niemand dreinreden, und so blieben die Kinder im Schloß.
grune_haus_06_f000100|Auch ihre alte Großmutter wurde hingeholt und wackelte vor lauter Seligkeit immer von einem Bein aufs andre.|Auch ihre alte Großmutter wurde hingeholt und wackelte vor lauter Seligkeit immer von einem Bein aufs andre.
grune_haus_06_f000101|Am besten aber hatte es die Königin, die wurde beinah wieder jung vor aller Freude.|Am besten aber hatte es die Königin, die wurde beinah wieder jung vor aller Freude.
grune_haus_06_f000102|Die Kinder mußten bei ihr lernen und spielen; fast hätte sie das Regieren vergessen vor lauter Eifer!|Die Kinder mußten bei ihr lernen und spielen; fast hätte sie das Regieren vergessen vor lauter Eifer!
grune_haus_06_f000103|Ihr erster Gedanke des Morgens waren die Kinder und abends erzählte sie ihnen von dem lieben Gott und den Sternen und noch von vielen andern schönen Dingen.|Ihr erster Gedanke des Morgens waren die Kinder und abends erzählte sie ihnen von dem lieben Gott und den Sternen und noch von vielen andern schönen Dingen.
grune_haus_06_f000104|Am liebsten aber ging sie mit ihnen in den Wald; da wußten die Kinder die schönsten Plätzchen und brachten Mutter Königin frische Erdbeeren,|Am liebsten aber ging sie mit ihnen in den Wald; da wußten die Kinder die schönsten Plätzchen und brachten Mutter Königin frische Erdbeeren,
grune_haus_06_f000105|die viel besser schmeckten, als die man bei Tisch bekam.|die viel besser schmeckten, als die man bei Tisch bekam.
grune_haus_06_f000106|An den blauen Vogel hatte sie die ganze Zeit nicht mehr gedacht.|An den blauen Vogel hatte sie die ganze Zeit nicht mehr gedacht.
grune_haus_06_f000107|Da hörte sie eines Tages fröhliches Lachen aus dem Gartensaal.|Da hörte sie eines Tages fröhliches Lachen aus dem Gartensaal.
grune_haus_06_f000108|Sie ging hinein, da tanzten Fritz und Lene um den blauen Vogel, der unbemerkt durch das Fenster gekommen war und nun fröhlich auf seiner kleinen Schaukel saß,|Sie ging hinein, da tanzten Fritz und Lene um den blauen Vogel, der unbemerkt durch das Fenster gekommen war und nun fröhlich auf seiner kleinen Schaukel saß,
grune_haus_06_f000109|als wäre er nicht weggewesen.|als wäre er nicht weggewesen.
grune_haus_06_f000110|Die Kinder aber lachten, weil er immerlos schrie: Dem Kutscher, der nicht fahren kann, geht der Wagen schief.|Die Kinder aber lachten, weil er immerlos schrie: Dem Kutscher, der nicht fahren kann, geht der Wagen schief.
grune_haus_06_f000111|Der kleine Schelm mußte wohl im Walde zugehört haben.|Der kleine Schelm mußte wohl im Walde zugehört haben.
grune_haus_06_f000112|Der Königin blitzten die Augen vor Freude, als sie den lieben blauen Vogel wiedersah, und nun lachten sie alle drei,|Der Königin blitzten die Augen vor Freude, als sie den lieben blauen Vogel wiedersah, und nun lachten sie alle drei,
grune_haus_06_f000113|daß die alten vergoldeten Stühle und die Bilder mit den steifen Königen mitwackelten.|daß die alten vergoldeten Stühle und die Bilder mit den steifen Königen mitwackelten.
grune_haus_06_f000114|Plötzlich hielten sie an. Die Tür war aufgegangen, der Mann im blauen Kittel stand im Saal.|Plötzlich hielten sie an. Die Tür war aufgegangen, der Mann im blauen Kittel stand im Saal.
grune_haus_06_f000115|Willst du mit, Frohgemut? fragte er. Der blaue Vogel wippte mit dem Silberfederschwänzchen, flog der Königin auf die Schulter und sang:|Willst du mit, Frohgemut? fragte er. Der blaue Vogel wippte mit dem Silberfederschwänzchen, flog der Königin auf die Schulter und sang:
grune_haus_06_f000116|Die Welt ist gescheidt, sie wechselt ihr Kleid und schüttelt die Zeit!|Die Welt ist gescheidt, sie wechselt ihr Kleid und schüttelt die Zeit!
grune_haus_06_f000117|Ich grüße den Herrn, Wo Kinder lachen, da bin ich gern.|Ich grüße den Herrn, Wo Kinder lachen, da bin ich gern.
grune_haus_06_f000118|Da nickte der Mann im blauen Kittel der Königin zu und ging.|Da nickte der Mann im blauen Kittel der Königin zu und ging.
grune_haus_06_f000119|Der blaue Vogel aber blieb, und manchmal half er der Königin regieren.|Der blaue Vogel aber blieb, und manchmal half er der Königin regieren.
grune_haus_07_f000001|Die Fabel vom Kohlkopf und den Veilchen|Die Fabel vom Kohlkopf und den Veilchen
grune_haus_07_f000002|Mitten im Veilchenbeet stand ein Kohlkopf. Durch Zufall war er dort hingeraten und prächtig angewachsen.|Mitten im Veilchenbeet stand ein Kohlkopf. Durch Zufall war er dort hingeraten und prächtig angewachsen.
grune_haus_07_f000003|Niemand kümmerte sich um ihn und die Veilchen. Die Leute, denen der kleine Garten gehörte, waren verreist.|Niemand kümmerte sich um ihn und die Veilchen. Die Leute, denen der kleine Garten gehörte, waren verreist.
grune_haus_07_f000004|Wozu seid ihr auf der Welt, fragte eines Tages der Kohlkopf die Veilchen, als er schon über sie wegsehen konnte.|Wozu seid ihr auf der Welt, fragte eines Tages der Kohlkopf die Veilchen, als er schon über sie wegsehen konnte.
grune_haus_07_f000005|Ich meine, ihr macht bloß Blätter und keine Köpfe, und ihr müßt wissen, daß die Köpfe die Hauptsache sind!|Ich meine, ihr macht bloß Blätter und keine Köpfe, und ihr müßt wissen, daß die Köpfe die Hauptsache sind!
grune_haus_07_f000006|Die Veilchen sahen ganz erschrocken aus. Sie verstanden den Kohlkopf nicht, es war ihnen unheimlich, daß er so groß wurde.|Die Veilchen sahen ganz erschrocken aus. Sie verstanden den Kohlkopf nicht, es war ihnen unheimlich, daß er so groß wurde.
grune_haus_07_f000007|Ja, täglich konnten sie sehen, wie er wuchs. – Na, seid ihr stumm, schrie der Kohl, was wollt ihr hier? – Blühen und duften, sagte da schüchtern ein Veilchen.|Ja, täglich konnten sie sehen, wie er wuchs. - Na, seid ihr stumm, schrie der Kohl, was wollt ihr hier? - Blühen und duften, sagte da schüchtern ein Veilchen.
grune_haus_07_f000008|Blühen und duften, hä, kann denn das der Mensch essen? Uns, die Kohlköpfe kann er essen, und Essen ist die Hauptsache!|Blühen und duften, hä, kann denn das der Mensch essen? Uns, die Kohlköpfe kann er essen, und Essen ist die Hauptsache!
grune_haus_07_f000009|Aber euch! Hi, hi, blühen und duften, blühen und duften! Und der Kohlkopf schüttelte sich vor Lachen und wurde noch röter als zuvor.|Aber euch! Hi, hi, blühen und duften, blühen und duften! Und der Kohlkopf schüttelte sich vor Lachen und wurde noch röter als zuvor.
grune_haus_07_f000010|Die Veilchen krochen ganz in sich zusammen; sie hatten Angst vor dem dicken, roten Kohlkopf; sie fanden ihn sehr häßlich, trotzdem er so klug war und gegessen werden konnte!|Die Veilchen krochen ganz in sich zusammen; sie hatten Angst vor dem dicken, roten Kohlkopf; sie fanden ihn sehr häßlich, trotzdem er so klug war und gegessen werden konnte!
grune_haus_07_f000011|Jeden Tag hielt der Kohlkopf den Veilchen lange Reden; sie sollten wenigstens versuchen auch Köpfe anzusetzen; so dünn hätten sie gar keinen Zweck, und Zweck wäre die Hauptsache!|Jeden Tag hielt der Kohlkopf den Veilchen lange Reden; sie sollten wenigstens versuchen auch Köpfe anzusetzen; so dünn hätten sie gar keinen Zweck, und Zweck wäre die Hauptsache!
grune_haus_07_f000012|Eines Tages öffneten ein paar Veilchen ihre Kelche, und köstlicher Wohlgeruch strömte über das Beet.|Eines Tages öffneten ein paar Veilchen ihre Kelche, und köstlicher Wohlgeruch strömte über das Beet.
grune_haus_07_f000013|Wie riecht denn das hier? sagte der Kohlkopf, es ist schauderhaft, wie das hier riecht! Und er wurde so wütend, daß sein Kopf blau anlief.|Wie riecht denn das hier? sagte der Kohlkopf, es ist schauderhaft, wie das hier riecht! Und er wurde so wütend, daß sein Kopf blau anlief.
grune_haus_07_f000014|Am andern Morgen kamen die Leute zurück, denen der Garten gehörte.|Am andern Morgen kamen die Leute zurück, denen der Garten gehörte.
grune_haus_07_f000015|Ein junges Mädchen öffnete das Gitter und lief auf das Veilchenbeet zu.|Ein junges Mädchen öffnete das Gitter und lief auf das Veilchenbeet zu.
grune_haus_07_f000016|Sie blühen schon, sie blühen schon! jubelte sie, atmete tief ihren Duft ein und begann ein Sträußchen zu sammeln.|Sie blühen schon, sie blühen schon! jubelte sie, atmete tief ihren Duft ein und begann ein Sträußchen zu sammeln.
grune_haus_07_f000017|Da bemerkte sie den Kohlkopf und lachte. Guck, Fritz, ein Kohl mitten unter Veilchen!|Da bemerkte sie den Kohlkopf und lachte. Guck, Fritz, ein Kohl mitten unter Veilchen!
grune_haus_07_f000018|rief sie dem schlanken Manne zu, der eben in den Garten trat, gib mir dein Federmesser, ich will ihn abschneiden.|rief sie dem schlanken Manne zu, der eben in den Garten trat, gib mir dein Federmesser, ich will ihn abschneiden.
grune_haus_07_f000019|Der aber sagte: Erst einen Kuß, Rose, dann kriegst du das Messer; und das junge Mädchen küßte den Mann, und ihre Augen lachten.|Der aber sagte: Erst einen Kuß, Rose, dann kriegst du das Messer; und das junge Mädchen küßte den Mann, und ihre Augen lachten.
grune_haus_07_f000020|Der Kohl aber schrie: Ich will noch wachsen, ich bin noch nicht dick genug, merkt ihr nicht, daß ich noch nicht dick genug bin? Und dick sein ist die Hauptsache.|Der Kohl aber schrie: Ich will noch wachsen, ich bin noch nicht dick genug, merkt ihr nicht, daß ich noch nicht dick genug bin? Und dick sein ist die Hauptsache.
grune_haus_07_f000021|Aber die beiden Menschen verstanden die Kohlsprache nicht, und so wurde er abgeschnitten.|Aber die beiden Menschen verstanden die Kohlsprache nicht, und so wurde er abgeschnitten.
grune_haus_07_f000022|Das junge Mädchen pflückte noch mehr Veilchen; ein paar für ihren Liebsten und die andern für die kranke Mutter, die mit bleichen Händen oben im Stuhl am Fenster saß.|Das junge Mädchen pflückte noch mehr Veilchen; ein paar für ihren Liebsten und die andern für die kranke Mutter, die mit bleichen Händen oben im Stuhl am Fenster saß.
grune_haus_07_f000023|Da duftete das ganze Zimmer, und die Augen der alten Frau leuchteten.|Da duftete das ganze Zimmer, und die Augen der alten Frau leuchteten.
grune_haus_07_f000024|Und wollt ihr wissen, wo der Kohl geblieben ist? Den hat die Ziege gefressen, und wenn sie nicht so blitzdumm wäre, könnte sie's euch selbst erzählen!|Und wollt ihr wissen, wo der Kohl geblieben ist? Den hat die Ziege gefressen, und wenn sie nicht so blitzdumm wäre, könnte sie's euch selbst erzählen!
grune_haus_08_f000001|Vom verkehrten Peter|Vom verkehrten Peter
grune_haus_08_f000002|In einem Lande, in dem die Scheunen brennen, wenn man sie ansteckt, und die Menschen zornig werden, wenn man sie ärgert, lebte einmal ein Junge, der Peter hieß.|In einem Lande, in dem die Scheunen brennen, wenn man sie ansteckt, und die Menschen zornig werden, wenn man sie ärgert, lebte einmal ein Junge, der Peter hieß.
grune_haus_08_f000003|Er hatte rote Backen und stramme Beine, unterschied sich also nicht sichtbarlich von allen andern Petern; aber er war verhext.|Er hatte rote Backen und stramme Beine, unterschied sich also nicht sichtbarlich von allen andern Petern; aber er war verhext.
grune_haus_08_f000004|Wer ihn verhext hatte, wußte er nicht, und der Schulmeister, der sonst ein tüchtiger Mann war und das Lineal nicht bloß zum Linienziehen gebrauchte, wußte es auch nicht.|Wer ihn verhext hatte, wußte er nicht, und der Schulmeister, der sonst ein tüchtiger Mann war und das Lineal nicht bloß zum Linienziehen gebrauchte, wußte es auch nicht.
grune_haus_08_f000005|Verhext war er aber ganz gewiß; das konnte jedermann bei helligtem Tage sehen, ohne erst die Laternen anzustecken.|Verhext war er aber ganz gewiß; das konnte jedermann bei helligtem Tage sehen, ohne erst die Laternen anzustecken.
grune_haus_08_f000006|Wenn er nämlich so recht von Herzen was sagen wollte, kam das Gegenteil aus ihm heraus, platzte in die erstaunte Welt wie eine Granate in die Kochschüssel und trug dem Peter manchen Puff und manch ärgerliches Dreinschauen ein;|Wenn er nämlich so recht von Herzen was sagen wollte, kam das Gegenteil aus ihm heraus, platzte in die erstaunte Welt wie eine Granate in die Kochschüssel und trug dem Peter manchen Puff und manch ärgerliches Dreinschauen ein;
grune_haus_08_f000007|manchmal freilich auch eine gute Miene und einen dankbaren Blick, wie es sich gerade traf.|manchmal freilich auch eine gute Miene und einen dankbaren Blick, wie es sich gerade traf.
grune_haus_08_f000008|Ich will euch ein paar handliche Beispiele erzählen, damit ihr nicht etwa glaubt, ich wolle hier mit Lügen aufwarten,|Ich will euch ein paar handliche Beispiele erzählen, damit ihr nicht etwa glaubt, ich wolle hier mit Lügen aufwarten,
grune_haus_08_f000009|wie weiland der selige Herr von Münchhausen, oder euch an der Nase herumführen, wie der berühmte Meister Till Eulenspiegel gern tat.|wie weiland der selige Herr von Münchhausen, oder euch an der Nase herumführen, wie der berühmte Meister Till Eulenspiegel gern tat.
grune_haus_08_f000010|Das sollt ihr nicht glauben, also hört!|Das sollt ihr nicht glauben, also hört!
grune_haus_08_f000011|Als unser Peter noch ein kleiner Hosenmatz war, so ein schmächtiges Kerlchen, das kaum richtig sprechen konnte,|Als unser Peter noch ein kleiner Hosenmatz war, so ein schmächtiges Kerlchen, das kaum richtig sprechen konnte,
grune_haus_08_f000012|kam einst der Landesherr durch seine Vaterstadt, und Peter durfte ihm den Wagenschlag aufmachen.|kam einst der Landesherr durch seine Vaterstadt, und Peter durfte ihm den Wagenschlag aufmachen.
grune_haus_08_f000013|Der Gnädige neigte sich zu dem Jungen, kniff ihn mit der rechten Hand in die Backe, langte mit Daumen und Zeigefinger der Linken in die Westentasche und fragte ihn leutselig:|Der Gnädige neigte sich zu dem Jungen, kniff ihn mit der rechten Hand in die Backe, langte mit Daumen und Zeigefinger der Linken in die Westentasche und fragte ihn leutselig:
grune_haus_08_f000014|Bist auch immer fein manierlich und brav?|Bist auch immer fein manierlich und brav?
grune_haus_08_f000015|Nö, sagte der Peter und wurde puterrot, ich bin der Ruppigst' in der ganzen Stadt, fragt nur den Vater;|Nö, sagte der Peter und wurde puterrot, ich bin der Ruppigst' in der ganzen Stadt, fragt nur den Vater;
grune_haus_08_f000016|und damit machte er kehrt und lief davon wie ein aus dem Kohl gejagter Hase.|und damit machte er kehrt und lief davon wie ein aus dem Kohl gejagter Hase.
grune_haus_08_f000017|Den silbernen Henkeltaler bekam nun der Pfarrergustav, und Peter stand am Ententeich, machte eine Faust und spuckte vor Wut immer ins Wasser.|Den silbernen Henkeltaler bekam nun der Pfarrergustav, und Peter stand am Ententeich, machte eine Faust und spuckte vor Wut immer ins Wasser.
grune_haus_08_f000018|Gab ihm seine Mutter einen Apfel, so biß er herzhaft hinein, denn im Garten wuchsen gute Sorten, und der Peter war ein Feinschmecker,|Gab ihm seine Mutter einen Apfel, so biß er herzhaft hinein, denn im Garten wuchsen gute Sorten, und der Peter war ein Feinschmecker,
grune_haus_08_f000019|der lieber einen Grafensteiner aß, als hungrig zu Bett ging.|der lieber einen Grafensteiner aß, als hungrig zu Bett ging.
grune_haus_08_f000020|Wurde er aber gefragt: Peter, magst einen Apfel? so sagte der Junge gewißlich nö, mag keinen und sah hernach mit langem Gesicht zu,|Wurde er aber gefragt: Peter, magst einen Apfel? so sagte der Junge gewißlich nö, mag keinen und sah hernach mit langem Gesicht zu,
grune_haus_08_f000021|wie Schwester Grete hintereinander zwei Äpfel aß, denn sie bekam dann seinen dazu.|wie Schwester Grete hintereinander zwei Äpfel aß, denn sie bekam dann seinen dazu.
grune_haus_08_f000022|Einmal hatte er etwas Ernstliches ausgefressen, und eine Tracht Prügel stand in bedrohlicher Nähe.|Einmal hatte er etwas Ernstliches ausgefressen, und eine Tracht Prügel stand in bedrohlicher Nähe.
grune_haus_08_f000023|Herzlich gern hätte er dem Vater abgebeten und dadurch vielleicht den Stock in der Schrankecke festgehalten;|Herzlich gern hätte er dem Vater abgebeten und dadurch vielleicht den Stock in der Schrankecke festgehalten;
grune_haus_08_f000024|statt dessen sagte er: Schlag man zu, Vater, es kann gar nicht toll genug kommen; – und nun bekam er die doppelte Ladung.|statt dessen sagte er: Schlag man zu, Vater, es kann gar nicht toll genug kommen; - und nun bekam er die doppelte Ladung.
grune_haus_08_f000025|Solche Streiche spielte dem Peter sein verhextes Maulwerk noch oft;|Solche Streiche spielte dem Peter sein verhextes Maulwerk noch oft;
grune_haus_08_f000026|– ich denke aber, ich habe euch nun genug Beispiele erzählt, sonst komme ich vor lauter Beispielen nicht zu meiner Geschichte, und das wäre doch schade.|- ich denke aber, ich habe euch nun genug Beispiele erzählt, sonst komme ich vor lauter Beispielen nicht zu meiner Geschichte, und das wäre doch schade.
grune_haus_08_f000027|Ja, als der Peter merkte, daß es mit dem Bösen in ihm nicht besser wurde, trotzdem er nun schon ein großer Junge war und lange Hosen trug,|Ja, als der Peter merkte, daß es mit dem Bösen in ihm nicht besser wurde, trotzdem er nun schon ein großer Junge war und lange Hosen trug,
grune_haus_08_f000028|beschloß er, in die Welt zu gehn und sein dummes Mundwerk kurieren zu lassen.|beschloß er, in die Welt zu gehn und sein dummes Mundwerk kurieren zu lassen.
grune_haus_08_f000029|Vielleicht gab es irgendwo einen Doktor, der ihn für gute Worte oder andere Dienste davon erlösen konnte.|Vielleicht gab es irgendwo einen Doktor, der ihn für gute Worte oder andere Dienste davon erlösen konnte.
grune_haus_08_f000030|Vielleicht machte er auch sonstwie sein Glück, man konnte ja nicht wissen.|Vielleicht machte er auch sonstwie sein Glück, man konnte ja nicht wissen.
grune_haus_08_f000031|Aber recht stattlich wollte er in die Fremde ziehn;|Aber recht stattlich wollte er in die Fremde ziehn;
grune_haus_08_f000032|darum schloß er seine Patenbüchse auf und kaufte sich eine goldbraune Sammetjacke mit gelben Troddeln dran und eine dazu passende Mütze.|darum schloß er seine Patenbüchse auf und kaufte sich eine goldbraune Sammetjacke mit gelben Troddeln dran und eine dazu passende Mütze.
grune_haus_08_f000033|Dann lieh er sich beim Posthalter einen leibhaftigen Schimmel mit einer grünen Schabracke, steckte seine Mundharmonika in die Tasche und ritt stolz vor seines Vaters Haus, um Abschied zu nehmen.|Dann lieh er sich beim Posthalter einen leibhaftigen Schimmel mit einer grünen Schabracke, steckte seine Mundharmonika in die Tasche und ritt stolz vor seines Vaters Haus, um Abschied zu nehmen.
grune_haus_08_f000034|Die Mutter weinte vor Rührung und Wohlgefallen in den rechten, und Grete in den linken Schürzenzipfel,|Die Mutter weinte vor Rührung und Wohlgefallen in den rechten, und Grete in den linken Schürzenzipfel,
grune_haus_08_f000035|als sie ihren Peter so stattlich und hoch zu Roß sahen, und der Vater paffte aus seiner Pfeife doppelt soviel Rauchwolken als sonst und sagte:|als sie ihren Peter so stattlich und hoch zu Roß sahen, und der Vater paffte aus seiner Pfeife doppelt soviel Rauchwolken als sonst und sagte:
grune_haus_08_f000036|Jung, laß dir deinen bösen Mund austreiben, sei ein rechter und braver Kerl, sieh aber zu, daß du ein paar Taler ins Hosenfutter nähst,|Jung, laß dir deinen bösen Mund austreiben, sei ein rechter und braver Kerl, sieh aber zu, daß du ein paar Taler ins Hosenfutter nähst,
grune_haus_08_f000037|arme Schlucker gibt's schon genug im Lande!|arme Schlucker gibt's schon genug im Lande!
grune_haus_08_f000038|Hol euch alle der Kuckuck, sagte der Peter, ihm war aber ganz anders zumute, denn er drehte sich um und schnaubte sich die Nase recht kräftig aus,|Hol euch alle der Kuckuck, sagte der Peter, ihm war aber ganz anders zumute, denn er drehte sich um und schnaubte sich die Nase recht kräftig aus,
grune_haus_08_f000039|um die Tränen nicht sehn zu lassen, die ihm über die Backen kluckerten.|um die Tränen nicht sehn zu lassen, die ihm über die Backen kluckerten.
grune_haus_08_f000040|Hol euch der Kuckuck! sagte er und ritt davon.|Hol euch der Kuckuck! sagte er und ritt davon.
grune_haus_08_f000041|Es war eine lustige Welt, in die er hineinritt, denn es war Frühling.|Es war eine lustige Welt, in die er hineinritt, denn es war Frühling.
grune_haus_08_f000042|Alles schien zu lachen; die Sonne, die Wiesen, die Vögel; selbst der Bach plinkerte wie einer, der vor Vergnügen die Augen zukneift.|Alles schien zu lachen; die Sonne, die Wiesen, die Vögel; selbst der Bach plinkerte wie einer, der vor Vergnügen die Augen zukneift.
grune_haus_08_f000043|So kam es, daß Peter auch lachte und den Abschied und die Hexerei über all dem Lachen und Freuen bald vergaß.|So kam es, daß Peter auch lachte und den Abschied und die Hexerei über all dem Lachen und Freuen bald vergaß.
grune_haus_08_f000044|Er nahm seine Mundharmonika aus der Tasche und blies ein lustiges Stückchen.|Er nahm seine Mundharmonika aus der Tasche und blies ein lustiges Stückchen.
grune_haus_08_f000045|Das klang so vergnügt, daß die Mäuse aus den Löchern guckten und ihre durchsichtigen Öhrlein spitzten.|Das klang so vergnügt, daß die Mäuse aus den Löchern guckten und ihre durchsichtigen Öhrlein spitzten.
grune_haus_08_f000046|Sogar die mürrischen Maulwürfe steckten die Nase aus der Erde und vergaßen für eine Weile die fetten Engerlinge, die sie gern zum Frühstück essen wollten.|Sogar die mürrischen Maulwürfe steckten die Nase aus der Erde und vergaßen für eine Weile die fetten Engerlinge, die sie gern zum Frühstück essen wollten.
grune_haus_08_f000047|Mücken und Fliegen tanzten zu seiner Musik, und der Wind pfiff die zweite Stimme dazu; wie gesagt, es war eine lustige Reise!|Mücken und Fliegen tanzten zu seiner Musik, und der Wind pfiff die zweite Stimme dazu; wie gesagt, es war eine lustige Reise!
grune_haus_08_f000048|Als er an ein junges Saatfeld kam, wollte er seinem Pferde eine Freude machen, stieg ab und ließ es grasen.|Als er an ein junges Saatfeld kam, wollte er seinem Pferde eine Freude machen, stieg ab und ließ es grasen.
grune_haus_08_f000049|Er selbst ging pfeifend und mit den Händen in den Hosentaschen dem nahen Walde zu.|Er selbst ging pfeifend und mit den Händen in den Hosentaschen dem nahen Walde zu.
