grune_haus_13_f000017|Vorn, auf dem Feuer einer platzenden Granate, saß grinsend der Teufel und schwenkte sein rotes Fähnchen.|Vorn, auf dem Feuer einer platzenden Granate, saß grinsend der Teufel und schwenkte sein rotes Fähnchen.
grune_haus_13_f000018|Das Bild auf der andern Seite war ein Gastmahl in einer offnen Veranda.|Das Bild auf der andern Seite war ein Gastmahl in einer offnen Veranda.
grune_haus_13_f000019|Eine Menge schöngeputzter Herren und Damen saßen da zu Tische.|Eine Menge schöngeputzter Herren und Damen saßen da zu Tische.
grune_haus_13_f000020|Erlesene Speisen und edle Weine standen vor ihnen. Sie aßen und lachten miteinander und warfen Knochen und Brotstücke über die Brüstung.|Erlesene Speisen und edle Weine standen vor ihnen. Sie aßen und lachten miteinander und warfen Knochen und Brotstücke über die Brüstung.
grune_haus_13_f000021|Draußen standen viele arme Leute und fingen die Brocken auf; einige mit Haß in den Augen, andre mit tiefen Verbeugungen.|Draußen standen viele arme Leute und fingen die Brocken auf; einige mit Haß in den Augen, andre mit tiefen Verbeugungen.
grune_haus_13_f000022|Daneben standen etliche, die sahen traurig oder ingrimmig zu, und einer ballte die Faust nach dem Tisch mit den Speisen.|Daneben standen etliche, die sahen traurig oder ingrimmig zu, und einer ballte die Faust nach dem Tisch mit den Speisen.
grune_haus_13_f000023|Diese beiden Bilder zogen die Menschen immer wieder machtvoll an, aber der Weise aus dem Morgenlande sah kopfschüttelnd zu;|Diese beiden Bilder zogen die Menschen immer wieder machtvoll an, aber der Weise aus dem Morgenlande sah kopfschüttelnd zu;
grune_haus_13_f000024|die Halle war schon seit Jahren fertig, und noch kein Pilger hatte den Stern der Decke gläubig angesehn.|die Halle war schon seit Jahren fertig, und noch kein Pilger hatte den Stern der Decke gläubig angesehn.
grune_haus_13_f000025|Da kam eines Tages ein Findelkind der Armut in das Gewölbe.|Da kam eines Tages ein Findelkind der Armut in das Gewölbe.
grune_haus_13_f000026|Heimatlos und elternlos war der Knabe ausgezogen, aber seine Augen waren voll Sonne und sein Herz voll Güte.|Heimatlos und elternlos war der Knabe ausgezogen, aber seine Augen waren voll Sonne und sein Herz voll Güte.
grune_haus_13_f000027|Er sang in den blauen Himmel hinein, und sein trocknes Brot mundete ihm wie köstliches Manna.|Er sang in den blauen Himmel hinein, und sein trocknes Brot mundete ihm wie köstliches Manna.
grune_haus_13_f000028|Ehrfurchtsvoll trat er in das hohe Tor, ließ seine staunenden Blicke langsam durch das Gewölbe gleiten und sah entzückt auf zur Kuppel.|Ehrfurchtsvoll trat er in das hohe Tor, ließ seine staunenden Blicke langsam durch das Gewölbe gleiten und sah entzückt auf zur Kuppel.
grune_haus_13_f000029|Da war ihm, als ob das ganze strahlende Bauwerk fern oben in der Mitte zusammenfloß, und als ob sich goldne Ströme in langen Bahnen aus dem leuchtenden Sterne in die Halle zurückergössen.|Da war ihm, als ob das ganze strahlende Bauwerk fern oben in der Mitte zusammenfloß, und als ob sich goldne Ströme in langen Bahnen aus dem leuchtenden Sterne in die Halle zurückergössen.
grune_haus_13_f000030|Immer wieder sah er hinab – hinauf – seine Augen wurden weit vor staunender Erkenntnis, und wie zum Gebet schlossen sich seine Hände.|Immer wieder sah er hinab - hinauf - seine Augen wurden weit vor staunender Erkenntnis, und wie zum Gebet schlossen sich seine Hände.
grune_haus_13_f000031|Da erfüllte sich das Wunder, das dem Sterne innewohnte: Er fing an sich zu drehen und dem Knaben sein verborgnes Farbenspiel zu zeigen.|Da erfüllte sich das Wunder, das dem Sterne innewohnte: Er fing an sich zu drehen und dem Knaben sein verborgnes Farbenspiel zu zeigen.
grune_haus_13_f000032|Weich und glühend dehnten sich seine bunten Kreise durch das Gewölbe;|Weich und glühend dehnten sich seine bunten Kreise durch das Gewölbe;
grune_haus_13_f000033|und was sie berührten, wurde von eignem Leben erfüllt oder kristallen durchsichtig und offenbarte dem Beschauer sein innerstes Wirken.|und was sie berührten, wurde von eignem Leben erfüllt oder kristallen durchsichtig und offenbarte dem Beschauer sein innerstes Wirken.
grune_haus_13_f000034|Da faltete der einsame Knabe gläubig die Hände und betete: Gelobt sei Allah!|Da faltete der einsame Knabe gläubig die Hände und betete: Gelobt sei Allah!
grune_haus_13_f000035|Wie ein Träumender ging er zuerst durch das Gewimmel der andern Pilger; sie wichen scheu vor ihm, er aber merkte es nicht.|Wie ein Träumender ging er zuerst durch das Gewimmel der andern Pilger; sie wichen scheu vor ihm, er aber merkte es nicht.
grune_haus_13_f000036|Bald jedoch erfüllte sich die Verheißung des Weisen an ihm; es war, als ob ein geheimes Licht in Menschen und Dinge hineinleuchtete.|Bald jedoch erfüllte sich die Verheißung des Weisen an ihm; es war, als ob ein geheimes Licht in Menschen und Dinge hineinleuchtete.
grune_haus_13_f000037|So sah er vieles, was den andern verborgen war, und was er selbst nie vorher gesehen hatte.|So sah er vieles, was den andern verborgen war, und was er selbst nie vorher gesehen hatte.
grune_haus_13_f000038|Auch die Bilder in der Halle sah er mit neuen Augen.|Auch die Bilder in der Halle sah er mit neuen Augen.
grune_haus_13_f000039|Auf dem Bilde mit den geköpften Soldaten erblickte er hinter allen Greueln den Friedensengel;|Auf dem Bilde mit den geköpften Soldaten erblickte er hinter allen Greueln den Friedensengel;
grune_haus_13_f000040|und auf dem Bilde der Reichen und Armen sah er den Geist der Gerechtigkeit, der eben das Schwert aus der Scheide zog.|und auf dem Bilde der Reichen und Armen sah er den Geist der Gerechtigkeit, der eben das Schwert aus der Scheide zog.
grune_haus_13_f000041|Fern aber, zwischen beiden Bildern, tat sich ihm die Wand auf, und er sah ein neues Land in der Dämmerung liegen,|Fern aber, zwischen beiden Bildern, tat sich ihm die Wand auf, und er sah ein neues Land in der Dämmerung liegen,
grune_haus_13_f000042|wo stolze, gesunde Menschen ihrem Tagewerk und ihrer Muße nachgingen.|wo stolze, gesunde Menschen ihrem Tagewerk und ihrer Muße nachgingen.
grune_haus_13_f000043|Und er sah das Lebendige und das Tote, und erkannte, daß ein Weizenkorn mehr sei als ein Goldkorn.|Und er sah das Lebendige und das Tote, und erkannte, daß ein Weizenkorn mehr sei als ein Goldkorn.
grune_haus_13_f000044|Und er sah den Krieg und die Bitternis, und wußte, daß der Frieden ihr letztes Kind sein würde.|Und er sah den Krieg und die Bitternis, und wußte, daß der Frieden ihr letztes Kind sein würde.
grune_haus_13_f000045|Und er sah, daß der Tod nur ruhendes Leben und das Endliche nur ein Widerspiel des Unendlichen ist.|Und er sah, daß der Tod nur ruhendes Leben und das Endliche nur ein Widerspiel des Unendlichen ist.
grune_haus_13_f000046|Und er wuchs und tat seinen Mund auf und sagte den Pilgern, was er sah. Und es ging ein Leuchten von ihm aus, so daß sie ihm glaubten und ihm anhingen.|Und er wuchs und tat seinen Mund auf und sagte den Pilgern, was er sah. Und es ging ein Leuchten von ihm aus, so daß sie ihm glaubten und ihm anhingen.
grune_haus_13_f000047|Er hatte den Stern der Mitte gläubig angesehen.|Er hatte den Stern der Mitte gläubig angesehen.
grune_haus_14_f000001|Vom Feuermännchen und der Maus Grisegrau|Vom Feuermännchen und der Maus Grisegrau
grune_haus_14_f000002|Heut will ich euch die Geschichte vom Feuermännchen erzählen, sagte eines Abends unsere gute alte Tante Minna;|Heut will ich euch die Geschichte vom Feuermännchen erzählen, sagte eines Abends unsere gute alte Tante Minna;
grune_haus_14_f000003|sie ist zwar ein bissel gruselig, aber ich will sie euch doch erzählen.|sie ist zwar ein bissel gruselig, aber ich will sie euch doch erzählen.
grune_haus_14_f000004|Ihr müßt wissen, zu Hause in Pankenbrück hatten wir einen großen Kachelofen, so einen recht altmodischen grünen Kachelofen.|Ihr müßt wissen, zu Hause in Pankenbrück hatten wir einen großen Kachelofen, so einen recht altmodischen grünen Kachelofen.
grune_haus_14_f000005|Und blanke Haken hatte er, um nasse Kleider dran aufzuhängen, und eine Warmröhre mit einer Messingtüre hatte er auch.|Und blanke Haken hatte er, um nasse Kleider dran aufzuhängen, und eine Warmröhre mit einer Messingtüre hatte er auch.
grune_haus_14_f000006|Darin gab es im Winter Bratäpfel oder ein Töpfchen mit Kaffee für den Fritz und die Grete, wenn sie müde und hungrig vom Schlittschuhlaufen kamen.|Darin gab es im Winter Bratäpfel oder ein Töpfchen mit Kaffee für den Fritz und die Grete, wenn sie müde und hungrig vom Schlittschuhlaufen kamen.
grune_haus_14_f000007|Ich sage euch Kinder, es war ein Prachtstück von einem alten Kachelofen!|Ich sage euch Kinder, es war ein Prachtstück von einem alten Kachelofen!
grune_haus_14_f000008|Und was das Herrlichste war, es wohnte ein Feuermännchen drin, ein wirkliches gelbes Teufelchen.|Und was das Herrlichste war, es wohnte ein Feuermännchen drin, ein wirkliches gelbes Teufelchen.
grune_haus_14_f000009|Wenn man unten die Tür aufmachte und die rote Glut einem entgegenschlug, konnte man ihn deutlich hüpfen und springen sehn,|Wenn man unten die Tür aufmachte und die rote Glut einem entgegenschlug, konnte man ihn deutlich hüpfen und springen sehn,
grune_haus_14_f000010|hopp, hopp, immer durch die Flammen durch, hinüber und herüber.|hopp, hopp, immer durch die Flammen durch, hinüber und herüber.
grune_haus_14_f000011|Manchmal machte er auch einen ganz lächerlichen Spektakel.|Manchmal machte er auch einen ganz lächerlichen Spektakel.
grune_haus_14_f000012|Er amüsierte sich, die Holzstücke, die nicht gleich brennen wollten, knack, mitten durchzubrechen, spuckte auch wohl in die Flammen,|Er amüsierte sich, die Holzstücke, die nicht gleich brennen wollten, knack, mitten durchzubrechen, spuckte auch wohl in die Flammen,
grune_haus_14_f000013|daß sie sprühten und zischten, und kicherte vernehmlich hinterher.|daß sie sprühten und zischten, und kicherte vernehmlich hinterher.
grune_haus_14_f000014|Kurz und gut, er war eben ein rechtes Teufelchen, wie alle andern Feuermännchen auch sind.|Kurz und gut, er war eben ein rechtes Teufelchen, wie alle andern Feuermännchen auch sind.
grune_haus_14_f000015|Doch nun kommt meine Geschichte.|Doch nun kommt meine Geschichte.
grune_haus_14_f000016|Einmal nämlich mußte ich eine Mausefalle aufstellen.|Einmal nämlich mußte ich eine Mausefalle aufstellen.
grune_haus_14_f000017|Im Eckschrank in der Wohnstube hatte das Brot ein ganz verdächtiges Loch gehabt.|Im Eckschrank in der Wohnstube hatte das Brot ein ganz verdächtiges Loch gehabt.
grune_haus_14_f000018|Ich briet ein Stück Speck hübsch knusprig und legte es in die Falle.|Ich briet ein Stück Speck hübsch knusprig und legte es in die Falle.
grune_haus_14_f000019|Am andern Morgen war der Speck weg, die Falle aber zu und von einem Mäuschen nix zu sehn.|Am andern Morgen war der Speck weg, die Falle aber zu und von einem Mäuschen nix zu sehn.
grune_haus_14_f000020|Grete und ich schüttelten verwundert die Köpfe; bloß der Fritz, der sich über nichts wunderte, lachte unbändig,|Grete und ich schüttelten verwundert die Köpfe; bloß der Fritz, der sich über nichts wunderte, lachte unbändig,
grune_haus_14_f000021|so daß wir schon glaubten, er habe das Mäuschen wieder laufen lassen.|so daß wir schon glaubten, er habe das Mäuschen wieder laufen lassen.
grune_haus_14_f000022|Er sagte aber nein, und da er ein wahrhaftiger Junge war, mußten wir ihm schon glauben.|Er sagte aber nein, und da er ein wahrhaftiger Junge war, mußten wir ihm schon glauben.
grune_haus_14_f000023|Ich machte ein neues Stückchen Speck zurecht und richtete die Falle zum zweiten Male.|Ich machte ein neues Stückchen Speck zurecht und richtete die Falle zum zweiten Male.
grune_haus_14_f000024|Aber es ging wie vorher: Speck weg, Maus weg, Falle zu! Das ging nicht mit rechten Dingen zu!|Aber es ging wie vorher: Speck weg, Maus weg, Falle zu! Das ging nicht mit rechten Dingen zu!
grune_haus_14_f000025|Ich machte mir nun mein Bett auf dem Sofa in der Wohnstube zurecht und wollte aufpassen.|Ich machte mir nun mein Bett auf dem Sofa in der Wohnstube zurecht und wollte aufpassen.
grune_haus_14_f000026|In der Falle roch wieder ein saftiges Speckstückchen. Ich legte mich hin und blinzelte von Zeit zu Zeit hinüber, aber es blieb alles still.|In der Falle roch wieder ein saftiges Speckstückchen. Ich legte mich hin und blinzelte von Zeit zu Zeit hinüber, aber es blieb alles still.
grune_haus_14_f000027|Wenn der Vollmond nicht so hell ins Zimmer geschienen hätte, wäre mir die Zeit gewiß recht lang geworden.|Wenn der Vollmond nicht so hell ins Zimmer geschienen hätte, wäre mir die Zeit gewiß recht lang geworden.
grune_haus_14_f000028|Endlich hörte ich Trippelschrittchen, und – Kinder, da hatten wir die Bescherung!|Endlich hörte ich Trippelschrittchen, und - Kinder, da hatten wir die Bescherung!
grune_haus_14_f000029|Da kam mein Mäuschen, aber nicht allein, es hatte einen artigen Kavalier bei sich, nämlich unser leibhaftiges Feuermännchen.|Da kam mein Mäuschen, aber nicht allein, es hatte einen artigen Kavalier bei sich, nämlich unser leibhaftiges Feuermännchen.
grune_haus_14_f000030|Der ging an die Falle, hielt zierlich und geschickt das Fallbrettchen hoch, Mäuschen holte den Speck,|Der ging an die Falle, hielt zierlich und geschickt das Fallbrettchen hoch, Mäuschen holte den Speck,
grune_haus_14_f000031|und als sie außer Gefahr war, ließ das Kerlchen vorsichtig den Deckel wieder fallen.|und als sie außer Gefahr war, ließ das Kerlchen vorsichtig den Deckel wieder fallen.
grune_haus_14_f000032|Ich sah belustigt zu, mit welchem Appetit sie dann den Speck verzehrten, und spitzte die Ohren, was sie wohl sonst noch machen würden.|Ich sah belustigt zu, mit welchem Appetit sie dann den Speck verzehrten, und spitzte die Ohren, was sie wohl sonst noch machen würden.
grune_haus_14_f000033|Ich brauchte nicht lange zu warten, bis sie ihre drolligen Spiele anfingen.|Ich brauchte nicht lange zu warten, bis sie ihre drolligen Spiele anfingen.
grune_haus_14_f000034|Mitten auf der Diele war ein großer weißer Fleck, den hatte der Vollmond dorthin gemalt.|Mitten auf der Diele war ein großer weißer Fleck, den hatte der Vollmond dorthin gemalt.
grune_haus_14_f000035|Da begannen sie ihre Kunststückchen. Wie die geschicktesten Turner und Seiltänzer sag' ich euch!|Da begannen sie ihre Kunststückchen. Wie die geschicktesten Turner und Seiltänzer sag' ich euch!
grune_haus_14_f000036|Einmal war Feuermännchen der Reiter und Maus das Pferdchen.|Einmal war Feuermännchen der Reiter und Maus das Pferdchen.
grune_haus_14_f000037|Hui, ging's immer rundum, ohne Sattel und Zaum. Nein, das hättet ihr wirklich sehn müssen!|Hui, ging's immer rundum, ohne Sattel und Zaum. Nein, das hättet ihr wirklich sehn müssen!
grune_haus_14_f000038|Von Mäuschens kleinen Ohren bis zu Mäuschens Schwanzspitze lief das behende Männchen hin und her, vorwärts und rückwärts,|Von Mäuschens kleinen Ohren bis zu Mäuschens Schwanzspitze lief das behende Männchen hin und her, vorwärts und rückwärts,
grune_haus_14_f000039|daß sein gelbes Röckchen sich um ihn bauschte und die roten Schuhe klapperten.|daß sein gelbes Röckchen sich um ihn bauschte und die roten Schuhe klapperten.
grune_haus_14_f000040|Dabei schoß er noch Köpfchen und schlug Räder; ich sage euch, mir wurde ganz wirblig dabei.|Dabei schoß er noch Köpfchen und schlug Räder; ich sage euch, mir wurde ganz wirblig dabei.
grune_haus_14_f000041|Oder Maus lief ihrem Kameraden blitzschnell durch die Beine, rechtsum, linksum, sprang ihm unversehens über den Kopf weg, wieder durch die Beine und lief ihm endlich davon.|Oder Maus lief ihrem Kameraden blitzschnell durch die Beine, rechtsum, linksum, sprang ihm unversehens über den Kopf weg, wieder durch die Beine und lief ihm endlich davon.
grune_haus_14_f000042|Dann begann ein tolles Haschen über Stuhl und Tisch, oben und unten;|Dann begann ein tolles Haschen über Stuhl und Tisch, oben und unten;
grune_haus_14_f000043|von der Gardinenstange aufs Fensterbrett, von dort auf die Sofalehne oder quer über die Kommode, bis sie sich endlich hatten und müde waren.|von der Gardinenstange aufs Fensterbrett, von dort auf die Sofalehne oder quer über die Kommode, bis sie sich endlich hatten und müde waren.
grune_haus_14_f000044|Dann setzten sie sich artig auf eine Fußbank und streichelten und küßten sich wie richtige Liebesleute.|Dann setzten sie sich artig auf eine Fußbank und streichelten und küßten sich wie richtige Liebesleute.
grune_haus_14_f000045|Bald aber tollten sie wieder wie vorher. Das dauerte so eine gute Stunde;|Bald aber tollten sie wieder wie vorher. Das dauerte so eine gute Stunde;
grune_haus_14_f000046|da ging der Mond weg, und Maus und Feuermännchen verschwanden im Ofen, unten, wo schon lange eine Kachel fehlte.|da ging der Mond weg, und Maus und Feuermännchen verschwanden im Ofen, unten, wo schon lange eine Kachel fehlte.
grune_haus_14_f000047|Na, nun wußte ich Bescheid und nahm mir vor, da nun einmal das Mäuschen unserm Feuermännchen sein Schatz war, ihr nix Böses zu tun.|Na, nun wußte ich Bescheid und nahm mir vor, da nun einmal das Mäuschen unserm Feuermännchen sein Schatz war, ihr nix Böses zu tun.
grune_haus_14_f000048|Im Gegenteil, Grete mußte jeden Tag ein Puppenschälchen voll Milch vor das Ofenloch stellen;|Im Gegenteil, Grete mußte jeden Tag ein Puppenschälchen voll Milch vor das Ofenloch stellen;
grune_haus_14_f000049|und ich tat ab und zu auch noch einen andern guten Bissen hinein; wußte ich doch, daß auch Feuermännchen kein Kostverächter sei.|und ich tat ab und zu auch noch einen andern guten Bissen hinein; wußte ich doch, daß auch Feuermännchen kein Kostverächter sei.
grune_haus_14_f000050|Bald war das Mäuschen so zahm, daß es sich auch am Tage hervorwagte, ja, es stellte sich zu den Mahlzeiten ein und trug manch Häppchen zu ihrem Schatz ins Ofenloch.|Bald war das Mäuschen so zahm, daß es sich auch am Tage hervorwagte, ja, es stellte sich zu den Mahlzeiten ein und trug manch Häppchen zu ihrem Schatz ins Ofenloch.
grune_haus_14_f000051|Wir nannten sie Frau Grisegrau und hatten sie alle lieb.|Wir nannten sie Frau Grisegrau und hatten sie alle lieb.
grune_haus_14_f000052|Wenn Vollmond war, ließ es mir keine Ruhe; eine Nacht wenigstens mußte ich ihrem übermütigen Treiben zusehn.|Wenn Vollmond war, ließ es mir keine Ruhe; eine Nacht wenigstens mußte ich ihrem übermütigen Treiben zusehn.
grune_haus_14_f000053|Auch dem Fritz und der Grete machte ich mal im Wohnzimmer ihr Bett auf;|Auch dem Fritz und der Grete machte ich mal im Wohnzimmer ihr Bett auf;
grune_haus_14_f000054|aber die dummen Jöhren schliefen immer ein und wußten am andern Morgen nix vom Feuermännchen und nix von Frau Grisegrau.|aber die dummen Jöhren schliefen immer ein und wußten am andern Morgen nix vom Feuermännchen und nix von Frau Grisegrau.
grune_haus_14_f000055|So lebten wir ein paar schöne Jahre zusammen; und wenn die Bratäpfel in unserm alten Ofen schmorten und draußen der Sturm ging,|So lebten wir ein paar schöne Jahre zusammen; und wenn die Bratäpfel in unserm alten Ofen schmorten und draußen der Sturm ging,
grune_haus_14_f000056|erzählte ich den Kindern neue Kunststücke von Feuermännchen und Grisegrau, und sie guckten vergnügt ins Ofenloch und sahen das Teufelchen lustig flackern und springen.|erzählte ich den Kindern neue Kunststücke von Feuermännchen und Grisegrau, und sie guckten vergnügt ins Ofenloch und sahen das Teufelchen lustig flackern und springen.
grune_haus_14_f000057|Doch nun kommt's traurig, Kinder, denn alles Schöne hat im Leben mal ein Ende.|Doch nun kommt's traurig, Kinder, denn alles Schöne hat im Leben mal ein Ende.
grune_haus_14_f000058|Eines Tages lag unser Mäuschen tot vor ihrem Loche. Ein fremder Kater hatte sich hereingeschlichen und es erwischt. Ich verjagte ihn, aber ich kam zu spät.|Eines Tages lag unser Mäuschen tot vor ihrem Loche. Ein fremder Kater hatte sich hereingeschlichen und es erwischt. Ich verjagte ihn, aber ich kam zu spät.
grune_haus_14_f000059|Ich blieb im Wohnzimmer, und als der Mond kam, sah ich unser Feuermännchen klagend um die Leiche gehn.|Ich blieb im Wohnzimmer, und als der Mond kam, sah ich unser Feuermännchen klagend um die Leiche gehn.
grune_haus_14_f000060|Zuletzt nahm er sie auf den Rücken und ging langsam den gewohnten Weg durch die Kachel.|Zuletzt nahm er sie auf den Rücken und ging langsam den gewohnten Weg durch die Kachel.
grune_haus_14_f000061|Im Ofen war noch Glut, ich bückte mich, um hineinzusehn, da war er schon mit seiner lieben Grisegrau mitten drin.|Im Ofen war noch Glut, ich bückte mich, um hineinzusehn, da war er schon mit seiner lieben Grisegrau mitten drin.
grune_haus_14_f000062|Hellauf loderten die Flammen, die die kleine Maus begraben sollten; ganz stille hockte das Feuermännchen daneben und sah zu.|Hellauf loderten die Flammen, die die kleine Maus begraben sollten; ganz stille hockte das Feuermännchen daneben und sah zu.
grune_haus_14_f000063|Mir war ganz traurig zumute, als ob mir was liebes gestorben wäre.|Mir war ganz traurig zumute, als ob mir was liebes gestorben wäre.
grune_haus_14_f000064|Bei uns im Hause wurde es auch still, seitdem Feuermännchen und Grisegrau nicht mehr zusammen spielten.|Bei uns im Hause wurde es auch still, seitdem Feuermännchen und Grisegrau nicht mehr zusammen spielten.
grune_haus_14_f000065|Der Fritz kam zu den Soldaten und die Grete wurde Erzieherin weit weg in Ungarn.|Der Fritz kam zu den Soldaten und die Grete wurde Erzieherin weit weg in Ungarn.
grune_haus_14_f000066|Für mich allein mochte ich keine Bratäpfel mehr in den alten Kachelofen legen, und auch das Feuermännchen habe ich seit jener Nacht nicht wieder gesehn.|Für mich allein mochte ich keine Bratäpfel mehr in den alten Kachelofen legen, und auch das Feuermännchen habe ich seit jener Nacht nicht wieder gesehn.
grune_haus_15_f000001|Vom Kater, der gern ein Mensch sein wollte|Vom Kater, der gern ein Mensch sein wollte
grune_haus_15_f000002|Im Hause eines Dichters lebte einmal ein Kater. Er hatte ein glänzend schwarzes Fell, prachtvolle grüne Augen und den schönsten dicken Katerschwanz weit und breit.|Im Hause eines Dichters lebte einmal ein Kater. Er hatte ein glänzend schwarzes Fell, prachtvolle grüne Augen und den schönsten dicken Katerschwanz weit und breit.
grune_haus_15_f000003|Kurz, er war ein Kater wie er sein muß! Sein Herr, der Dichter, hielt ihn hoch und wert; er behauptete, der Kater verstünde jedes Wort, und so war es auch.|Kurz, er war ein Kater wie er sein muß! Sein Herr, der Dichter, hielt ihn hoch und wert; er behauptete, der Kater verstünde jedes Wort, und so war es auch.
grune_haus_15_f000004|Eines Abends, als der Dichter Besuch hatte, pfiff er dem Kater und ließ ihn auf den Tisch springen.|Eines Abends, als der Dichter Besuch hatte, pfiff er dem Kater und ließ ihn auf den Tisch springen.
grune_haus_15_f000005|Jetzt zeige, was du kannst, sagte er und hob den Finger.|Jetzt zeige, was du kannst, sagte er und hob den Finger.
grune_haus_15_f000006|Da machte der Kater sogleich einen Buckel und fauchte die Umstehenden mit blitzenden Augen an.|Da machte der Kater sogleich einen Buckel und fauchte die Umstehenden mit blitzenden Augen an.
grune_haus_15_f000007|Der Dichter aber sagte: Meinem Kater fehlt bloß die Sprache, hätte er die, wäre er sicherlich ebenso intelligent wie manche unsrer Professoren und könnte einen respektablen Doktor abgeben.|Der Dichter aber sagte: Meinem Kater fehlt bloß die Sprache, hätte er die, wäre er sicherlich ebenso intelligent wie manche unsrer Professoren und könnte einen respektablen Doktor abgeben.
grune_haus_15_f000008|Die Freunde lachten und streichelten den vor Freude schnurrenden Kater. Einer von ihnen aber sagte: Na, was nicht ist, kann ja noch werden. Und sie lachten noch mehr.|Die Freunde lachten und streichelten den vor Freude schnurrenden Kater. Einer von ihnen aber sagte: Na, was nicht ist, kann ja noch werden. Und sie lachten noch mehr.
grune_haus_15_f000009|Unserm Kater aber stiegen alle diese Worte zu Kopfe, und der Ehrgeiz fing an, ihn gewaltig zu jucken.|Unserm Kater aber stiegen alle diese Worte zu Kopfe, und der Ehrgeiz fing an, ihn gewaltig zu jucken.
grune_haus_15_f000010|Wäre ich doch ein Mensch, dachte er, es muß herrlich sein, seinen tiefsten Gefühlen in Worten Ausdruck geben zu können; wie armselig ist unsre Katzensprache!|Wäre ich doch ein Mensch, dachte er, es muß herrlich sein, seinen tiefsten Gefühlen in Worten Ausdruck geben zu können; wie armselig ist unsre Katzensprache!
grune_haus_15_f000011|Gelänge es mir doch menschlich zu sprechen, meinen Schwanz würde ich dafür hergeben!|Gelänge es mir doch menschlich zu sprechen, meinen Schwanz würde ich dafür hergeben!
grune_haus_15_f000012|Er wurde ganz melancholisch und klagte nachts auf den Dächern dem Monde sein Leid.|Er wurde ganz melancholisch und klagte nachts auf den Dächern dem Monde sein Leid.
grune_haus_15_f000013|Der verstand ihn aber nicht, ebensowenig wie seine Nachbarin, die weiße Katze, die ihren Freund erschrocken von der Seite ansah und sich mit einem angstvollen Miau zu ihrem Vetter, dem grauen Kater flüchtete.|Der verstand ihn aber nicht, ebensowenig wie seine Nachbarin, die weiße Katze, die ihren Freund erschrocken von der Seite ansah und sich mit einem angstvollen Miau zu ihrem Vetter, dem grauen Kater flüchtete.
