mein_weg_als_deutscher_und_jude_005_f000174|und Menschen sind vergänglich; sein Gesetz erhält das Schicksal erst durch den Dichter.|und Menschen sind vergänglich; sein Gesetz erhält das Schicksal erst durch den Dichter.
mein_weg_als_deutscher_und_jude_005_f000175|Aber was die Abschreiber und Klitterer der Wirklichkeit aus ihr machen, ist noch viel vergänglicher als Mensch und Geschehen.|Aber was die Abschreiber und Klitterer der Wirklichkeit aus ihr machen, ist noch viel vergänglicher als Mensch und Geschehen.
mein_weg_als_deutscher_und_jude_005_f000176|Diese zufällige grobe Wirklichkeit; mit ihr ist in der Regel wenig anzufangen, wenig zu leisten; sie ist ein ungeheurer Materialspeicher, und ist kein Auge da, das das Verworrene entwirrt,|Diese zufällige grobe Wirklichkeit; mit ihr ist in der Regel wenig anzufangen, wenig zu leisten; sie ist ein ungeheurer Materialspeicher, und ist kein Auge da, das das Verworrene entwirrt,
mein_weg_als_deutscher_und_jude_005_f000177|im Vielfältigen das Einfache wahrnimmt, in den Schlacken das Edelmetall, unter Fratzen das Gesicht, im Stückwerk die Andeutung des Ganzen, im Abgeirrten das Gesetz, was ist sie dann nütze?|im Vielfältigen das Einfache wahrnimmt, in den Schlacken das Edelmetall, unter Fratzen das Gesicht, im Stückwerk die Andeutung des Ganzen, im Abgeirrten das Gesetz, was ist sie dann nütze?
mein_weg_als_deutscher_und_jude_005_f000178|Der Augenschein gehört mir, unter allen Umständen; wer dürfte ihn mir bestreiten?|Der Augenschein gehört mir, unter allen Umständen; wer dürfte ihn mir bestreiten?
mein_weg_als_deutscher_und_jude_005_f000179|Wozu ich ihn umschaffe, ist Sache der Gnade.|Wozu ich ihn umschaffe, ist Sache der Gnade.
mein_weg_als_deutscher_und_jude_005_f000180|17|siebzehn
mein_weg_als_deutscher_und_jude_005_f000181|Aber ich will von einem Gespräch zwischen mir und dem Freund berichten.|Aber ich will von einem Gespräch zwischen mir und dem Freund berichten.
mein_weg_als_deutscher_und_jude_005_f000182|Er erkundigte sich nach meiner Familie, und ob sie sich mit mir ausgesöhnt habe.|Er erkundigte sich nach meiner Familie, und ob sie sich mit mir ausgesöhnt habe.
mein_weg_als_deutscher_und_jude_005_f000183|An meinen persönlichen Verhältnissen zeigte er lebhaften Anteil.|An meinen persönlichen Verhältnissen zeigte er lebhaften Anteil.
mein_weg_als_deutscher_und_jude_005_f000184|Obwohl der Dialog durch die Ausschließlichkeit, mit der er sich an das Thema hielt, etwas Gezwungenes bekam, stand ich ihm ohne Rückhalt Rede.|Obwohl der Dialog durch die Ausschließlichkeit, mit der er sich an das Thema hielt, etwas Gezwungenes bekam, stand ich ihm ohne Rückhalt Rede.
mein_weg_als_deutscher_und_jude_005_f000185|War ich auch nicht mehr der verhungerte Skribent, der ihm ehemals Bürde gewesen, und den er von sich gestoßen, so übte er doch noch immer Macht über mich aus.|War ich auch nicht mehr der verhungerte Skribent, der ihm ehemals Bürde gewesen, und den er von sich gestoßen, so übte er doch noch immer Macht über mich aus.
mein_weg_als_deutscher_und_jude_005_f000186|Solche Macht, die ein Erfahrener, Überlegener über einen irrend Suchenden erlangt, geht überhaupt nie ganz verloren, es sei denn, der eine oder der andere verlöre sich selbst.|Solche Macht, die ein Erfahrener, Überlegener über einen irrend Suchenden erlangt, geht überhaupt nie ganz verloren, es sei denn, der eine oder der andere verlöre sich selbst.
mein_weg_als_deutscher_und_jude_005_f000187|Außerdem bewahrte ich dem merkwürdigen Mann eine Anhänglichkeit, die ihm gewiß fühlbar wurde.|Außerdem bewahrte ich dem merkwürdigen Mann eine Anhänglichkeit, die ihm gewiß fühlbar wurde.
mein_weg_als_deutscher_und_jude_005_f000188|Es kam mir vor, als wollte er mich nach einer bestimmten Richtung ausholen, und endlich fragte er mich geradezu, ob ich noch wie zu jener Zeit überzeugter Jude sei.|Es kam mir vor, als wollte er mich nach einer bestimmten Richtung ausholen, und endlich fragte er mich geradezu, ob ich noch wie zu jener Zeit überzeugter Jude sei.
mein_weg_als_deutscher_und_jude_005_f000189|Ich antwortete: Überzeugter Jude?|Ich antwortete: Überzeugter Jude?
mein_weg_als_deutscher_und_jude_005_f000190|Mit dem Beiwort wisse ich nichts Rechtes anzufangen.|Mit dem Beiwort wisse ich nichts Rechtes anzufangen.
mein_weg_als_deutscher_und_jude_005_f000191|Ich sei Jude, damit sei alles gesagt.|Ich sei Jude, damit sei alles gesagt.
mein_weg_als_deutscher_und_jude_005_f000192|Ich könne es nicht ändern; ich wolle es nicht ändern.|Ich könne es nicht ändern; ich wolle es nicht ändern.
mein_weg_als_deutscher_und_jude_005_f000193|Also hätte ich mich nach der einen Seite entschieden?|Also hätte ich mich nach der einen Seite entschieden?
mein_weg_als_deutscher_und_jude_005_f000194|fragte er und sah mich mit seinem scharfen Blick durch die Augengläser an.|fragte er und sah mich mit seinem scharfen Blick durch die Augengläser an.
mein_weg_als_deutscher_und_jude_005_f000195|Ich versuchte, ihm zu erklären, daß ich zu der Erkenntnis gekommen sei, diese Entscheidung sei keine Notwendigkeit für mich. Nur für diejenigen sei sie eine Notwendigkeit,|Ich versuchte, ihm zu erklären, daß ich zu der Erkenntnis gekommen sei, diese Entscheidung sei keine Notwendigkeit für mich. Nur für diejenigen sei sie eine Notwendigkeit,
mein_weg_als_deutscher_und_jude_005_f000196|die sich entschlossen hätten, das Feld ihrer Wirkung freiwillig zu beschränken und sich damit zufrieden gäben, entweder aus dem Stolz des ungerecht Verkannten heraus, oder aus Müdigkeit und Schwäche;|die sich entschlossen hätten, das Feld ihrer Wirkung freiwillig zu beschränken und sich damit zufrieden gäben, entweder aus dem Stolz des ungerecht Verkannten heraus, oder aus Müdigkeit und Schwäche;
mein_weg_als_deutscher_und_jude_005_f000197|für diejenigen dann, nach der andern Seite, die die Schiffe hinter sich verbrannt hätten und sich dem Prozeß der Anpassung, Angleichung mit mehr oder minder gutem Gewissen, mehr oder minder guter Haltung überließen.|für diejenigen dann, nach der andern Seite, die die Schiffe hinter sich verbrannt hätten und sich dem Prozeß der Anpassung, Angleichung mit mehr oder minder gutem Gewissen, mehr oder minder guter Haltung überließen.
mein_weg_als_deutscher_und_jude_005_f000198|Zu beidem fehle mir die Lust, zu beidem auch der Grund.|Zu beidem fehle mir die Lust, zu beidem auch der Grund.
mein_weg_als_deutscher_und_jude_005_f000199|Ich stünde in der Welt mit einer Sendung; so viel hätte ich schon zu spüren bekommen, daß ich mich darin nicht irre, mich nicht gleichsam als leibhaftige Lüge zu betrachten habe, was dieses Bewußtsein anging.|Ich stünde in der Welt mit einer Sendung; so viel hätte ich schon zu spüren bekommen, daß ich mich darin nicht irre, mich nicht gleichsam als leibhaftige Lüge zu betrachten habe, was dieses Bewußtsein anging.
mein_weg_als_deutscher_und_jude_005_f000200|Und darin hatte ich mich zu erweisen, in nichts sonst, darin zu entscheiden, und nicht etwa ein für allemal und mir’s dann bequem werden zu lassen in meiner Haut, nein, Tag für Tag, bei jedem Schritt, mit jedem Atemzug.|Und darin hatte ich mich zu erweisen, in nichts sonst, darin zu entscheiden, und nicht etwa ein für allemal und mirs dann bequem werden zu lassen in meiner Haut, nein, Tag für Tag, bei jedem Schritt, mit jedem Atemzug.
mein_weg_als_deutscher_und_jude_005_f000201|Ich wußte, daß ich übers Ziel schoß mit dem Bequemwerdenlassen in meiner Haut, aber es fiel mir plötzlich wie Schuppen von den Augen, daß ich inne wurde, was mit den Entscheidungen gemeint war,|Ich wußte, daß ich übers Ziel schoß mit dem Bequemwerdenlassen in meiner Haut, aber es fiel mir plötzlich wie Schuppen von den Augen, daß ich inne wurde, was mit den Entscheidungen gemeint war,
mein_weg_als_deutscher_und_jude_005_f000202|die nicht in der eigenen Brust gefordert werden, sondern vom anderswollenden, herrschsüchtigen, zwiespältigen Andern.|die nicht in der eigenen Brust gefordert werden, sondern vom anderswollenden, herrschsüchtigen, zwiespältigen Andern.
mein_weg_als_deutscher_und_jude_005_f000203|Es sind Abdrängungen, Gebietsschmälerungen, Verzichtserklärungen, die er haben will.|Es sind Abdrängungen, Gebietsschmälerungen, Verzichtserklärungen, die er haben will.
mein_weg_als_deutscher_und_jude_005_f000204|Schranke will er setzen; sich will er entgegensetzen, sein Urteil, seinen Begriff, seine Form.|Schranke will er setzen; sich will er entgegensetzen, sein Urteil, seinen Begriff, seine Form.
mein_weg_als_deutscher_und_jude_005_f000205|Der Freund war etwas erstaunt über mein Ungestüm; er erwiderte bedächtig, da nähme ich entweder zu viel auf mich, das Unmögliche sogar, oder er müsse glauben, ich begnüge mich damit, ein geistiges Luxusamt zu verwalten.|Der Freund war etwas erstaunt über mein Ungestüm; er erwiderte bedächtig, da nähme ich entweder zu viel auf mich, das Unmögliche sogar, oder er müsse glauben, ich begnüge mich damit, ein geistiges Luxusamt zu verwalten.
mein_weg_als_deutscher_und_jude_005_f000206|Das verstand ich nicht; ich bat ihn, sich deutlicher auszudrücken.|Das verstand ich nicht; ich bat ihn, sich deutlicher auszudrücken.
mein_weg_als_deutscher_und_jude_005_f000207|Er sagte: es ist umsonst.|Er sagte: es ist umsonst.
mein_weg_als_deutscher_und_jude_005_f000208|– Was?|- Was?
mein_weg_als_deutscher_und_jude_005_f000209|Was ist umsonst?|Was ist umsonst?
mein_weg_als_deutscher_und_jude_005_f000210|– Er schaute mich an.|- Er schaute mich an.
mein_weg_als_deutscher_und_jude_005_f000211|Der Geist in uns und der Geist in euch mischt sich nicht, sagte er, es ist nie gewesen, es wird nie sein.|Der Geist in uns und der Geist in euch mischt sich nicht, sagte er, es ist nie gewesen, es wird nie sein.
mein_weg_als_deutscher_und_jude_005_f000212|Es gibt keine Blüte, es gibt keinen Organismus, es gibt Konglomerat.|Es gibt keine Blüte, es gibt keinen Organismus, es gibt Konglomerat.
mein_weg_als_deutscher_und_jude_005_f000213|Wo die Mischung scheinbar gelungen ist wie etwa bei Felix Mendelssohn, ist doch kein Tiefgang da, auch keine wirkliche Verschmelzung; es ist eine geniale Zwitterbildung mit übriggebliebenen Rudimenten,|Wo die Mischung scheinbar gelungen ist wie etwa bei Felix Mendelssohn, ist doch kein Tiefgang da, auch keine wirkliche Verschmelzung; es ist eine geniale Zwitterbildung mit übriggebliebenen Rudimenten,
mein_weg_als_deutscher_und_jude_005_f000214|begünstigt durch eine Epoche, in der die Invasion des fremden Wesens noch unbeträchtlich war und die Witterung für die Gefahr schwach.|begünstigt durch eine Epoche, in der die Invasion des fremden Wesens noch unbeträchtlich war und die Witterung für die Gefahr schwach.
mein_weg_als_deutscher_und_jude_005_f000215|Damals und wohl noch ein halbes Jahrhundert lang lag mehr an der Kunst als am Menschen, man erklärte die Kunst für neutral; heute wird der Mensch geprüft und gewogen, und wir wissen,|Damals und wohl noch ein halbes Jahrhundert lang lag mehr an der Kunst als am Menschen, man erklärte die Kunst für neutral; heute wird der Mensch geprüft und gewogen, und wir wissen,
mein_weg_als_deutscher_und_jude_005_f000216|daß die verführendste, vollendetste Kunst Gift- und Krankheitskeime aussäen kann.|daß die verführendste, vollendetste Kunst Gift- und Krankheitskeime aussäen kann.
mein_weg_als_deutscher_und_jude_005_f000217|Mir war das alles nicht neu und doch wieder neu.|Mir war das alles nicht neu und doch wieder neu.
mein_weg_als_deutscher_und_jude_005_f000218|In gewisser Beziehung war es wahr, in gewisser ein Abschaum von Unvernunft und Verdrehung.|In gewisser Beziehung war es wahr, in gewisser ein Abschaum von Unvernunft und Verdrehung.
mein_weg_als_deutscher_und_jude_005_f000219|Es war sehr deutsch, wie mir vorkam, sehr borniert, sehr kategorisch, Philosophie und Weltgericht aus eigener Machtvollkommenheit.|Es war sehr deutsch, wie mir vorkam, sehr borniert, sehr kategorisch, Philosophie und Weltgericht aus eigener Machtvollkommenheit.
mein_weg_als_deutscher_und_jude_005_f000220|Statt zu widersprechen, fragte ich ihn, ob er Bücher von mir kenne, irgendeines, ein einziges nur; er werde begreifen, daß ich mich nicht aus Eitelkeit danach erkundige.|Statt zu widersprechen, fragte ich ihn, ob er Bücher von mir kenne, irgendeines, ein einziges nur; er werde begreifen, daß ich mich nicht aus Eitelkeit danach erkundige.
mein_weg_als_deutscher_und_jude_005_f000221|Seine Züge wurden sonderbar starr.|Seine Züge wurden sonderbar starr.
mein_weg_als_deutscher_und_jude_005_f000222|Ich ließ ihn nicht, ich bedrängte ihn wie Jakob den Engel.|Ich ließ ihn nicht, ich bedrängte ihn wie Jakob den Engel.
mein_weg_als_deutscher_und_jude_005_f000223|Warum er es verhehle?|Warum er es verhehle?
mein_weg_als_deutscher_und_jude_005_f000224|Ob sie ihn nicht wankend gemacht hätten an seinem Lehrsatz?|Ob sie ihn nicht wankend gemacht hätten an seinem Lehrsatz?
mein_weg_als_deutscher_und_jude_005_f000225|Ob er mit der geringsten Kenntnis davon als ehrlicher Mann, als denkender, schauender, fühlender Mann das Wort aufrechterhalte?|Ob er mit der geringsten Kenntnis davon als ehrlicher Mann, als denkender, schauender, fühlender Mann das Wort aufrechterhalte?
mein_weg_als_deutscher_und_jude_005_f000226|Er wich aus.|Er wich aus.
mein_weg_als_deutscher_und_jude_005_f000227|Er schien betreten, ja beklommen.|Er schien betreten, ja beklommen.
mein_weg_als_deutscher_und_jude_005_f000228|Schließlich sagte er: Wenn ich es auch in deinem Fall bedingungsweise zugeben könnte, was wäre damit bewiesen?|Schließlich sagte er: Wenn ich es auch in deinem Fall bedingungsweise zugeben könnte, was wäre damit bewiesen?
mein_weg_als_deutscher_und_jude_005_f000229|Ich will es zugeben, weshalb nicht?|Ich will es zugeben, weshalb nicht?
mein_weg_als_deutscher_und_jude_005_f000230|Ich war ja stets der Meinung, du seiest ein Ausnahmeexemplar, ich will zugeben, daß du Ströme des Ostens zu uns geleitet, Gesichte des Ostens uns entschleiert hast; zugeben,|Ich war ja stets der Meinung, du seiest ein Ausnahmeexemplar, ich will zugeben, daß du Ströme des Ostens zu uns geleitet, Gesichte des Ostens uns entschleiert hast; zugeben,
mein_weg_als_deutscher_und_jude_005_f000231|daß deutsche Art in dir ist, Art von unserer Art, rätselhaft wie, aber sie ist da; zugeben, daß da etwas wie Verschmelzung, neue Synthese vor sich gegangen ist; aber was ist damit bewiesen?|daß deutsche Art in dir ist, Art von unserer Art, rätselhaft wie, aber sie ist da; zugeben, daß da etwas wie Verschmelzung, neue Synthese vor sich gegangen ist; aber was ist damit bewiesen?
mein_weg_als_deutscher_und_jude_005_f000232|Es wäre nur die Regel bestätigt.|Es wäre nur die Regel bestätigt.
mein_weg_als_deutscher_und_jude_005_f000233|Darauf antwortete ich ihm, inbrünstiger und eindringlicher, dünkt mich, als ich je zu ihm gesprochen: Ist es vorstellbar, so ist es möglich.|Darauf antwortete ich ihm, inbrünstiger und eindringlicher, dünkt mich, als ich je zu ihm gesprochen: Ist es vorstellbar, so ist es möglich.
mein_weg_als_deutscher_und_jude_005_f000234|Gibt es die Idee davon, so ist die Erscheinung nur die nächste Folge.|Gibt es die Idee davon, so ist die Erscheinung nur die nächste Folge.
mein_weg_als_deutscher_und_jude_005_f000235|Hat es ein Einzelner erreicht, so ist es überhaupt erreichbar.|Hat es ein Einzelner erreicht, so ist es überhaupt erreichbar.
mein_weg_als_deutscher_und_jude_005_f000236|Ich bin nur scheinbar ein Einzelner, ich stehe für alle, ich bin Ausdruck eines bestimmten Zeitwillens, Geschlechterwillens, Schicksalswillens.|Ich bin nur scheinbar ein Einzelner, ich stehe für alle, ich bin Ausdruck eines bestimmten Zeitwillens, Geschlechterwillens, Schicksalswillens.
mein_weg_als_deutscher_und_jude_005_f000237|In mir sind alle, auch die Widerstrebenden, ich schaffe Bahn für alle, ich räume die Lüge weg für alle, und daß ich da bin, ist Beweis.|In mir sind alle, auch die Widerstrebenden, ich schaffe Bahn für alle, ich räume die Lüge weg für alle, und daß ich da bin, ist Beweis.
mein_weg_als_deutscher_und_jude_005_f000238|Die Ausnahme bestätigt nicht die Regel, sie bricht die Regel.|Die Ausnahme bestätigt nicht die Regel, sie bricht die Regel.
mein_weg_als_deutscher_und_jude_005_f000239|Es ist immer ein erster Tropfen, der den Felsen durchhöhlt.|Es ist immer ein erster Tropfen, der den Felsen durchhöhlt.
mein_weg_als_deutscher_und_jude_005_f000240|Ich weiß nicht mehr, was er mir entgegnete.|Ich weiß nicht mehr, was er mir entgegnete.
mein_weg_als_deutscher_und_jude_005_f000241|Wir trennten uns dann bald.|Wir trennten uns dann bald.
mein_weg_als_deutscher_und_jude_005_f000242|Ende von abschnitt 5|Ende von abschnitt fünf
mein_weg_als_deutscher_und_jude_006_f000001|Abschnitt 6 von Mein Weg als Deutscher und Jude von Jakob Wassermann.|Abschnitt sechs von Mein Weg als Deutscher und Jude von Jakob Wassermann.
mein_weg_als_deutscher_und_jude_006_f000002|Diese Librivox Aufnahme ist in der public Domain.|Diese Librivox Aufnahme ist in der public Domain.
mein_weg_als_deutscher_und_jude_006_f000003|18|achtzehn
mein_weg_als_deutscher_und_jude_006_f000004|Ich war schon um die Mitte des Jahres 1898 von München weggezogen und hatte mein Domizil in Wien aufgeschlagen.|Ich war schon um die Mitte des Jahres tausendachthundertachtundneunzig von München weggezogen und hatte mein Domizil in Wien aufgeschlagen.
mein_weg_als_deutscher_und_jude_006_f000005|Dort konnte meines Bleibens nicht länger sein.|Dort konnte meines Bleibens nicht länger sein.
mein_weg_als_deutscher_und_jude_006_f000006|Wie schon angedeutet, hatte mich eine Frau an den Rand des Verderbens gebracht,|Wie schon angedeutet, hatte mich eine Frau an den Rand des Verderbens gebracht,
mein_weg_als_deutscher_und_jude_006_f000007|und hätte ich nicht das unheilvolle Band mit einem leidenschaftlichen Entschluß durchschnitten, so wäre es mit mir zu Ende gewesen.|und hätte ich nicht das unheilvolle Band mit einem leidenschaftlichen Entschluß durchschnitten, so wäre es mit mir zu Ende gewesen.
mein_weg_als_deutscher_und_jude_006_f000008|Vier Jahre hatte ich dumpf und flammend in einer erotischen Sklaverei verbracht, namenlos erfüllt,|Vier Jahre hatte ich dumpf und flammend in einer erotischen Sklaverei verbracht, namenlos erfüllt,
mein_weg_als_deutscher_und_jude_006_f000009|unbedingt hingegeben, dabei geschändet und mißbraucht im Innern; meine ganze Natur war davon versengt und angefault,|unbedingt hingegeben, dabei geschändet und mißbraucht im Innern; meine ganze Natur war davon versengt und angefault,
mein_weg_als_deutscher_und_jude_006_f000010|meine moralische Existenz bedroht, meine bürgerliche schwankte schon, Freunde kehrten sich ab, Wohlwollende verschlossen mir ihr Haus, Verleumdung und Klatsch besudelten meinen Namen,|meine moralische Existenz bedroht, meine bürgerliche schwankte schon, Freunde kehrten sich ab, Wohlwollende verschlossen mir ihr Haus, Verleumdung und Klatsch besudelten meinen Namen,
mein_weg_als_deutscher_und_jude_006_f000011|und so gab es am Ende keine Rettung als Bruch und Flucht.|und so gab es am Ende keine Rettung als Bruch und Flucht.
mein_weg_als_deutscher_und_jude_006_f000012|Vielleicht hätte ich mich nicht aufzuraffen und die Fesseln zu zerreißen vermocht, wäre nicht ein junges Mädchen gewesen, eine siebzehnjährige russische Jüdin,|Vielleicht hätte ich mich nicht aufzuraffen und die Fesseln zu zerreißen vermocht, wäre nicht ein junges Mädchen gewesen, eine siebzehnjährige russische Jüdin,
mein_weg_als_deutscher_und_jude_006_f000013|die wie ein liebendes Madonnchen in meinen verwunschenen Kreis trat und, wenn ich’s recht bedenke, die erste Glückbringerin war.|die wie ein liebendes Madonnchen in meinen verwunschenen Kreis trat und, wenn ichs recht bedenke, die erste Glückbringerin war.
mein_weg_als_deutscher_und_jude_006_f000014|Nur durch ihre Art zu sein, zu lächeln, zu verstehen, eine stummschenkende, ergreifend wahre Art, half sie mir über das Schwere und machte, daß ich vergaß und beharrte.|Nur durch ihre Art zu sein, zu lächeln, zu verstehen, eine stummschenkende, ergreifend wahre Art, half sie mir über das Schwere und machte, daß ich vergaß und beharrte.
mein_weg_als_deutscher_und_jude_006_f000015|Sie war Tabakarbeiterin, in ärmlichsten Verhältnissen, doch sie hätte eine junge Fürstin sein können; sie war so stolz wie anmutig, so großen Sinns wie gehalten in ihrem Wesen.|Sie war Tabakarbeiterin, in ärmlichsten Verhältnissen, doch sie hätte eine junge Fürstin sein können; sie war so stolz wie anmutig, so großen Sinns wie gehalten in ihrem Wesen.
mein_weg_als_deutscher_und_jude_006_f000016|Rasch, wie wir uns gefunden, verloren wir uns wieder.|Rasch, wie wir uns gefunden, verloren wir uns wieder.
mein_weg_als_deutscher_und_jude_006_f000017|Das Leben in Wien und Österreich wirkte wohltätig auf mich durch seine leichtere Form.|Das Leben in Wien und Österreich wirkte wohltätig auf mich durch seine leichtere Form.
mein_weg_als_deutscher_und_jude_006_f000018|Da waren Widerstände aufgehoben, die ich bei uns auf Schritt und Tritt gespürt hatte.|Da waren Widerstände aufgehoben, die ich bei uns auf Schritt und Tritt gespürt hatte.
mein_weg_als_deutscher_und_jude_006_f000019|Die Menschen kamen mir freier entgegen, williger, offener, und wenn es sich auch meistens erwies, daß sie sich durch ihr Entgegenkommen nicht für sonderlich verpflichtet hielten, ja,|Die Menschen kamen mir freier entgegen, williger, offener, und wenn es sich auch meistens erwies, daß sie sich durch ihr Entgegenkommen nicht für sonderlich verpflichtet hielten, ja,
mein_weg_als_deutscher_und_jude_006_f000020|daß sie gewissermaßen jedem ausgestellten Wechsel auf Verläßlichkeit mit naivem Bedauern bei der Vorzeigung die Anerkennung und natürlich auch die Zahlung verweigerten,|daß sie gewissermaßen jedem ausgestellten Wechsel auf Verläßlichkeit mit naivem Bedauern bei der Vorzeigung die Anerkennung und natürlich auch die Zahlung verweigerten,
mein_weg_als_deutscher_und_jude_006_f000021|überhaupt in listig-unschuldige Verwunderung gerieten, wenn man sich einfallen ließ, aus ihrem Wort die Folgerung des Vertrauens zu ziehen, so war doch der Alltag ohne die verletzende Reibung, der Ton des Verkehrs gutmütiger und unverfänglicher.|überhaupt in listig-unschuldige Verwunderung gerieten, wenn man sich einfallen ließ, aus ihrem Wort die Folgerung des Vertrauens zu ziehen, so war doch der Alltag ohne die verletzende Reibung, der Ton des Verkehrs gutmütiger und unverfänglicher.
mein_weg_als_deutscher_und_jude_006_f000022|Man mußte nur wissen; man mußte sich mit einer bestimmten Erfahrung gürten und nicht immer mit dem schmucklosen Anspruch auf den Plan treten.|Man mußte nur wissen; man mußte sich mit einer bestimmten Erfahrung gürten und nicht immer mit dem schmucklosen Anspruch auf den Plan treten.
mein_weg_als_deutscher_und_jude_006_f000023|Das lernt sich.|Das lernt sich.
mein_weg_als_deutscher_und_jude_006_f000024|Es lernt sich auch bei einiger Schmiegsamkeit in Italien, wo verwandte Fehler den moralischen Hochmut des Deutschen reizen.|Es lernt sich auch bei einiger Schmiegsamkeit in Italien, wo verwandte Fehler den moralischen Hochmut des Deutschen reizen.
mein_weg_als_deutscher_und_jude_006_f000025|Aber dies geht wohl tiefer, und es ist nötig, die Tiefe zu sondieren.|Aber dies geht wohl tiefer, und es ist nötig, die Tiefe zu sondieren.
mein_weg_als_deutscher_und_jude_006_f000026|Ich lebte ja nicht nur dem Bild und Gedicht; ich war auch, im heimlichen Bewußtsein, darauf angewiesen, den Boden zu erforschen, auf dem es Wurzel schlägt und die Atmosphäre, in der es gedeiht.|Ich lebte ja nicht nur dem Bild und Gedicht; ich war auch, im heimlichen Bewußtsein, darauf angewiesen, den Boden zu erforschen, auf dem es Wurzel schlägt und die Atmosphäre, in der es gedeiht.
mein_weg_als_deutscher_und_jude_006_f000027|Ich wußte um die Menschen, die Vorwand waren zur Gestalt, und in die Absonderung, die ich mir hart erkämpfte, drang ihre Welt noch laut genug.|Ich wußte um die Menschen, die Vorwand waren zur Gestalt, und in die Absonderung, die ich mir hart erkämpfte, drang ihre Welt noch laut genug.
mein_weg_als_deutscher_und_jude_006_f000028|Heute steht diese österreichische Welt vor mir, wie ich sie zwei Jahrzehnte hindurch erlebt habe, halb nehmend, halb wehrend.|Heute steht diese österreichische Welt vor mir, wie ich sie zwei Jahrzehnte hindurch erlebt habe, halb nehmend, halb wehrend.
mein_weg_als_deutscher_und_jude_006_f000029|Ich war als erzogener Deutscher gewöhnt, eben das Deutsche, Land und Volk, als ein Ganzes zu empfinden, unbezweifelbar, in seiner Rundheit und Faßlichkeit erfreulich, in keinem Bezug mißzuverstehen.|Ich war als erzogener Deutscher gewöhnt, eben das Deutsche, Land und Volk, als ein Ganzes zu empfinden, unbezweifelbar, in seiner Rundheit und Faßlichkeit erfreulich, in keinem Bezug mißzuverstehen.
mein_weg_als_deutscher_und_jude_006_f000030|Hier dagegen war durchaus alles fragwürdig, Land, Volk, Staatsform, Lebensform, Nationalität und Gesellschaft, Überlieferung und Abfall von ihr, Politik und Kunst, Organisation und Individuen.|Hier dagegen war durchaus alles fragwürdig, Land, Volk, Staatsform, Lebensform, Nationalität und Gesellschaft, Überlieferung und Abfall von ihr, Politik und Kunst, Organisation und Individuen.
mein_weg_als_deutscher_und_jude_006_f000031|Das Fragwürdige übt Lockung aus, namentlich in seiner Oberflächenschicht, und die Genießer und Ferienbeobachter haben ja nicht versäumt, sich in ihrer Weise daran zu letzen.|Das Fragwürdige übt Lockung aus, namentlich in seiner Oberflächenschicht, und die Genießer und Ferienbeobachter haben ja nicht versäumt, sich in ihrer Weise daran zu letzen.
