mein_weg_als_deutscher_und_jude_002_f000125|Im ganzen Betrieb herrschte eigentümliche Tücke und Aufsässigkeit.|Im ganzen Betrieb herrschte eigentümliche Tücke und Aufsässigkeit.
mein_weg_als_deutscher_und_jude_002_f000126|Man verlangte die niedrigsten Dienstleistungen von mir, und ohne zu wissen wie, war ich alsbald das Ziel eines niedrigen Intrigenwesens, der Verleumdung und der Bosheit.|Man verlangte die niedrigsten Dienstleistungen von mir, und ohne zu wissen wie, war ich alsbald das Ziel eines niedrigen Intrigenwesens, der Verleumdung und der Bosheit.
mein_weg_als_deutscher_und_jude_002_f000127|Zehn Monate nahm ich mich zusammen, um meinem Versprechen treu zu bleiben.|Zehn Monate nahm ich mich zusammen, um meinem Versprechen treu zu bleiben.
mein_weg_als_deutscher_und_jude_002_f000128|Ein frecher Bubenstreich machte der Sache ein Ende.|Ein frecher Bubenstreich machte der Sache ein Ende.
mein_weg_als_deutscher_und_jude_002_f000129|Der Prokurist fand eines Tages während meiner Abwesenheit in meinem Pult einige pornographische Photographien, ich wurde vor ein Tribunal zitiert, ich wußte von nichts, ich hatte dergleichen Bilder nie gesehen,|Der Prokurist fand eines Tages während meiner Abwesenheit in meinem Pult einige pornographische Photographien, ich wurde vor ein Tribunal zitiert, ich wußte von nichts, ich hatte dergleichen Bilder nie gesehen,
mein_weg_als_deutscher_und_jude_002_f000130|ich verschmähte es, mich zu verteidigen, verließ den Posten und erklärte meinem Onkel rundweg, daß ich mit solchen Menschen nichts mehr zu schaffen haben wolle.|ich verschmähte es, mich zu verteidigen, verließ den Posten und erklärte meinem Onkel rundweg, daß ich mit solchen Menschen nichts mehr zu schaffen haben wolle.
mein_weg_als_deutscher_und_jude_002_f000131|Eine junge Praktikantin, die mir ihre Zuneigung geschenkt hatte, ruhte nicht, bis sie die Verschwörung aufgedeckt und den Schuldigen zum Geständnis gezwungen hatte, aber das war nunmehr zu spät.|Eine junge Praktikantin, die mir ihre Zuneigung geschenkt hatte, ruhte nicht, bis sie die Verschwörung aufgedeckt und den Schuldigen zum Geständnis gezwungen hatte, aber das war nunmehr zu spät.
mein_weg_als_deutscher_und_jude_002_f000132|Der Familienrat war in Verlegenheit: ich war zur Kalamität geworden, und man wollte mich los sein, wenn nicht auf gute Manier, so auf schlechte.|Der Familienrat war in Verlegenheit: ich war zur Kalamität geworden, und man wollte mich los sein, wenn nicht auf gute Manier, so auf schlechte.
mein_weg_als_deutscher_und_jude_002_f000133|Es wurde beschlossen, daß ich mein Militärjahr absolvieren und, falls ich nach Verlauf dieses Jahres nicht zur Vernunft gekommen sei, meinem Schicksal überlassen werden sollte.|Es wurde beschlossen, daß ich mein Militärjahr absolvieren und, falls ich nach Verlauf dieses Jahres nicht zur Vernunft gekommen sei, meinem Schicksal überlassen werden sollte.
mein_weg_als_deutscher_und_jude_002_f000134|Ich wurde also wieder nach Würzburg geschickt, stellte mich dort in der Kaserne und wurde aufgenommen.|Ich wurde also wieder nach Würzburg geschickt, stellte mich dort in der Kaserne und wurde aufgenommen.
mein_weg_als_deutscher_und_jude_002_f000135|Zur Bestreitung der Kosten wurde die Hälfte eines kleinen mütterlichen Erbteils flüssig gemacht, etwa tausend Mark;|Zur Bestreitung der Kosten wurde die Hälfte eines kleinen mütterlichen Erbteils flüssig gemacht, etwa tausend Mark;
mein_weg_als_deutscher_und_jude_002_f000136|und davon sollte ich nicht nur ein ganzes Jahr leben, sondern auch die unerläßlichen Ausgaben für den Dienst, die Uniformierung, die Repräsentation aufbringen.|und davon sollte ich nicht nur ein ganzes Jahr leben, sondern auch die unerläßlichen Ausgaben für den Dienst, die Uniformierung, die Repräsentation aufbringen.
mein_weg_als_deutscher_und_jude_002_f000137|Ich trat sonach in die Armee als mittelloser Privilegierter ein, unglückselige Mischung, wie ich bald spüren sollte.|Ich trat sonach in die Armee als mittelloser Privilegierter ein, unglückselige Mischung, wie ich bald spüren sollte.
mein_weg_als_deutscher_und_jude_002_f000138|Jude und arm, das erregte doppelte Geringschätzung, bei der Mannschaft wie bei den Offizieren.|Jude und arm, das erregte doppelte Geringschätzung, bei der Mannschaft wie bei den Offizieren.
mein_weg_als_deutscher_und_jude_002_f000139|Im übrigen beging ich gleich zu Beginn eine Torheit und Einfältigkeit, von der das Odium während des ganzen Jahres an mir haften blieb.|Im übrigen beging ich gleich zu Beginn eine Torheit und Einfältigkeit, von der das Odium während des ganzen Jahres an mir haften blieb.
mein_weg_als_deutscher_und_jude_002_f000140|Lächerlicherweise nämlich schloß ich das schriftliche #Curriculum vitae,# dessen Anfertigung in den ersten Tagen verlangt wurde, mit einem schwermütigen Gedicht, das, soweit ich mich erinnere, die Vergeblichkeit irdischen Strebens und des meinen insbesonders zum Motiv hatte.|Lächerlicherweise nämlich schloß ich das schriftliche Curriculum vitae, dessen Anfertigung in den ersten Tagen verlangt wurde, mit einem schwermütigen Gedicht, das, soweit ich mich erinnere, die Vergeblichkeit irdischen Strebens und des meinen insbesonders zum Motiv hatte.
mein_weg_als_deutscher_und_jude_002_f000141|Der Feldwebel las die gereimten Verse beim Rapport unter allgemeinem Hallo vor und hielt mir eine niederschmetternde Standrede, als hätte ich das gesamte deutsche Heer verhöhnt.|Der Feldwebel las die gereimten Verse beim Rapport unter allgemeinem Hallo vor und hielt mir eine niederschmetternde Standrede, als hätte ich das gesamte deutsche Heer verhöhnt.
mein_weg_als_deutscher_und_jude_002_f000142|8|acht
mein_weg_als_deutscher_und_jude_002_f000143|Erlebnis will mit Freiheit behandelt sein, sonst bleibt es dem Zufälligen verhaftet oder ans Eitle verdingt.|Erlebnis will mit Freiheit behandelt sein, sonst bleibt es dem Zufälligen verhaftet oder ans Eitle verdingt.
mein_weg_als_deutscher_und_jude_002_f000144|Da eine eigentliche Lebensbeschreibung hier nicht beabsichtigt ist, sondern nur Darstellung eines schicksalhaften Konflikts, genüge als Zusammenhängendes der bisherige Bericht, der lediglich aufzeigen soll, wie ich geworden, und auf welchem Boden ich gewachsen bin.|Da eine eigentliche Lebensbeschreibung hier nicht beabsichtigt ist, sondern nur Darstellung eines schicksalhaften Konflikts, genüge als Zusammenhängendes der bisherige Bericht, der lediglich aufzeigen soll, wie ich geworden, und auf welchem Boden ich gewachsen bin.
mein_weg_als_deutscher_und_jude_002_f000145|Der Weg wird nun schmaler und bestimmter, die Richtung energischer sein müssen, Gebot der Verknüpfung hat zurückzutreten gegen die Folge und Stufung des Entscheidenden.|Der Weg wird nun schmaler und bestimmter, die Richtung energischer sein müssen, Gebot der Verknüpfung hat zurückzutreten gegen die Folge und Stufung des Entscheidenden.
mein_weg_als_deutscher_und_jude_002_f000146|Obwohl ich meine Ehre und ganze Kraft darein setzte, als Soldat meine Pflicht zu tun und das geforderte Maß der Leistung zu erfüllen, wozu bisweilen keine geringe Selbstüberwindung nötig war, gelang es mir nicht,|Obwohl ich meine Ehre und ganze Kraft darein setzte, als Soldat meine Pflicht zu tun und das geforderte Maß der Leistung zu erfüllen, wozu bisweilen keine geringe Selbstüberwindung nötig war, gelang es mir nicht,
mein_weg_als_deutscher_und_jude_002_f000147|die Anerkennung meiner Vorgesetzten zu erringen, und ich merkte bald, daß es mir auch bei exemplarischer Führung nicht gelungen wäre, daß es nicht gelingen konnte, weil Absicht dawider war.|die Anerkennung meiner Vorgesetzten zu erringen, und ich merkte bald, daß es mir auch bei exemplarischer Führung nicht gelungen wäre, daß es nicht gelingen konnte, weil Absicht dawider war.
mein_weg_als_deutscher_und_jude_002_f000148|Ich merkte es an der verächtlichen Haltung der Offiziere, an der unverhehlten Tendenz, die befriedigende Leistung selbstverständlich zu finden, die unbefriedigende an den Pranger zu stellen.|Ich merkte es an der verächtlichen Haltung der Offiziere, an der unverhehlten Tendenz, die befriedigende Leistung selbstverständlich zu finden, die unbefriedigende an den Pranger zu stellen.
mein_weg_als_deutscher_und_jude_002_f000149|Von gesellschaftlicher Annäherung konnte nicht die Rede sein, menschliche Qualität wurde nicht einmal erwogen, Geist oder auch nur jede originelle Form der Äußerung erweckte sofort Argwohn,|Von gesellschaftlicher Annäherung konnte nicht die Rede sein, menschliche Qualität wurde nicht einmal erwogen, Geist oder auch nur jede originelle Form der Äußerung erweckte sofort Argwohn,
mein_weg_als_deutscher_und_jude_002_f000150|Beförderung über eine zugestandene Grenze hinaus kam nicht in Frage, alles, weil die bürgerliche Legitimation unter der Rubrik Glaubensbekenntnis die Bezeichnung Jude trug.|Beförderung über eine zugestandene Grenze hinaus kam nicht in Frage, alles, weil die bürgerliche Legitimation unter der Rubrik Glaubensbekenntnis die Bezeichnung Jude trug.
mein_weg_als_deutscher_und_jude_002_f000151|Aber dies ist ja hinlänglich bekannt, niemand hat sich schließlich mehr darüber gewundert, auch ich war von vornherein mit der Situation vertraut, was ja an sich schlimm genug ist und eine beständige Trübung der allgemeinen Lebensstimmung herbeiführen muß.|Aber dies ist ja hinlänglich bekannt, niemand hat sich schließlich mehr darüber gewundert, auch ich war von vornherein mit der Situation vertraut, was ja an sich schlimm genug ist und eine beständige Trübung der allgemeinen Lebensstimmung herbeiführen muß.
mein_weg_als_deutscher_und_jude_002_f000152|Auffallender, weitaus quälender war mir in dieser Beziehung das Verhalten der Mannschaften.|Auffallender, weitaus quälender war mir in dieser Beziehung das Verhalten der Mannschaften.
mein_weg_als_deutscher_und_jude_002_f000153|Zum erstenmal begegnete ich jenem in den Volkskörper gedrungenen dumpfen, starren, fast sprachlosen Haß, von dem der Name Antisemitismus fast nichts aussagt, weil er weder die Art, noch die Quelle, noch die Tiefe, noch das Ziel zu erkennen gibt.|Zum erstenmal begegnete ich jenem in den Volkskörper gedrungenen dumpfen, starren, fast sprachlosen Haß, von dem der Name Antisemitismus fast nichts aussagt, weil er weder die Art, noch die Quelle, noch die Tiefe, noch das Ziel zu erkennen gibt.
mein_weg_als_deutscher_und_jude_002_f000154|Dieser Haß hat Züge des Aberglaubens ebenso wie der freiwilligen Verblendung, der Dämonenfurcht wie der pfäffischen Verstocktheit, der Ranküne des Benachteiligten, Betrogenen ebenso wie der Unwissenheit,|Dieser Haß hat Züge des Aberglaubens ebenso wie der freiwilligen Verblendung, der Dämonenfurcht wie der pfäffischen Verstocktheit, der Ranküne des Benachteiligten, Betrogenen ebenso wie der Unwissenheit,
mein_weg_als_deutscher_und_jude_002_f000155|der Lüge und Gewissenlosigkeit wie der berechtigten Abwehr, affenhafter Bosheit wie des religiösen Fanatismus.|der Lüge und Gewissenlosigkeit wie der berechtigten Abwehr, affenhafter Bosheit wie des religiösen Fanatismus.
mein_weg_als_deutscher_und_jude_002_f000156|Gier und Neugier sind in ihm, Blutdurst, Angst verführt, verlockt zu werden, Lust am Geheimnis und Niedrigkeit der Selbsteinschätzung.|Gier und Neugier sind in ihm, Blutdurst, Angst verführt, verlockt zu werden, Lust am Geheimnis und Niedrigkeit der Selbsteinschätzung.
mein_weg_als_deutscher_und_jude_002_f000157|Er ist in solcher Verquickung und Hintergründigkeit ein besonderes deutsches Phänomen.|Er ist in solcher Verquickung und Hintergründigkeit ein besonderes deutsches Phänomen.
mein_weg_als_deutscher_und_jude_002_f000158|Es ist ein deutscher Haß.|Es ist ein deutscher Haß.
mein_weg_als_deutscher_und_jude_002_f000159|Jeder redliche und sich achtende Jude muß, wenn ihn zuerst dieser Gifthauch anweht und er sich über dessen Beschaffenheit klar zu werden versucht, in nachhaltige Bestürzung geraten.|Jeder redliche und sich achtende Jude muß, wenn ihn zuerst dieser Gifthauch anweht und er sich über dessen Beschaffenheit klar zu werden versucht, in nachhaltige Bestürzung geraten.
mein_weg_als_deutscher_und_jude_002_f000160|Und so erging es auch mir.|Und so erging es auch mir.
mein_weg_als_deutscher_und_jude_002_f000161|Kam hinzu, daß die katholische Bevölkerung Unterfrankens, reichlich durchsetzt mit einem unerfreulichen Schlag noch halb ghettohafter, handelsbeflissener, wuchernder Juden, Krämer, Trödler, Viehhändler, Hausierer,|Kam hinzu, daß die katholische Bevölkerung Unterfrankens, reichlich durchsetzt mit einem unerfreulichen Schlag noch halb ghettohafter, handelsbeflissener, wuchernder Juden, Krämer, Trödler, Viehhändler, Hausierer,
mein_weg_als_deutscher_und_jude_002_f000162|einer dauernden Verhetzung preisgegeben war, an Urbanität und natürlicher Gutherzigkeit weit unter benachbarten Stämmen stand und das Andenken an Brunnenvergiftungs- und Passahschlachtungsmärchen, bischöfliche Bluterlässe, mörderische und gewinnbringende Judenverfolgungen noch lebendig im Sinne trug.|einer dauernden Verhetzung preisgegeben war, an Urbanität und natürlicher Gutherzigkeit weit unter benachbarten Stämmen stand und das Andenken an Brunnenvergiftungs- und Passahschlachtungsmärchen, bischöfliche Bluterlässe, mörderische und gewinnbringende Judenverfolgungen noch lebendig im Sinne trug.
mein_weg_als_deutscher_und_jude_002_f000163|Es geschah, daß ich zu einem jungen Menschen in förderliche Beziehungen trat;|Es geschah, daß ich zu einem jungen Menschen in förderliche Beziehungen trat;
mein_weg_als_deutscher_und_jude_002_f000164|wenn dann die gewisse Enthüllung unvermeidlich war, zog er sich entweder vorsichtig zurück, oder er gab sich eine Weile unbefangen, um schließlich doch ein schwer bekämpfbares Mißtrauen durchblicken zu lassen,|wenn dann die gewisse Enthüllung unvermeidlich war, zog er sich entweder vorsichtig zurück, oder er gab sich eine Weile unbefangen, um schließlich doch ein schwer bekämpfbares Mißtrauen durchblicken zu lassen,
mein_weg_als_deutscher_und_jude_002_f000165|oder er ließ mich verstehen, daß er in meiner Person eine Ausnahme statuiere und sich seines begründeten Vorurteils zu meinen Gunsten entäußere.|oder er ließ mich verstehen, daß er in meiner Person eine Ausnahme statuiere und sich seines begründeten Vorurteils zu meinen Gunsten entäußere.
mein_weg_als_deutscher_und_jude_002_f000166|Das war dann das Beleidigendste von allem.|Das war dann das Beleidigendste von allem.
mein_weg_als_deutscher_und_jude_002_f000167|Eher noch können wir es ertragen, daß das Individuum in uns für minderwertig proklamiert wird, als die Gattung;|Eher noch können wir es ertragen, daß das Individuum in uns für minderwertig proklamiert wird, als die Gattung;
mein_weg_als_deutscher_und_jude_002_f000168|eher noch darf der Charakter verdächtigt werden, als die Geburt;|eher noch darf der Charakter verdächtigt werden, als die Geburt;
mein_weg_als_deutscher_und_jude_002_f000169|gegen jenes kann man sich retten, man kann den Irrtum beweisen, oder wenigstens sich einbilden, ihn widerlegen zu können;|gegen jenes kann man sich retten, man kann den Irrtum beweisen, oder wenigstens sich einbilden, ihn widerlegen zu können;
mein_weg_als_deutscher_und_jude_002_f000170|gegen dieses sind alle Argumente und Beispiele machtlos, und der gehütetste innerste Spiegel des Bewußtseins trübt und befleckt sich.|gegen dieses sind alle Argumente und Beispiele machtlos, und der gehütetste innerste Spiegel des Bewußtseins trübt und befleckt sich.
mein_weg_als_deutscher_und_jude_002_f000171|Als ich nach der Entlassung vom Militärdienst nach Nürnberg kam, wo man mir eine schlechtbezahlte und untergeordnete Stellung in einer Kanzlei angeboten hatte, war ich in einem wesentlichen Teil des Verhältnisses zur Welt schon gelähmt.|Als ich nach der Entlassung vom Militärdienst nach Nürnberg kam, wo man mir eine schlechtbezahlte und untergeordnete Stellung in einer Kanzlei angeboten hatte, war ich in einem wesentlichen Teil des Verhältnisses zur Welt schon gelähmt.
mein_weg_als_deutscher_und_jude_002_f000172|Die Verbindung, die der Stolz in einem mit der Furcht vor Erniedrigung eingeht, ist für die Sittlichkeit und Freiheit des Handelns die schädigendste.|Die Verbindung, die der Stolz in einem mit der Furcht vor Erniedrigung eingeht, ist für die Sittlichkeit und Freiheit des Handelns die schädigendste.
mein_weg_als_deutscher_und_jude_002_f000173|Ist das errungene Gefühl des eigenen Wertes unverlierbar geworden, so rettet vor der Verbitterung nur die Isolierung, der Entschluß, sich suchen und finden zu lassen, die Sehnsucht nach dem, der suchen und finden wird.|Ist das errungene Gefühl des eigenen Wertes unverlierbar geworden, so rettet vor der Verbitterung nur die Isolierung, der Entschluß, sich suchen und finden zu lassen, die Sehnsucht nach dem, der suchen und finden wird.
mein_weg_als_deutscher_und_jude_002_f000174|Es ist das Wunderbare der Jugend, daß sie am Menschen nie ganz zu verzweifeln vermag, eher wirft sie sich selbst weg, als daß sie aufhört, an den Menschen, dies geträumte Bild vom Menschen zu glauben.|Es ist das Wunderbare der Jugend, daß sie am Menschen nie ganz zu verzweifeln vermag, eher wirft sie sich selbst weg, als daß sie aufhört, an den Menschen, dies geträumte Bild vom Menschen zu glauben.
mein_weg_als_deutscher_und_jude_002_f000175|Und so warf auch ich mich weg damals.|Und so warf auch ich mich weg damals.
mein_weg_als_deutscher_und_jude_002_f000176|Ich geriet in schlechte Gesellschaft;|Ich geriet in schlechte Gesellschaft;
mein_weg_als_deutscher_und_jude_002_f000177|ich hatte unhemmbares Verlangen nach geistigem Umgang und stürzte in die Kloake des Geistes, mich dürstete nach Bestätigung, und ich wurde aus mühselig eroberten Festen geschleudert, ich wünschte mir das Wort,|ich hatte unhemmbares Verlangen nach geistigem Umgang und stürzte in die Kloake des Geistes, mich dürstete nach Bestätigung, und ich wurde aus mühselig eroberten Festen geschleudert, ich wünschte mir das Wort,
mein_weg_als_deutscher_und_jude_002_f000178|das nicht seinen ganzen Gehalt aus Geld, Schweiß und Plage bezieht und wurde von dem besudelnden getroffen, dem, das Geistesart und Geisteshaltung äfft.|das nicht seinen ganzen Gehalt aus Geld, Schweiß und Plage bezieht und wurde von dem besudelnden getroffen, dem, das Geistesart und Geisteshaltung äfft.
mein_weg_als_deutscher_und_jude_002_f000179|Mehr ist schlechterdings nicht zu sagen nötig, um die Existenz zu kennzeichnen, die ich durch Jahr und Tag führte;|Mehr ist schlechterdings nicht zu sagen nötig, um die Existenz zu kennzeichnen, die ich durch Jahr und Tag führte;
mein_weg_als_deutscher_und_jude_002_f000180|was sollte es frommen, das häßliche Einzelne wieder hervorzuziehen aus dem Grab der Zeit, die in schmutzigen Kneipen verbrachten Nächte, Ekstasen eines ziemlich ideenlosen Rebellentums, jämmerlichen Selbstverlust,|was sollte es frommen, das häßliche Einzelne wieder hervorzuziehen aus dem Grab der Zeit, die in schmutzigen Kneipen verbrachten Nächte, Ekstasen eines ziemlich ideenlosen Rebellentums, jämmerlichen Selbstverlust,
mein_weg_als_deutscher_und_jude_002_f000181|Prahlerei mit Armut, versäumte Pflicht, würgende Not, billige Herausforderung des Bürgers.|Prahlerei mit Armut, versäumte Pflicht, würgende Not, billige Herausforderung des Bürgers.
mein_weg_als_deutscher_und_jude_002_f000182|Es ist heute nicht neu und war zu seiner Stunde nicht neu.|Es ist heute nicht neu und war zu seiner Stunde nicht neu.
mein_weg_als_deutscher_und_jude_002_f000183|Auch von dem Ring der traurigen Figuren zu sprechen, lohnt nicht.|Auch von dem Ring der traurigen Figuren zu sprechen, lohnt nicht.
mein_weg_als_deutscher_und_jude_002_f000184|So trüb oder auch merkwürdig die Schicksale, so mittelmäßig der Zuschnitt im ganzen.|So trüb oder auch merkwürdig die Schicksale, so mittelmäßig der Zuschnitt im ganzen.
mein_weg_als_deutscher_und_jude_002_f000185|In allen Winkelkaffeehäusern der Erde wird von allen malkontenten und impotenten Künstlern, Literaten und verkrachten Studenten, von allen Falstaffs und Pistols, Collines und Hjalmar Ekdals dieselbe Phrase in derselben Manier vom Rausch bis in den Katzenjammer totgeschleift.|In allen Winkelkaffeehäusern der Erde wird von allen malkontenten und impotenten Künstlern, Literaten und verkrachten Studenten, von allen Falstaffs und Pistols, Collines und Hjalmar Ekdals dieselbe Phrase in derselben Manier vom Rausch bis in den Katzenjammer totgeschleift.
mein_weg_als_deutscher_und_jude_002_f000186|Was als Ingredienz zu tieferer Lebensbestimmung vom Treiben jener Jahre für mich blieb, war einerseits die Stadt, Monument des Mittelalters, wie durch Zauberfluch ruhend inmitten tobender Betriebsamkeit, fieberhafter,|Was als Ingredienz zu tieferer Lebensbestimmung vom Treiben jener Jahre für mich blieb, war einerseits die Stadt, Monument des Mittelalters, wie durch Zauberfluch ruhend inmitten tobender Betriebsamkeit, fieberhafter,
mein_weg_als_deutscher_und_jude_002_f000187|von Tag zu Tag anschwellender Industrie, Ausgangspunkt fast und werdendes Zentrum des Kampfes zwischen Bürgertum und Proletariat;|von Tag zu Tag anschwellender Industrie, Ausgangspunkt fast und werdendes Zentrum des Kampfes zwischen Bürgertum und Proletariat;
mein_weg_als_deutscher_und_jude_002_f000188|es ist mir immer symbolisch bedeutend für diese Konstellation erschienen, daß die erste Eisenbahn Europas zwischen Nürnberg und Fürth lief.|es ist mir immer symbolisch bedeutend für diese Konstellation erschienen, daß die erste Eisenbahn Europas zwischen Nürnberg und Fürth lief.
mein_weg_als_deutscher_und_jude_002_f000189|Andrerseits, im natürlichen Zusammenhang damit, war Anblick und Erfahrung einer schroff geteilten Menschenwelt, Welt von Beschauenden, Stillen, Vergehenden und Welt von Wollenden, Überlauten, Kommenden.|Andrerseits, im natürlichen Zusammenhang damit, war Anblick und Erfahrung einer schroff geteilten Menschenwelt, Welt von Beschauenden, Stillen, Vergehenden und Welt von Wollenden, Überlauten, Kommenden.
mein_weg_als_deutscher_und_jude_002_f000190|Alles das in begrenztem Kreis, hingestellt wie zum Exempel und Experiment, im Herzen Deutschlands.|Alles das in begrenztem Kreis, hingestellt wie zum Exempel und Experiment, im Herzen Deutschlands.
mein_weg_als_deutscher_und_jude_002_f000191|Die Schalen schwankten vor mir auf und ab.|Die Schalen schwankten vor mir auf und ab.
mein_weg_als_deutscher_und_jude_002_f000192|Ich war nicht gesonnen, mein Schicksal an eine von ihnen zu hängen.|Ich war nicht gesonnen, mein Schicksal an eine von ihnen zu hängen.
mein_weg_als_deutscher_und_jude_002_f000193|Von dort wurde mir Zärtlichkeit alter Formen geschenkt, Ehrfurcht vor Überlieferung, Hauch der Geschichte, Innensein, Gabe, das Umfriedete, Geschlossene, Gesicherte zu spüren und zu denken;|Von dort wurde mir Zärtlichkeit alter Formen geschenkt, Ehrfurcht vor Überlieferung, Hauch der Geschichte, Innensein, Gabe, das Umfriedete, Geschlossene, Gesicherte zu spüren und zu denken;
mein_weg_als_deutscher_und_jude_002_f000194|von hier kam die Vision der neuen Dinge, Begriff und Gesicht verwandelter Zeit, im übrigen freilich Kälte, Kälte der Seelen, Trägheit der Seelen, Verkrustung der Seelen.|von hier kam die Vision der neuen Dinge, Begriff und Gesicht verwandelter Zeit, im übrigen freilich Kälte, Kälte der Seelen, Trägheit der Seelen, Verkrustung der Seelen.
mein_weg_als_deutscher_und_jude_002_f000195|Wenn ich mit jenen nun Versunkenen nicht versunken bin, so habe ich es vielleicht einem Menschen zu danken, der im bedenklichsten Augenblick wie ein Retter in mein Leben getreten ist.|Wenn ich mit jenen nun Versunkenen nicht versunken bin, so habe ich es vielleicht einem Menschen zu danken, der im bedenklichsten Augenblick wie ein Retter in mein Leben getreten ist.
mein_weg_als_deutscher_und_jude_002_f000196|Ich hatte seine Sympathie erweckt, er beobachtete mich, näherte sich mir, zeigte mir die Gefahr, und seine sanfte, geduldige, liebevolle Überredung bewirkte, daß ich das verrottet-unfruchtbare Treiben verabscheuen und meiden lernte.|Ich hatte seine Sympathie erweckt, er beobachtete mich, näherte sich mir, zeigte mir die Gefahr, und seine sanfte, geduldige, liebevolle Überredung bewirkte, daß ich das verrottet-unfruchtbare Treiben verabscheuen und meiden lernte.
mein_weg_als_deutscher_und_jude_002_f000197|Was ernsthafter Zuspruch nicht fertig brachte, erreichte er durch kaustischen Humor, durch die beispielhafte Anekdote, denn er war ein unermüdlicher Erzähler und barst von Geschichten.|Was ernsthafter Zuspruch nicht fertig brachte, erreichte er durch kaustischen Humor, durch die beispielhafte Anekdote, denn er war ein unermüdlicher Erzähler und barst von Geschichten.
mein_weg_als_deutscher_und_jude_002_f000198|Obwohl selbst in vielfaches Ungemach verstrickt, hamletisch vergrübelt und, da seine zugleich kantig-schroffe und weiblich-sensible Natur ihm jeden vertrauten Umgang erschwerte, auch vereinsamt, schloß er sich werbend, führend, eifersüchtig wachsam an mich an.|Obwohl selbst in vielfaches Ungemach verstrickt, hamletisch vergrübelt und, da seine zugleich kantig-schroffe und weiblich-sensible Natur ihm jeden vertrauten Umgang erschwerte, auch vereinsamt, schloß er sich werbend, führend, eifersüchtig wachsam an mich an.
mein_weg_als_deutscher_und_jude_002_f000199|Er war einer der problematischesten Menschen, denen ich je begegnet bin, und sein Einfluß erstreckte sich über meine wichtigsten Jahre.|Er war einer der problematischesten Menschen, denen ich je begegnet bin, und sein Einfluß erstreckte sich über meine wichtigsten Jahre.
