mein_weg_als_deutscher_und_jude_004_f000015|Die Frage, ob Jude oder Deutscher, war zunächst unwichtig geworden gegen die, wie ich zu den Menschen kommen konnte.|Die Frage, ob Jude oder Deutscher, war zunächst unwichtig geworden gegen die, wie ich zu den Menschen kommen konnte.
mein_weg_als_deutscher_und_jude_004_f000016|Mir ahnte manchmal, als sei ich im Begriff, das abzuzahlen, was am Judentum als Schuld und Odium hing, ich für meinen Teil, und als werde das irgendwie augenscheinlich und beweisbar werden.|Mir ahnte manchmal, als sei ich im Begriff, das abzuzahlen, was am Judentum als Schuld und Odium hing, ich für meinen Teil, und als werde das irgendwie augenscheinlich und beweisbar werden.
mein_weg_als_deutscher_und_jude_004_f000017|Es trat eine Reihe von Zufällen ein, von Frist zu Frist, die meiner materiellen Engnis kein Ende bereiteten, wohl aber der nachtschwarzen Hoffnungslosigkeit,|Es trat eine Reihe von Zufällen ein, von Frist zu Frist, die meiner materiellen Engnis kein Ende bereiteten, wohl aber der nachtschwarzen Hoffnungslosigkeit,
mein_weg_als_deutscher_und_jude_004_f000018|vor allem das verschlossene Tor sprengten, vor dem ich geharrt und gewacht hatte und Wege des Geistes freigaben.|vor allem das verschlossene Tor sprengten, vor dem ich geharrt und gewacht hatte und Wege des Geistes freigaben.
mein_weg_als_deutscher_und_jude_004_f000019|Ich wurde Sekretär bei einem sehr geschätzten Schriftsteller, der, obwohl nicht mehr jung,|Ich wurde Sekretär bei einem sehr geschätzten Schriftsteller, der, obwohl nicht mehr jung,
mein_weg_als_deutscher_und_jude_004_f000020|die Sache der Jungen zu seiner Sache gemacht hatte und dadurch allerdings mit der angeborenen Begabung in Zwiespalt geriet, die ihn mehr in bürgerlich-behagliche Bahnen wies.|die Sache der Jungen zu seiner Sache gemacht hatte und dadurch allerdings mit der angeborenen Begabung in Zwiespalt geriet, die ihn mehr in bürgerlich-behagliche Bahnen wies.
mein_weg_als_deutscher_und_jude_004_f000021|Er diktierte mir seine Romane und Erzählungen, und als ich es nach einiger Zeit wagte, ihm eigene Arbeiten zur Prüfung vorzulegen, zeigte er eine Überraschung, an der ich merkte, daß ich nicht taube Nüsse klopfte.|Er diktierte mir seine Romane und Erzählungen, und als ich es nach einiger Zeit wagte, ihm eigene Arbeiten zur Prüfung vorzulegen, zeigte er eine Überraschung, an der ich merkte, daß ich nicht taube Nüsse klopfte.
mein_weg_als_deutscher_und_jude_004_f000022|Es war der erste Mensch, der mich ermunterte, der erste überhaupt, der mich als Dichter uneingeschränkt ernst nahm, und das bedeutete für mich soviel wie Rettung und Erlösung.|Es war der erste Mensch, der mich ermunterte, der erste überhaupt, der mich als Dichter uneingeschränkt ernst nahm, und das bedeutete für mich soviel wie Rettung und Erlösung.
mein_weg_als_deutscher_und_jude_004_f000023|Aber er tat mehr.|Aber er tat mehr.
mein_weg_als_deutscher_und_jude_004_f000024|Er warb und wirkte für mich und jene sehr unfertigen, sehr fragwürdigen Gebilde; er scheute nicht Spott und Abwehr, ja Spott und Abwehr reizten ihn zu bedingungslosem Enthusiasmus,|Er warb und wirkte für mich und jene sehr unfertigen, sehr fragwürdigen Gebilde; er scheute nicht Spott und Abwehr, ja Spott und Abwehr reizten ihn zu bedingungslosem Enthusiasmus,
mein_weg_als_deutscher_und_jude_004_f000025|und als Heißsporn, der er war, begab er sich in Fehden; ich wurde unversehens ein Objekt von Für- und Widermeinung, was mich eher verzagt als stolz machte.|und als Heißsporn, der er war, begab er sich in Fehden; ich wurde unversehens ein Objekt von Für- und Widermeinung, was mich eher verzagt als stolz machte.
mein_weg_als_deutscher_und_jude_004_f000026|Aber die Brücken betrat ich, die mir geschlagen waren, und schnell sah ich mich in die Verwirrungen der Welt gerissen.|Aber die Brücken betrat ich, die mir geschlagen waren, und schnell sah ich mich in die Verwirrungen der Welt gerissen.
mein_weg_als_deutscher_und_jude_004_f000027|Das heißt ich nahm für Welt, was nur ein Zerr- und Scheinbild der Welt war; sie täuschte Freiheit, Weite und Würde vor, und sie war gebunden, eng und platt.|Das heißt ich nahm für Welt, was nur ein Zerr- und Scheinbild der Welt war; sie täuschte Freiheit, Weite und Würde vor, und sie war gebunden, eng und platt.
mein_weg_als_deutscher_und_jude_004_f000028|Als ich längst keine Illusionen mehr über sie hatte, war doch das, was ich hier unter Welt verstehe, nicht auffindbar, und je größer mein Bemühen um sie,|Als ich längst keine Illusionen mehr über sie hatte, war doch das, was ich hier unter Welt verstehe, nicht auffindbar, und je größer mein Bemühen um sie,
mein_weg_als_deutscher_und_jude_004_f000029|mein Verlangen nach ihr wurde, je schattenhafter erschien mir ihre Existenz.|mein Verlangen nach ihr wurde, je schattenhafter erschien mir ihre Existenz.
mein_weg_als_deutscher_und_jude_004_f000030|Und gleichwohl war sie mir notwendig, wenn nicht meine eigene Existenz eine schattenhafte sein sollte.|Und gleichwohl war sie mir notwendig, wenn nicht meine eigene Existenz eine schattenhafte sein sollte.
mein_weg_als_deutscher_und_jude_004_f000031|Der Kreis des literarischen Lebens umfing, damals wie heute, bei uns wie bei jeder Nation, Repräsentanten aller Stände und Schichten.|Der Kreis des literarischen Lebens umfing, damals wie heute, bei uns wie bei jeder Nation, Repräsentanten aller Stände und Schichten.
mein_weg_als_deutscher_und_jude_004_f000032|Es liegt nahe, an eine Auslese der Besten und Fähigsten zu glauben; dem ist nicht so.|Es liegt nahe, an eine Auslese der Besten und Fähigsten zu glauben; dem ist nicht so.
mein_weg_als_deutscher_und_jude_004_f000033|Es liegt nahe, an eine Gemeinschaft zu glauben, die sich auf höherer Ebene zusammengefunden hat als der breiten Alltagsfläche und die,|Es liegt nahe, an eine Gemeinschaft zu glauben, die sich auf höherer Ebene zusammengefunden hat als der breiten Alltagsfläche und die,
mein_weg_als_deutscher_und_jude_004_f000034|eben durch die vollzogene Auslese, durch Tun wie durch Sein vorbildlich ist.|eben durch die vollzogene Auslese, durch Tun wie durch Sein vorbildlich ist.
mein_weg_als_deutscher_und_jude_004_f000035|Dem ist nicht so.|Dem ist nicht so.
mein_weg_als_deutscher_und_jude_004_f000036|Es hat sich keine Auslese vollzogen, es ist keine Gemeinschaft entstanden, es ist ein zufälliges In-, Mit- und Gegeneinander mehr oder weniger begabter, mehr oder weniger guter,|Es hat sich keine Auslese vollzogen, es ist keine Gemeinschaft entstanden, es ist ein zufälliges In-, Mit- und Gegeneinander mehr oder weniger begabter, mehr oder weniger guter,
mein_weg_als_deutscher_und_jude_004_f000037|mehr oder weniger zielbewußter, ehrgeiziger oder verbitterter oder entzündlicher Einzelner.|mehr oder weniger zielbewußter, ehrgeiziger oder verbitterter oder entzündlicher Einzelner.
mein_weg_als_deutscher_und_jude_004_f000038|Es sind in der Mehrzahl Entlaufene, Entgleiste, sozial Verwundete und Kranke; Exponierte alle.|Es sind in der Mehrzahl Entlaufene, Entgleiste, sozial Verwundete und Kranke; Exponierte alle.
mein_weg_als_deutscher_und_jude_004_f000039|Ihrem Zirkel, ihrer Erde sind sie alle entflohen, nicht um frei zu sein, sondern freischweifend, ob es nun Proletarier, Bürger oder Aristokraten sind.|Ihrem Zirkel, ihrer Erde sind sie alle entflohen, nicht um frei zu sein, sondern freischweifend, ob es nun Proletarier, Bürger oder Aristokraten sind.
mein_weg_als_deutscher_und_jude_004_f000040|Sie bauen daher nicht auf einem gegebenen Fundament; sie müssen sich das Fundament erst errichten, und zwar jeder für sich und auf seine Weise.|Sie bauen daher nicht auf einem gegebenen Fundament; sie müssen sich das Fundament erst errichten, und zwar jeder für sich und auf seine Weise.
mein_weg_als_deutscher_und_jude_004_f000041|So vergeuden sie von vornherein Blut, Kraft und Geist für etwas, das Voraussetzung und Mitgift sein sollte.|So vergeuden sie von vornherein Blut, Kraft und Geist für etwas, das Voraussetzung und Mitgift sein sollte.
mein_weg_als_deutscher_und_jude_004_f000042|Sie zersplittern sich, ummauern sich, keiner hat die Bindung mit dem Volk, den Rückhalt an ihm, ja, das Volk beargwöhnt und verleugnet sie, es ist keine Mitte da, keine Übereinkunft,|Sie zersplittern sich, ummauern sich, keiner hat die Bindung mit dem Volk, den Rückhalt an ihm, ja, das Volk beargwöhnt und verleugnet sie, es ist keine Mitte da, keine Übereinkunft,
mein_weg_als_deutscher_und_jude_004_f000043|kein Vertrauen vom einen zum andern, nicht einmal Respekt vor der Arbeit oft, und auch wo wahrhaft Berufene sich vereinen, bilden sie Partei und hochmütige Sippe.|kein Vertrauen vom einen zum andern, nicht einmal Respekt vor der Arbeit oft, und auch wo wahrhaft Berufene sich vereinen, bilden sie Partei und hochmütige Sippe.
mein_weg_als_deutscher_und_jude_004_f000044|Genossen hat man bald, solche, die dasselbe meinen wie du, sogar dasselbe sagen.|Genossen hat man bald, solche, die dasselbe meinen wie du, sogar dasselbe sagen.
mein_weg_als_deutscher_und_jude_004_f000045|Aber sich im Redeaustausch vertragen und die geistige Kontinuität bewahren, ist zweierlei.|Aber sich im Redeaustausch vertragen und die geistige Kontinuität bewahren, ist zweierlei.
mein_weg_als_deutscher_und_jude_004_f000046|Eifersucht lauert stets unter der Schwelle, Kleinlichkeit, Neid und Spott.|Eifersucht lauert stets unter der Schwelle, Kleinlichkeit, Neid und Spott.
mein_weg_als_deutscher_und_jude_004_f000047|Die Erfolglosen und die Erfolganwärter machen geschlossene Phalanx gegen die, die den mindesten Vorsprung haben, und es bedarf schon einer überwältigenden Persönlichkeit,|Die Erfolglosen und die Erfolganwärter machen geschlossene Phalanx gegen die, die den mindesten Vorsprung haben, und es bedarf schon einer überwältigenden Persönlichkeit,
mein_weg_als_deutscher_und_jude_004_f000048|um den Zweifel der Unsachlichen, die sich sachlich gebärden, niederzuschlagen.|um den Zweifel der Unsachlichen, die sich sachlich gebärden, niederzuschlagen.
mein_weg_als_deutscher_und_jude_004_f000049|Dieser Zweifel kommt aus Verzweiflung oder führt zu ihr, und die Verzweiflung wieder weist auf mangelnde Zucht und Mangel der Idee, Mangel der Übereinkunft und Mangel der Verantwortung.|Dieser Zweifel kommt aus Verzweiflung oder führt zu ihr, und die Verzweiflung wieder weist auf mangelnde Zucht und Mangel der Idee, Mangel der Übereinkunft und Mangel der Verantwortung.
mein_weg_als_deutscher_und_jude_004_f000050|Ich erlebte es, daß frenetische Begeisterung um einen Namen lärmte, der sich dann nur in einen lebendigen Menschen zu verwandeln brauchte, um Abkühlung und Einschränkung hervorzurufen.|Ich erlebte es, daß frenetische Begeisterung um einen Namen lärmte, der sich dann nur in einen lebendigen Menschen zu verwandeln brauchte, um Abkühlung und Einschränkung hervorzurufen.
mein_weg_als_deutscher_und_jude_004_f000051|Fremdheit hielt stand; Distanz allein gab Glorie und bewahrte sie, sonst wurde alles zur Politik des Augenblicks mißbraucht.|Fremdheit hielt stand; Distanz allein gab Glorie und bewahrte sie, sonst wurde alles zur Politik des Augenblicks mißbraucht.
mein_weg_als_deutscher_und_jude_004_f000052|Ich selbst werde wohl nicht besser gewesen sein.|Ich selbst werde wohl nicht besser gewesen sein.
mein_weg_als_deutscher_und_jude_004_f000053|Die Luft, die man atmet, färbt die Haut.|Die Luft, die man atmet, färbt die Haut.
mein_weg_als_deutscher_und_jude_004_f000054|Aber es wurmte mich die verlorene Illusion.|Aber es wurmte mich die verlorene Illusion.
mein_weg_als_deutscher_und_jude_004_f000055|Es wurmte mich das kleine Maß, das die Wirklichkeit mich anzulegen zwang.|Es wurmte mich das kleine Maß, das die Wirklichkeit mich anzulegen zwang.
mein_weg_als_deutscher_und_jude_004_f000056|Es wurmte mich das Nichtbesserseinkönnen und Nichtbesserwerdenkönnen, und es wurmte mich schließlich die Maske, die ich tragen mußte, wenn höherer Wille und höhere Rücksicht Dissimulation forderten.|Es wurmte mich das Nichtbesserseinkönnen und Nichtbesserwerdenkönnen, und es wurmte mich schließlich die Maske, die ich tragen mußte, wenn höherer Wille und höhere Rücksicht Dissimulation forderten.
mein_weg_als_deutscher_und_jude_004_f000057|Die lernt sich schwer, und in ihrer feinsten Form ist sie dann doch wieder ein Gebot der Menschlichkeit; nichts ist roher und zweckloser, als mit dem Wahrheitsanspruch und der Wahrheitsfackel Gemüter zu beunruhigen und zu verwirren,|Die lernt sich schwer, und in ihrer feinsten Form ist sie dann doch wieder ein Gebot der Menschlichkeit; nichts ist roher und zweckloser, als mit dem Wahrheitsanspruch und der Wahrheitsfackel Gemüter zu beunruhigen und zu verwirren,
mein_weg_als_deutscher_und_jude_004_f000058|die nur in Dämmerung und Täuschung noch ein unsicheres Glück genießen.|die nur in Dämmerung und Täuschung noch ein unsicheres Glück genießen.
mein_weg_als_deutscher_und_jude_004_f000059|Das zu vermeiden und doch, in einem andern Sinn, wahr zu sein, ist eine Aufgabe für sich, die allerdings aus dem Bezirk des Literarischen heraus in den der Selbsterziehung und der Liebe tritt.|Das zu vermeiden und doch, in einem andern Sinn, wahr zu sein, ist eine Aufgabe für sich, die allerdings aus dem Bezirk des Literarischen heraus in den der Selbsterziehung und der Liebe tritt.
mein_weg_als_deutscher_und_jude_004_f000060|Auch Liebe ist nicht angeboren, auch Liebe muß man lernen.|Auch Liebe ist nicht angeboren, auch Liebe muß man lernen.
mein_weg_als_deutscher_und_jude_004_f000061|Die Entmutigung, die mich oft inmitten des Höllenkessels von Geistigkeit und Herzenstaubheit, Anmaßung und wesenloser Opposition überfiel, die Scham über alle die polternden,|Die Entmutigung, die mich oft inmitten des Höllenkessels von Geistigkeit und Herzenstaubheit, Anmaßung und wesenloser Opposition überfiel, die Scham über alle die polternden,
mein_weg_als_deutscher_und_jude_004_f000062|stolpernden Selbste, zu denen nun auch ich mich jetzt zählte, in denen ich aber von fern die entrückten Bewohner eines magischen Gartens gesehen hatte, veranlaßten mich bisweilen zu der Frage, ob die enge Aufsässigkeit,|stolpernden Selbste, zu denen nun auch ich mich jetzt zählte, in denen ich aber von fern die entrückten Bewohner eines magischen Gartens gesehen hatte, veranlaßten mich bisweilen zu der Frage, ob die enge Aufsässigkeit,
mein_weg_als_deutscher_und_jude_004_f000063|der Brothader im Ringen um allgemeine Ziele, die provinzielle Dumpfheit und das brutale Strebertum, das Mißtrauen und vorgesetzte Mißverstehen, wo es um Werk, um Vollkommenheit, um Ineinanderwirken,|der Brothader im Ringen um allgemeine Ziele, die provinzielle Dumpfheit und das brutale Strebertum, das Mißtrauen und vorgesetzte Mißverstehen, wo es um Werk, um Vollkommenheit, um Ineinanderwirken,
mein_weg_als_deutscher_und_jude_004_f000064|um Ideenhaftes ging, um Gedanken und Gestalt, ob das eine deutsche Eigentümlichkeit, deutsche Krankheit sei, oder ob es ein Ergebnis des Metiers als solchem war, die dunkle Kehrseite, und in anderen Ländern nicht anders als hier.|um Ideenhaftes ging, um Gedanken und Gestalt, ob das eine deutsche Eigentümlichkeit, deutsche Krankheit sei, oder ob es ein Ergebnis des Metiers als solchem war, die dunkle Kehrseite, und in anderen Ländern nicht anders als hier.
mein_weg_als_deutscher_und_jude_004_f000065|Ich machte die Bekanntschaft eines jungen französischen Schriftstellers, und mit ihm erlebte ich folgendes: Ich hatte mich ihm genähert, wir hatten fruchtbare Gespräche miteinander geführt,|Ich machte die Bekanntschaft eines jungen französischen Schriftstellers, und mit ihm erlebte ich folgendes: Ich hatte mich ihm genähert, wir hatten fruchtbare Gespräche miteinander geführt,
mein_weg_als_deutscher_und_jude_004_f000066|und bei einer schicklichen Gelegenheit gab er mir ein von ihm verfaßtes Buch mit einer freundschaftlichen Widmung.|und bei einer schicklichen Gelegenheit gab er mir ein von ihm verfaßtes Buch mit einer freundschaftlichen Widmung.
mein_weg_als_deutscher_und_jude_004_f000067|Kurze Zeit darauf geriet ich in eine drückende Notlage, in der mein letztes Hilfsmittel dieses Buch war, das ich beim Antiquar für ein paar Groschen veräußerte.|Kurze Zeit darauf geriet ich in eine drückende Notlage, in der mein letztes Hilfsmittel dieses Buch war, das ich beim Antiquar für ein paar Groschen veräußerte.
mein_weg_als_deutscher_und_jude_004_f000068|Mit ein paar Groschen konnte ich zwei bis drei Tage leben.|Mit ein paar Groschen konnte ich zwei bis drei Tage leben.
mein_weg_als_deutscher_und_jude_004_f000069|Da wir in demselben Hause wohnten, war ein Zusammentreffen mit dem Franzosen trotz meines schlechten Gewissens nicht zu vermeiden, und von einem bestimmten Tag an bemerkte ich, daß sich sein Benehmen gegen mich verändert hatte;|Da wir in demselben Hause wohnten, war ein Zusammentreffen mit dem Franzosen trotz meines schlechten Gewissens nicht zu vermeiden, und von einem bestimmten Tag an bemerkte ich, daß sich sein Benehmen gegen mich verändert hatte;
mein_weg_als_deutscher_und_jude_004_f000070|er hatte etwas Traurig-Scheues und Stumm-Vorwurfsvolles, wenn er mir begegnete; ich wußte seine Miene und Haltung nicht zu deuten, zog mich selber zurück, bedauerte die Entfremdung, und erst, als er abgereist war, löste sich mir das Rätsel auf ebenso peinliche wie überraschende Weise.|er hatte etwas Traurig-Scheues und Stumm-Vorwurfsvolles, wenn er mir begegnete; ich wußte seine Miene und Haltung nicht zu deuten, zog mich selber zurück, bedauerte die Entfremdung, und erst, als er abgereist war, löste sich mir das Rätsel auf ebenso peinliche wie überraschende Weise.
mein_weg_als_deutscher_und_jude_004_f000071|Er hatte nämlich zufällig bei dem Antiquar, bei dem ich es verkauft hatte, sein Buch gefunden, noch mit der Widmung, denn nicht einmal soviel Klugheit und Takt hatte ich in meiner verhärtenden, verrohenden Bedrängnis aufgebracht, dies Zeichen einer persönlichen Beziehung vorher zu verlöschen.|Er hatte nämlich zufällig bei dem Antiquar, bei dem ich es verkauft hatte, sein Buch gefunden, noch mit der Widmung, denn nicht einmal soviel Klugheit und Takt hatte ich in meiner verhärtenden, verrohenden Bedrängnis aufgebracht, dies Zeichen einer persönlichen Beziehung vorher zu verlöschen.
mein_weg_als_deutscher_und_jude_004_f000072|Er hatte gewartet bis zu seiner Entfernung aus der Stadt; nun schickte er mir das Buch wieder und mit ihm einen Brief.|Er hatte gewartet bis zu seiner Entfernung aus der Stadt; nun schickte er mir das Buch wieder und mit ihm einen Brief.
mein_weg_als_deutscher_und_jude_004_f000073|Dieser Brief war ein Dokument zartester Delikatesse und zugleich vornehmster Gesinnung; es ist mir kaum je ein ähnliches unter die Hände gekommen; es hat mich auch kaum je ein Mensch auf so profunde Manier belehrt und auf so feine beschämt.|Dieser Brief war ein Dokument zartester Delikatesse und zugleich vornehmster Gesinnung; es ist mir kaum je ein ähnliches unter die Hände gekommen; es hat mich auch kaum je ein Mensch auf so profunde Manier belehrt und auf so feine beschämt.
mein_weg_als_deutscher_und_jude_004_f000074|Was mich zu dem häßlichen Schritt getrieben, hatte er erraten; daß er sich verletzt gefühlt, verschwieg er; zum Vorwurf machte er mir den Mangel an Vertrauen.|Was mich zu dem häßlichen Schritt getrieben, hatte er erraten; daß er sich verletzt gefühlt, verschwieg er; zum Vorwurf machte er mir den Mangel an Vertrauen.
mein_weg_als_deutscher_und_jude_004_f000075|Er schrieb ungefähr: Kommen Sie nach Paris.|Er schrieb ungefähr: Kommen Sie nach Paris.
mein_weg_als_deutscher_und_jude_004_f000076|Es gibt dort vielleicht manches, worüber Sie sich zu beklagen haben werden, manches, was in Ihrem Vaterland anziehender, solider, gesünder ist, aber eines werden Sie dort unter den Leuten von Geist und Menschen unseres Berufs finden,|Es gibt dort vielleicht manches, worüber Sie sich zu beklagen haben werden, manches, was in Ihrem Vaterland anziehender, solider, gesünder ist, aber eines werden Sie dort unter den Leuten von Geist und Menschen unseres Berufs finden,
mein_weg_als_deutscher_und_jude_004_f000077|was ich in Deutschland in einem schmerzlichen Grad vermißt habe: wahre Kameradschaft, Courtoisie, unbedingte gegenseitige Achtung! Es ist mir dies später bestätigt worden.|was ich in Deutschland in einem schmerzlichen Grad vermißt habe: wahre Kameradschaft, Courtoisie, unbedingte gegenseitige Achtung! Es ist mir dies später bestätigt worden.
mein_weg_als_deutscher_und_jude_004_f000078|Die Kenntnis romanischen Geistes- und sozialen Lebens läßt es von innen her verstehen.|Die Kenntnis romanischen Geistes- und sozialen Lebens läßt es von innen her verstehen.
mein_weg_als_deutscher_und_jude_004_f000079|Das deutsche Wesen ist Zerstückung; Zerstückung bis ins Mark; deutsche Entwicklung geht von Ruck zu Ruck; Epochen des Reichtums und der Blüte münden jäh in eine Ödnis; große Erscheinungen sind unbegreiflich abseitig;|Das deutsche Wesen ist Zerstückung; Zerstückung bis ins Mark; deutsche Entwicklung geht von Ruck zu Ruck; Epochen des Reichtums und der Blüte münden jäh in eine Ödnis; große Erscheinungen sind unbegreiflich abseitig;
mein_weg_als_deutscher_und_jude_004_f000080|zwischen bewegten Teilen fehlen Vermittlungen und Übergänge, so daß an ein lebendiges Glied ein totes angenietet und Kaste von Kaste durch unübersteigliche Mauern geschieden ist.|zwischen bewegten Teilen fehlen Vermittlungen und Übergänge, so daß an ein lebendiges Glied ein totes angenietet und Kaste von Kaste durch unübersteigliche Mauern geschieden ist.
mein_weg_als_deutscher_und_jude_004_f000081|Ein Zentrum gibt es nicht und hat es nie gegeben, die vier Jahrzehnte des geeinten Reiches haben nicht einmal eines der Verwaltung geschaffen; der Künstler, der Dichter, konnte er nicht als Beamter subordiniert werden,|Ein Zentrum gibt es nicht und hat es nie gegeben, die vier Jahrzehnte des geeinten Reiches haben nicht einmal eines der Verwaltung geschaffen; der Künstler, der Dichter, konnte er nicht als Beamter subordiniert werden,
mein_weg_als_deutscher_und_jude_004_f000082|so war er ein verlorenes Individuum, und seine Position hing vom Ungefähr des ökonomischen Gelingens ab.|so war er ein verlorenes Individuum, und seine Position hing vom Ungefähr des ökonomischen Gelingens ab.
mein_weg_als_deutscher_und_jude_004_f000083|Die eine Schicht der Gesellschaft verdammt, was die andere preist; Traditionen brechen über Nacht, Bildung vernichtet das Bild, Gelehrsamkeit die Lehre, Gesinnung den Sinn, Erfolg die Folge, Liebhaberei die Liebe, Betriebsamkeit den Trieb.|Die eine Schicht der Gesellschaft verdammt, was die andere preist; Traditionen brechen über Nacht, Bildung vernichtet das Bild, Gelehrsamkeit die Lehre, Gesinnung den Sinn, Erfolg die Folge, Liebhaberei die Liebe, Betriebsamkeit den Trieb.
mein_weg_als_deutscher_und_jude_004_f000084|Alles dies erfuhr ich und mußte es erfahren, da es ja meiner Natur auferlegt war, daß sie sich sozusagen des ganzen Körpers bemächtige.|Alles dies erfuhr ich und mußte es erfahren, da es ja meiner Natur auferlegt war, daß sie sich sozusagen des ganzen Körpers bemächtige.
mein_weg_als_deutscher_und_jude_004_f000085|Ich war nun dem umrißlosen Dämmern entwachsen; ich hatte mir meine Formen, meine Inhalte zu suchen; was von ihnen mitgeboren war, bedurfte der Relation zum Realen und der Ergänzung in ihm.|Ich war nun dem umrißlosen Dämmern entwachsen; ich hatte mir meine Formen, meine Inhalte zu suchen; was von ihnen mitgeboren war, bedurfte der Relation zum Realen und der Ergänzung in ihm.
mein_weg_als_deutscher_und_jude_004_f000086|Es zeigten sich Aufgaben; ich fühlte mich zum Epiker berufen; als solcher bestand ich mit meiner Zeit und durch meine Zeit.|Es zeigten sich Aufgaben; ich fühlte mich zum Epiker berufen; als solcher bestand ich mit meiner Zeit und durch meine Zeit.
mein_weg_als_deutscher_und_jude_004_f000087|Symbol und Idee wurden von der Inspiration, der Phantasie gegeben; Farbe, Schwung und Leidenschaft kamen vom Blut her, von der Anschauung, der inneren Temperatur; wie aber war es um das Außen bestellt, um alles das, was mir Nahrung, Anlaß, Gerüst, Baugrund, Stoff sein sollte?|Symbol und Idee wurden von der Inspiration, der Phantasie gegeben; Farbe, Schwung und Leidenschaft kamen vom Blut her, von der Anschauung, der inneren Temperatur; wie aber war es um das Außen bestellt, um alles das, was mir Nahrung, Anlaß, Gerüst, Baugrund, Stoff sein sollte?
mein_weg_als_deutscher_und_jude_004_f000088|Da gab es weder eine Einheit noch eine Form, weder ein Übereinkommen noch ein organisch Entstehendes.|Da gab es weder eine Einheit noch eine Form, weder ein Übereinkommen noch ein organisch Entstehendes.
mein_weg_als_deutscher_und_jude_004_f000089|Stück um Stück, Person um Person, Stadt um Stadt, Staat um Staat setzte sich deutsches Leben mittelpunktlos zusammen.|Stück um Stück, Person um Person, Stadt um Stadt, Staat um Staat setzte sich deutsches Leben mittelpunktlos zusammen.
mein_weg_als_deutscher_und_jude_004_f000090|Der Franzose braucht nur hinzuschreiben: Paris, und er hat, eingeschlossen in eine Wortnuß, ein Ungeheures von Begebenheit und Entfaltung, das Siegel gleichsam für die Tatsache Gesellschaft, für die Tatsache Nation, für die Tatsache Frankreich.|Der Franzose braucht nur hinzuschreiben: Paris, und er hat, eingeschlossen in eine Wortnuß, ein Ungeheures von Begebenheit und Entfaltung, das Siegel gleichsam für die Tatsache Gesellschaft, für die Tatsache Nation, für die Tatsache Frankreich.
