novelle05_04_pirandello_f000276|sentiva anzi che con esso i compagni quasi lo sfidavano a proseguire per veder dove arrivasse la sua dabbenaggine o la sua sfrontatezza|sentiva anzi che con esso i compagni quasi lo sfidavano a proseguire per veder dove arrivasse la sua dabbenaggine o la sua sfrontatezza
novelle05_04_pirandello_f000277|oppure per assaltarlo a qualche parola non ben misurata;|oppure per assaltarlo a qualche parola non ben misurata;
novelle05_04_pirandello_f000278|e perciò cercava di rendere a mano a mano più umile l’espressione del volto e della voce.|e perciò cercava di rendere a mano a mano più umile lespressione del volto e della voce.
novelle05_04_pirandello_f000279|Ma ormai non sapeva più che altro aggiungere;|Ma ormai non sapeva più che altro aggiungere;
novelle05_04_pirandello_f000280|gli pareva d’aver detto abbastanza, d’aver difeso del suo meglio quei giovanotti.|gli pareva daver detto abbastanza, daver difeso del suo meglio quei giovanotti.
novelle05_04_pirandello_f000281|E intanto quelli seguitavano a tacere, lo sfidavano a parlare ancora. Che dire?|E intanto quelli seguitavano a tacere, lo sfidavano a parlare ancora. Che dire?
novelle05_04_pirandello_f000282|Aggiunse: — E dunque mi pare… — Che ti pare?|Aggiunse: - E dunque mi pare - Che ti pare?
novelle05_04_pirandello_f000283|— proruppe allora, furibondo, il Bellone, andandogli davanti, a petto.|- proruppe allora, furibondo, il Bellone, andandogli davanti, a petto.
novelle05_04_pirandello_f000284|— Un corno! un corno! — gridarono gli altri, alzandosi anch’ essi.|- Un corno! un corno! - gridarono gli altri, alzandosi anch essi.
novelle05_04_pirandello_f000285|E se lo misero in mezzo e presero a parlare concitatamente tutti insieme e chi lo tirava di qua e chi di là per dimostrargli che sosteneva una causa indegna e che se ne doveva vergognare.|E se lo misero in mezzo e presero a parlare concitatamente tutti insieme e chi lo tirava di qua e chi di là per dimostrargli che sosteneva una causa indegna e che se ne doveva vergognare.
novelle05_04_pirandello_f000286|Vergognare, perché difendeva quattro mascalzoni scioperati! — O che le epopee|Vergognare, perché difendeva quattro mascalzoni scioperati! - O che le epopee
novelle05_04_pirandello_f000287|le vere epopee come la garibaldina, potevano avere aggiunte, appendici?|le vere epopee come la garibaldina, potevano avere aggiunte, appendici?
novelle05_04_pirandello_f000288|Di ridicolo, di ridicolo s’era coperta la Grecia! Il povero Sciaramè non poteva rispondere a tutti, sopraffatto, investito.|Di ridicolo, di ridicolo sera coperta la Grecia! Il povero Sciaramè non poteva rispondere a tutti, sopraffatto, investito.
novelle05_04_pirandello_f000289|Colse a volo quel che diceva il Nardi e gli gridò: — L’impresa non fu nazionale?|Colse a volo quel che diceva il Nardi e gli gridò: - Limpresa non fu nazionale?
novelle05_04_pirandello_f000290|Ma Garibaldi, scusate, Garibaldi combatté forse soltanto per l’indipendenza nostra?|Ma Garibaldi, scusate, Garibaldi combatté forse soltanto per lindipendenza nostra?
novelle05_04_pirandello_f000291|Combatté anche in America, anche in Francia combatté, Cavaliere dell’Umanità! Che c’entra! — Ti vuoi star zitto, Sciaramè?|Combatté anche in America, anche in Francia combatté, Cavaliere dellUmanità! Che centra! - Ti vuoi star zitto, Sciaramè?
novelle05_04_pirandello_f000292|— tuonò a questo punto il Bellone, dando un gran pugno su la tavola presidenziale.|- tuonò a questo punto il Bellone, dando un gran pugno su la tavola presidenziale.
novelle05_04_pirandello_f000293|— Non bestemmiare! Non far confronti oltraggiosi! Oseresti paragonare l’epopea garibaldina con la pagliacciata della Grecia?|- Non bestemmiare! Non far confronti oltraggiosi! Oseresti paragonare lepopea garibaldina con la pagliacciata della Grecia?
novelle05_04_pirandello_f000294|Vergógnati! Vergógnati, perché so bene io la ragione della tua difesa di questi quattro buffoni.|Vergógnati! Vergógnati, perché so bene io la ragione della tua difesa di questi quattro buffoni.
novelle05_04_pirandello_f000295|Ma noi, sappi, prendendo stasera questa decisione, faremo un gran bene anche a te;|Ma noi, sappi, prendendo stasera questa decisione, faremo un gran bene anche a te;
novelle05_04_pirandello_f000296|ti libereremo da un moscone che insidia all’onore della tua casa;|ti libereremo da un moscone che insidia allonore della tua casa;
novelle05_04_pirandello_f000297|e tu devi votare con noi, intendi?|e tu devi votare con noi, intendi?
novelle05_04_pirandello_f000298|La domanda deve essere respinta all’unanimità|La domanda deve essere respinta allunanimità
novelle05_04_pirandello_f000299|perdio! Vota con noi! vota con noi! — Permettete almeno che io mi astenga… — scongiurò Sciaramè, a mani giunte.|perdio! Vota con noi! vota con noi! - Permettete almeno che io mi astenga - scongiurò Sciaramè, a mani giunte.
novelle05_04_pirandello_f000300|— No! Con noi! con noi! — gridarono, inflessibili, i socii, irritatissimi.|- No! Con noi! con noi! - gridarono, inflessibili, i socii, irritatissimi.
novelle05_04_pirandello_f000301|E tanto fecero e tanto dissero, che costrinsero il povero Sciaramè a votar di no, con loro.|E tanto fecero e tanto dissero, che costrinsero il povero Sciaramè a votar di no, con loro.
novelle05_04_pirandello_f000302|Due giorni dopo, sul giornaletto locale, comparve questa protesta del Gàsperi, il ferito di Domokòs.|Due giorni dopo, sul giornaletto locale, comparve questa protesta del Gàsperi, il ferito di Domokòs.
novelle05_04_pirandello_f000303|GARIBALDINI VECCHI E NUOVI Riceviamo e pubblichiamo: Egregio Signor Direttore, a nome mio e de’ miei compagni, La Rosa, Betti e Marcolini|GARIBALDINI VECCHI E NUOVI Riceviamo e pubblichiamo: Egregio Signor Direttore, a nome mio e de miei compagni, La Rosa, Betti e Marcolini
novelle05_04_pirandello_f000304|Le comunico la deliberazione votata ad unanimità dal Sodalizio dei Reduci Garibaldini, in seguito alla nostra domanda d’ammissione.|Le comunico la deliberazione votata ad unanimità dal Sodalizio dei Reduci Garibaldini, in seguito alla nostra domanda dammissione.
novelle05_04_pirandello_f000305|Siamo stati respinti, signor Direttore! La nostra camicia rossa, per i signori veterani del Sodalizio, non è autentica. Proprio cosí! E sa perché?|Siamo stati respinti, signor Direttore! La nostra camicia rossa, per i signori veterani del Sodalizio, non è autentica. Proprio cosí! E sa perché?
novelle05_04_pirandello_f000306|perché, non essendo ancor nati o essendo ancora in fasce, quando Giuseppe Garibaldi – il vero|perché, non essendo ancor nati o essendo ancora in fasce, quando Giuseppe Garibaldi - il vero
novelle05_04_pirandello_f000307|il solo – come dice la deliberazione – si mosse a combattere per la liberazione della Patria|il solo - come dice la deliberazione - si mosse a combattere per la liberazione della Patria
novelle05_04_pirandello_f000308|noi poveretti non potemmo naturalmente con le nostre balie e con le nostre mamme seguir Lui, allora|noi poveretti non potemmo naturalmente con le nostre balie e con le nostre mamme seguir Lui, allora
novelle05_04_pirandello_f000309|e abbiamo avuto il torto di seguire invece il Figlio (che pare|e abbiamo avuto il torto di seguire invece il Figlio che pare
novelle05_04_pirandello_f000310|a giudizio dei sullodati veterani, non sia Garibaldi anche lui) nell’Ellade sacra.|a giudizio dei sullodati veterani, non sia Garibaldi anche lui nellEllade sacra.
novelle05_04_pirandello_f000311|Ci si fa una colpa, infatti, del triste e umiliante esito della guerra greco-turca|Ci si fa una colpa, infatti, del triste e umiliante esito della guerra greco-turca
novelle05_04_pirandello_f000312|come se noi a Domokòs non avessimo combattuto e vinto, lasciando sul campo di battaglia l’eroico Fratti e altri generosi.|come se noi a Domokòs non avessimo combattuto e vinto, lasciando sul campo di battaglia leroico Fratti e altri generosi.
novelle05_04_pirandello_f000313|Ora capirà, egregio signor Direttore, che noi non possiamo difendere, come vorremmo, il Duce nostro|Ora capirà, egregio signor Direttore, che noi non possiamo difendere, come vorremmo, il Duce nostro
novelle05_04_pirandello_f000314|la nobile idealità che ci spinse ad accorrere all’appello, i nostri compagni d’arme caduti e i superstiti|la nobile idealità che ci spinse ad accorrere allappello, i nostri compagni darme caduti e i superstiti
novelle05_04_pirandello_f000315|dall’indegna offesa contenuta nell’inqualificabile deliberazione dei nostri Reduci: non possiamo|dallindegna offesa contenuta nellinqualificabile deliberazione dei nostri Reduci: non possiamo
novelle05_04_pirandello_f000316|perché ci troviamo di fronte a vecchi evidentemente rimbecilliti.|perché ci troviamo di fronte a vecchi evidentemente rimbecilliti.
novelle05_04_pirandello_f000317|La parola può parere in prima un po’ dura|La parola può parere in prima un po dura
novelle05_04_pirandello_f000318|ma non parrà più tale quando si consideri che questi signori hanno respinto noi dal sodalizio senza pensare che intanto ne fa parte qualcuno|ma non parrà più tale quando si consideri che questi signori hanno respinto noi dal sodalizio senza pensare che intanto ne fa parte qualcuno
novelle05_04_pirandello_f000319|il quale non solo non è mai stato garibaldino|il quale non solo non è mai stato garibaldino
novelle05_04_pirandello_f000320|non solo non ha mai preso parte ad alcun fatto d’armi|non solo non ha mai preso parte ad alcun fatto darmi
novelle05_04_pirandello_f000321|ma osa per giunta d’indossare una camicia rossa e di fregiarsi il petto di ben sette medaglie che non gli appartengono|ma osa per giunta dindossare una camicia rossa e di fregiarsi il petto di ben sette medaglie che non gli appartengono
novelle05_04_pirandello_f000322|perché furono di suo fratello morto eroicamente a Digione.|perché furono di suo fratello morto eroicamente a Digione.
novelle05_04_pirandello_f000323|Detto questo, mi sembra superfluo aggiungere altri commenti alla deliberazione.|Detto questo, mi sembra superfluo aggiungere altri commenti alla deliberazione.
novelle05_04_pirandello_f000324|Mi dichiaro pronto a dimostrare coi documenti alla mano quanto asserisco.|Mi dichiaro pronto a dimostrare coi documenti alla mano quanto asserisco.
novelle05_04_pirandello_f000325|Se vi sarò costretto, smaschererò anche pubblicamente questo falso garibaldino|Se vi sarò costretto, smaschererò anche pubblicamente questo falso garibaldino
novelle05_04_pirandello_f000326|che ha pure avuto il coraggio di votare con gli altri contro la nostra ammissione.|che ha pure avuto il coraggio di votare con gli altri contro la nostra ammissione.
novelle05_04_pirandello_f000327|Intanto, pregandola, signor Direttore, di pubblicare integralmente nel suo periodico questa mia protesta|Intanto, pregandola, signor Direttore, di pubblicare integralmente nel suo periodico questa mia protesta
novelle05_04_pirandello_f000328|ho l’onore di dirmi Suo devotossimo Alessandro Gàsperi Era noto anche a noi da un pezzo che della Società dei Reduci Garibaldini faceva parte un messer tale che non è punto reduce come non fu mai garibaldino.|ho lonore di dirmi Suo devotossimo Alessandro Gàsperi Era noto anche a noi da un pezzo che della Società dei Reduci Garibaldini faceva parte un messer tale che non è punto reduce come non fu mai garibaldino.
novelle05_04_pirandello_f000329|Non ne avevamo mai fatto parola, per carità di patria, né ce ne saremmo mai occupati|Non ne avevamo mai fatto parola, per carità di patria, né ce ne saremmo mai occupati
novelle05_04_pirandello_f000330|se ora l’atto inconsulto della suddetta Società non avesse giustamente provocato la protesta del signor Gàsperi e degli altri giovani valorosi che combatterono in Grecia.|se ora latto inconsulto della suddetta Società non avesse giustamente provocato la protesta del signor Gàsperi e degli altri giovani valorosi che combatterono in Grecia.
novelle05_04_pirandello_f000331|Riteniamo che la Società dei Reduci, per dare almeno una qualche soddisfazione a questi giovani e provvedere al suo decoro|Riteniamo che la Società dei Reduci, per dare almeno una qualche soddisfazione a questi giovani e provvedere al suo decoro
novelle05_04_pirandello_f000332|dovrebbe adesso affrettarsi ad espellere quel socio per ogni riguardo immeritevole di farne parte.|dovrebbe adesso affrettarsi ad espellere quel socio per ogni riguardo immeritevole di farne parte.
novelle05_04_pirandello_f000333|Nota della redazione Amilcare Bellone|Nota della redazione Amilcare Bellone
novelle05_04_pirandello_f000334|col giornaletto in mano – mentre tutto il paese commentava meravigliato la protesta del Gàsperi – si precipitò|col giornaletto in mano - mentre tutto il paese commentava meravigliato la protesta del Gàsperi - si precipitò
novelle05_04_pirandello_f000335|furente, nella sede della Società e|furente, nella sede della Società e
novelle05_04_pirandello_f000336|imbattutosi in Carlandrea Sciaramè, che s’avviava triste e ignaro al Caffè della piazza|imbattutosi in Carlandrea Sciaramè, che savviava triste e ignaro al Caffè della piazza
novelle05_04_pirandello_f000337|lo prese per il petto e lo buttò a sedere su una seggiola, schiaffandogli con l’altra mano in faccia il giornale. — Hai letto?|lo prese per il petto e lo buttò a sedere su una seggiola, schiaffandogli con laltra mano in faccia il giornale. - Hai letto?
novelle05_04_pirandello_f000338|Leggi qua! — No… Che… che è stato?|Leggi qua! - No Che che è stato?
novelle05_04_pirandello_f000339|— balbettò Sciaramè, soprappreso con tanta violenza.|- balbettò Sciaramè, soprappreso con tanta violenza.
novelle05_04_pirandello_f000340|— Leggi! leggi — gli gridò di nuovo il Bellone, serrando le pugna, per frenare la rabbia;|- Leggi! leggi - gli gridò di nuovo il Bellone, serrando le pugna, per frenare la rabbia;
novelle05_04_pirandello_f000341|e si mise a far le volte del leone per la stanza.|e si mise a far le volte del leone per la stanza.
novelle05_04_pirandello_f000342|Il povero Sciaramè cercò con le mani mal ferme le lenti;|Il povero Sciaramè cercò con le mani mal ferme le lenti;
novelle05_04_pirandello_f000343|se le pose sulla punta del naso;|se le pose sulla punta del naso;
novelle05_04_pirandello_f000344|ma non sapeva che cosa dovesse leggere in quel giornale. Il Bellone gli s’appressò;|ma non sapeva che cosa dovesse leggere in quel giornale. Il Bellone gli sappressò;
novelle05_04_pirandello_f000345|glielo strappò di mano e, apertolo, gl’indicò nella seconda pagina la protesta.|glielo strappò di mano e, apertolo, glindicò nella seconda pagina la protesta.
novelle05_04_pirandello_f000346|— Qua! qua! Leggi qua! — Ah, — fece, dolente, Sciaramè, dopo aver letto il titolo e la firma.|- Qua! qua! Leggi qua! - Ah, - fece, dolente, Sciaramè, dopo aver letto il titolo e la firma.
novelle05_04_pirandello_f000347|— Non ve l’avevo detto io?|- Non ve lavevo detto io?
novelle05_04_pirandello_f000348|— Va’ avanti! Va’ avanti! — gli urlò il Bellone; e riprese a passeggiare.|- Va avanti! Va avanti! - gli urlò il Bellone; e riprese a passeggiare.
novelle05_04_pirandello_f000349|Sciaramè si mise a leggere, zitto zitto.|Sciaramè si mise a leggere, zitto zitto.
novelle05_04_pirandello_f000350|A un certo punto, aggrottò le ciglia;|A un certo punto, aggrottò le ciglia;
novelle05_04_pirandello_f000351|poi le spianò, sbarrando gli occhi e spalancando la bocca.|poi le spianò, sbarrando gli occhi e spalancando la bocca.
novelle05_04_pirandello_f000352|Il giornale fu per cadergli di mano.|Il giornale fu per cadergli di mano.
novelle05_04_pirandello_f000353|Lo riprese, lo accostò di più agli occhi, come se la vista gli si fosse a un tratto annebbiata.|Lo riprese, lo accostò di più agli occhi, come se la vista gli si fosse a un tratto annebbiata.
novelle05_04_pirandello_f000354|Il Bellone s’era fermato a guardarlo con occhi fulminanti, le braccia conserte|Il Bellone sera fermato a guardarlo con occhi fulminanti, le braccia conserte
novelle05_04_pirandello_f000355|e attendeva, fremente, una protesta, una smentita, una spiegazione. — Che ne dici?|e attendeva, fremente, una protesta, una smentita, una spiegazione. - Che ne dici?
novelle05_04_pirandello_f000356|Alza il capo! Guardami! Sciaramè, con faccia cadaverica, restringendo le palpebre attorno agli occhi smorti|Alza il capo! Guardami! Sciaramè, con faccia cadaverica, restringendo le palpebre attorno agli occhi smorti
novelle05_04_pirandello_f000357|scosse lentamente la testa, in segno negativo, senza poter parlare;|scosse lentamente la testa, in segno negativo, senza poter parlare;
novelle05_04_pirandello_f000358|posò sul tavolino il giornale e si recò una mano sul cuore.|posò sul tavolino il giornale e si recò una mano sul cuore.
novelle05_04_pirandello_f000359|— Aspetta… — poi disse, più col gesto che con la voce. Si provò a inghiottire;|- Aspetta - poi disse, più col gesto che con la voce. Si provò a inghiottire;
novelle05_04_pirandello_f000360|ma la lingua gli s’era d’un tratto insugherita. Non tirava più fiato.|ma la lingua gli sera dun tratto insugherita. Non tirava più fiato.
novelle05_04_pirandello_f000361|— Io… — prese quindi a balbettare, ansimando|- Io - prese quindi a balbettare, ansimando
novelle05_04_pirandello_f000362|— io ci… ci fui io… a… a Calatafimi… a… a Palermo… poi a Milazzo… e in… in Calabria a… a Melito… poi sú|- io ci ci fui io a a Calatafimi a a Palermo poi a Milazzo e in in Calabria a a Melito poi sú
novelle05_04_pirandello_f000363|sú fino a… a Napoli… e poi al Volturno… — Ma come ci fosti?|sú fino a a Napoli e poi al Volturno - Ma come ci fosti?
novelle05_04_pirandello_f000364|Le prove! Le prove! I documenti! Come ci fosti?|Le prove! Le prove! I documenti! Come ci fosti?
novelle05_04_pirandello_f000365|— Aspetta… Io… con… con Stefanuccio… Avevo il somarello… — Che dici? Che farnetichi? Le medaglie di chi sono? Tue o di tuo fratello?|- Aspetta Io con con Stefanuccio Avevo il somarello - Che dici? Che farnetichi? Le medaglie di chi sono? Tue o di tuo fratello?
novelle05_04_pirandello_f000366|Parla! Questo voglio sapere! — Sono… Lasciami dire… A Marsala… stavamo lí, al Sessanta, io e Stefanuccio|Parla! Questo voglio sapere! - Sono Lasciami dire A Marsala stavamo lí, al Sessanta, io e Stefanuccio
novelle05_04_pirandello_f000367|il mio fratellino… Gli avevo fatto da padre… a Stefanuccio… Aveva appena quindici anni, capisci?|il mio fratellino Gli avevo fatto da padre a Stefanuccio Aveva appena quindici anni, capisci?
novelle05_04_pirandello_f000368|Mi scappò di casa, quando… quando sbarcarono i Mille… per seguir Lui, Garibaldi, coi volontarii… Torno a casa;|Mi scappò di casa, quando quando sbarcarono i Mille per seguir Lui, Garibaldi, coi volontarii Torno a casa;
novelle05_04_pirandello_f000369|non lo trovo… Allora presi a nolo un somarello… Lo raggiunsi prima a Calatafimi|non lo trovo Allora presi a nolo un somarello Lo raggiunsi prima a Calatafimi
novelle05_04_pirandello_f000370|per riportarmelo a casa… A quindici anni, ragazzino, che poteva fare, cuore mio?|per riportarmelo a casa A quindici anni, ragazzino, che poteva fare, cuore mio?
novelle05_04_pirandello_f000371|… Ma lui mi minacciò che si sarebbe fatto saltar la… la testa, dice| Ma lui mi minacciò che si sarebbe fatto saltar la la testa, dice
novelle05_04_pirandello_f000372|con quel vecchio fucile più alto di lui che gli avevano dato… se io lo costringevo a tornare indietro… la testa… E allora|con quel vecchio fucile più alto di lui che gli avevano dato se io lo costringevo a tornare indietro la testa E allora
novelle05_04_pirandello_f000373|persuaso dagli altri volontarii, lasciai in libertà il somarello… che poi mi toccò ripagare… e… e m’accompagnai con loro.|persuaso dagli altri volontarii, lasciai in libertà il somarello che poi mi toccò ripagare e e maccompagnai con loro.
novelle05_04_pirandello_f000374|— Volontario anche tu? E combattesti?|- Volontario anche tu? E combattesti?
novelle05_04_pirandello_f000375|— Non… non avevo… non avevo fucile… — E avevi invece paura?|- Non non avevo non avevo fucile - E avevi invece paura?
novelle05_04_pirandello_f000376|— No, no… Piuttosto morire che lasciarlo! — Seguisti dunque tuo fratello?|- No, no Piuttosto morire che lasciarlo! - Seguisti dunque tuo fratello?
novelle05_04_pirandello_f000377|— Sí, sempre! E Sciaramè ebbe come un brivido lungo la schiena, e si strinse più forte il petto con la mano, curvandosi vie più. — Ma le medaglie? La camicia rossa?|- Sí, sempre! E Sciaramè ebbe come un brivido lungo la schiena, e si strinse più forte il petto con la mano, curvandosi vie più. - Ma le medaglie? La camicia rossa?
novelle05_04_pirandello_f000378|— riprese il Bellone, scrollandolo furiosamente, — di chi sono? Tue o di tuo fratello?|- riprese il Bellone, scrollandolo furiosamente, - di chi sono? Tue o di tuo fratello?
novelle05_04_pirandello_f000379|Rispondi! Sciaramè aprí le braccia, senza ardire di levare il capo;|Rispondi! Sciaramè aprí le braccia, senza ardire di levare il capo;
novelle05_04_pirandello_f000380|poi disse: — Siccome Stefanuccio non… non se le poté godere… — Te le sei portate a spasso tu! — compí la frase il Bellone.|poi disse: - Siccome Stefanuccio non non se le poté godere - Te le sei portate a spasso tu! - compí la frase il Bellone.
novelle05_04_pirandello_f000381|— Oh miserabile impostore! E hai osato di gabbare cosí la nostra buona fede?|- Oh miserabile impostore! E hai osato di gabbare cosí la nostra buona fede?
novelle05_04_pirandello_f000382|Meriteresti ch’io ti sputassi in faccia;|Meriteresti chio ti sputassi in faccia;
novelle05_04_pirandello_f000383|meriteresti ch’io… Ma mi fai pietà! Tu uscirai ora stesso dal sodalizio! Fuori! Fuori! — Mi cacciate di casa mia?|meriteresti chio Ma mi fai pietà! Tu uscirai ora stesso dal sodalizio! Fuori! Fuori! - Mi cacciate di casa mia?
novelle05_04_pirandello_f000384|— Ce n’andremo via noi, ora stesso! Fa’ schiodare subito la tabella dalla porta! Ma come|- Ce nandremo via noi, ora stesso! Fa schiodare subito la tabella dalla porta! Ma come
novelle05_04_pirandello_f000385|ma come non mi passò mai per la mente il sospetto che|ma come non mi passò mai per la mente il sospetto che
novelle05_04_pirandello_f000386|per essere cosí stupido, bisognava che costui Garibaldi non lo avesse mai veduto nemmeno da lontano! — Io?|per essere cosí stupido, bisognava che costui Garibaldi non lo avesse mai veduto nemmeno da lontano! - Io?
novelle05_04_pirandello_f000387|— esclamò Sciaramè con un balzo. — Non lo vidi? io?|- esclamò Sciaramè con un balzo. - Non lo vidi? io?
novelle05_04_pirandello_f000388|Ah, se lo vidi! E gli baciai anche le mani! A Piazza Pretorio, gliele baciai, a Palermo, dove s’era accampato! Le mani! — Zitto|Ah, se lo vidi! E gli baciai anche le mani! A Piazza Pretorio, gliele baciai, a Palermo, dove sera accampato! Le mani! - Zitto
novelle05_04_pirandello_f000389|svergognato! Non voglio più sentirti! Non voglio più vederti!|svergognato! Non voglio più sentirti! Non voglio più vederti!
novelle05_04_pirandello_f000390|Fai schiodare la tabella e guaj a te se osi più gabellarti da garibaldino! E il Bellone s’avviò di furia verso la porta.|Fai schiodare la tabella e guaj a te se osi più gabellarti da garibaldino! E il Bellone savviò di furia verso la porta.
novelle05_04_pirandello_f000391|Prima d’uscire, si voltò a gridargli di nuovo: — Svergognato! Rimasto solo, Sciaramè provò a levarsi in piedi;|Prima duscire, si voltò a gridargli di nuovo: - Svergognato! Rimasto solo, Sciaramè provò a levarsi in piedi;
novelle05_04_pirandello_f000392|ma le gambe non lo reggevano più;|ma le gambe non lo reggevano più;
novelle05_04_pirandello_f000393|il cuore malato gli tempestava in petto.|il cuore malato gli tempestava in petto.
novelle05_04_pirandello_f000394|Aggrappandosi con le mani al tavolino, alla sedia, alla parete, si trascinò sú.|Aggrappandosi con le mani al tavolino, alla sedia, alla parete, si trascinò sú.
novelle05_04_pirandello_f000395|Rorò, nel vederselo comparire davanti in quello stato, gettò un grido;|Rorò, nel vederselo comparire davanti in quello stato, gettò un grido;
novelle05_04_pirandello_f000396|ma egli le fece segno di tacere;|ma egli le fece segno di tacere;
novelle05_04_pirandello_f000397|poi le indicò il cassettone nella camera e le domandò quasi strozzato: — Tu… le carte di là… al La Rosa? — Le carte? Che carte?|poi le indicò il cassettone nella camera e le domandò quasi strozzato: - Tu le carte di là al La Rosa? - Le carte? Che carte?
novelle05_04_pirandello_f000398|— disse Rorò, accorrendo a sostenerlo, tutta sconvolta.|- disse Rorò, accorrendo a sostenerlo, tutta sconvolta.
novelle05_04_pirandello_f000399|— Le mie… i documenti di… di mio fratello… — balbettò Sciaramè appressandosi al cassettone.|- Le mie i documenti di di mio fratello - balbettò Sciaramè appressandosi al cassettone.
novelle05_04_pirandello_f000400|— Apri… Fammi vedere… Rorò aprí il cassetto.|- Apri Fammi vedere Rorò aprí il cassetto.
novelle05_04_pirandello_f000401|Sciaramè cacciò una mano con le dita artigliate sul fascetto dei documenti logori, ingialliti, legati con lo spago;|Sciaramè cacciò una mano con le dita artigliate sul fascetto dei documenti logori, ingialliti, legati con lo spago;
