novelle05_08_pirandello_f000234|e lui a rompersi le ossa sul divanaccio sgangherato che gli cacciava tra le costole le molle sconnesse|e lui a rompersi le ossa sul divanaccio sgangherato che gli cacciava tra le costole le molle sconnesse
novelle05_08_pirandello_f000235|cosí che ogni notte sognava di giacer lungo disteso sulle vette di una giogaja di monti.|cosí che ogni notte sognava di giacer lungo disteso sulle vette di una giogaja di monti.
novelle05_08_pirandello_f000236|Ma per la cura, poteva andare dal farmacista, dal droghiere|Ma per la cura, poteva andare dal farmacista, dal droghiere
novelle05_08_pirandello_f000237|dal macellajo a prender roba a credito, dicendo che la Norvegia avrebbe poi pagato?|dal macellajo a prender roba a credito, dicendo che la Norvegia avrebbe poi pagato?
novelle05_08_pirandello_f000238|— Lí, boghe e cefaletti, il giorno, e gronghi la sera, quando ne pescava;|- Lí, boghe e cefaletti, il giorno, e gronghi la sera, quando ne pescava;
novelle05_08_pirandello_f000239|e se no, niente! Eppure quel povero diavolo era riuscito a non morire! Doveva essere a prova di bomba|e se no, niente! Eppure quel povero diavolo era riuscito a non morire! Doveva essere a prova di bomba
novelle05_08_pirandello_f000240|se non ci aveva potuto neanche il medico del paese|se non ci aveva potuto neanche il medico del paese
novelle05_08_pirandello_f000241|che aveva tanto buon cuore e tanta carità di prossimo da ammazzare almeno un concittadino al giorno.|che aveva tanto buon cuore e tanta carità di prossimo da ammazzare almeno un concittadino al giorno.
novelle05_08_pirandello_f000242|Non diceva cosí, perché in fondo volesse male a quel povero straniero;|Non diceva cosí, perché in fondo volesse male a quel povero straniero;
novelle05_08_pirandello_f000243|no, ma — porco diavolo! — esclamava don Pietro — chi più poveretto di me?|no, ma - porco diavolo! - esclamava don Pietro - chi più poveretto di me?
novelle05_08_pirandello_f000244|Manco male che, fra pochi giorni, si sarebbe liberato.|Manco male che, fra pochi giorni, si sarebbe liberato.
novelle05_08_pirandello_f000245|Il Norvegese, ch’egli chiamava L’arso (si chiamava Lars Cleen), era già entrato in convalescenza|Il Norvegese, chegli chiamava Larso si chiamava Lars Cleen, era già entrato in convalescenza
novelle05_08_pirandello_f000246|e di lí a una, a due settimane al più, si sarebbe potuto mettere in viaggio.|e di lí a una, a due settimane al più, si sarebbe potuto mettere in viaggio.
novelle05_08_pirandello_f000247|Ne era tempo, perché donna Rosolina non voleva più saperne di far la guardia alla nipote:|Ne era tempo, perché donna Rosolina non voleva più saperne di far la guardia alla nipote:
novelle05_08_pirandello_f000248|protestava d’esser nubile anche lei e che non le pareva ben fatto che due donne stessero a tener compagnia a quell’uomo ch’ella credeva veramente turco,|protestava desser nubile anche lei e che non le pareva ben fatto che due donne stessero a tener compagnia a quelluomo chella credeva veramente turco,
novelle05_08_pirandello_f000249|e perciò fuori della grazia di Dio.|e perciò fuori della grazia di Dio.
novelle05_08_pirandello_f000250|Già si era levato di letto, poteva muoversi e… e… non si sa mai! Donna Rosolina non aggiungeva|Già si era levato di letto, poteva muoversi e e non si sa mai! Donna Rosolina non aggiungeva
novelle05_08_pirandello_f000251|in queste rimostranze a don Pietro, che il contegno di Venerina, verso il convalescente, da un pezzo non le garbava più.|in queste rimostranze a don Pietro, che il contegno di Venerina, verso il convalescente, da un pezzo non le garbava più.
novelle05_08_pirandello_f000252|Il convalescente pareva uscito dalla malattia mortale quasi di nuovo bambino.|Il convalescente pareva uscito dalla malattia mortale quasi di nuovo bambino.
novelle05_08_pirandello_f000253|Il sorriso, lo sguardo degli occhi limpidi avevano proprio una espressione infantile. Era ancora magrissimo;|Il sorriso, lo sguardo degli occhi limpidi avevano proprio una espressione infantile. Era ancora magrissimo;
novelle05_08_pirandello_f000254|ma il volto gli s’era rasserenato, la pelle gli si ricoloriva leggermente;|ma il volto gli sera rasserenato, la pelle gli si ricoloriva leggermente;
novelle05_08_pirandello_f000255|e gli rispuntavano più biondi, lievi, aerei, i capelli che gli erano caduti durante la malattia.|e gli rispuntavano più biondi, lievi, aerei, i capelli che gli erano caduti durante la malattia.
novelle05_08_pirandello_f000256|Venerina, nel vederlo cosí timido, smarrito nella beatitudine di quel suo rinascere in un paese ignoto|Venerina, nel vederlo cosí timido, smarrito nella beatitudine di quel suo rinascere in un paese ignoto
novelle05_08_pirandello_f000257|tra gente estranea, provava per lui una tenerezza quasi materna.|tra gente estranea, provava per lui una tenerezza quasi materna.
novelle05_08_pirandello_f000258|Ma tutta la loro conversazione si riduceva, per Venerina che non intendeva il francese e tanto meno il norvegese|Ma tutta la loro conversazione si riduceva, per Venerina che non intendeva il francese e tanto meno il norvegese
novelle05_08_pirandello_f000259|a una variazione di tono nel pronunziare il nome di lui, Cleen.|a una variazione di tono nel pronunziare il nome di lui, Cleen.
novelle05_08_pirandello_f000260|Cosí, se egli si ricusava, arricciando il naso, scotendo la testa|Cosí, se egli si ricusava, arricciando il naso, scotendo la testa
novelle05_08_pirandello_f000261|di prendere qualche medicina o qualche cibo, ella pronunziava quel Cleen con voce cupa|di prendere qualche medicina o qualche cibo, ella pronunziava quel Cleen con voce cupa
novelle05_08_pirandello_f000262|d’impero, aggrottando le ciglia su gli occhi fermi, severi, come per dire: «Obbedisci: non ammetto capricci!».|dimpero, aggrottando le ciglia su gli occhi fermi, severi, come per dire: Obbedisci: non ammetto capricci!.
novelle05_08_pirandello_f000263|— Se poi egli, in uno scatto di gioconda tenerezza, vedendosela passar da presso|- Se poi egli, in uno scatto di gioconda tenerezza, vedendosela passar da presso
novelle05_08_pirandello_f000264|le tirava un po’ la veste, col volto illuminato da un sorriso di gratitudine e di simpatia|le tirava un po la veste, col volto illuminato da un sorriso di gratitudine e di simpatia
novelle05_08_pirandello_f000265|Venerina strascicava quel Cleen in una esclamazione di stupore e di rimprovero, come se volesse dirgli: «Sei matto?|Venerina strascicava quel Cleen in una esclamazione di stupore e di rimprovero, come se volesse dirgli: Sei matto?
novelle05_08_pirandello_f000266|Ma lo stupore era finto, il rimprovero dolce: espressi l’uno e l’altro per ammansare gli scrupoli di donna Rosolina che|Ma lo stupore era finto, il rimprovero dolce: espressi luno e laltro per ammansare gli scrupoli di donna Rosolina che
novelle05_08_pirandello_f000267|assistendo a quelle scene, sarebbe diventata di centomila colori, se non avesse avuto sulle magre gote quella patina di rossetto.|assistendo a quelle scene, sarebbe diventata di centomila colori, se non avesse avuto sulle magre gote quella patina di rossetto.
novelle05_08_pirandello_f000268|Anche lei, Venerina, si sentiva quasi rinata.|Anche lei, Venerina, si sentiva quasi rinata.
novelle05_08_pirandello_f000269|Avvezza a star sempre sola, in quella casa povera e nuda, senza cure intime|Avvezza a star sempre sola, in quella casa povera e nuda, senza cure intime
novelle05_08_pirandello_f000270|senza affetti vivi, da un pezzo s’era abbandonata a un’uggia invincibile|senza affetti vivi, da un pezzo sera abbandonata a unuggia invincibile
novelle05_08_pirandello_f000271|a un tedio smanioso: il cuore le si era come isterilito, e la sterilità del sentimento si disfaceva in lei nella pigrizia più accidiosa.|a un tedio smanioso: il cuore le si era come isterilito, e la sterilità del sentimento si disfaceva in lei nella pigrizia più accidiosa.
novelle05_08_pirandello_f000272|Lei stessa, ora, non avrebbe saputo spiegarsi perché le andasse tanto di sfaccendare per casa|Lei stessa, ora, non avrebbe saputo spiegarsi perché le andasse tanto di sfaccendare per casa
novelle05_08_pirandello_f000273|lietamente, di levarsi per tempo e d’acconciarsi.|lietamente, di levarsi per tempo e dacconciarsi.
novelle05_08_pirandello_f000274|— Miracoli! Miracoli! — esclamava don Paranza, rincasando la sera, con gli attrezzi da pesca, tutto fragrante di mare.|- Miracoli! Miracoli! - esclamava don Paranza, rincasando la sera, con gli attrezzi da pesca, tutto fragrante di mare.
novelle05_08_pirandello_f000275|Trovava ogni cosa in ordine: la tavola apparecchiata, pronta la cena.|Trovava ogni cosa in ordine: la tavola apparecchiata, pronta la cena.
novelle05_08_pirandello_f000276|— Miracoli! Entrava nella camera dell’infermo, fregandosi le mani: — Bon suarre, mossiur Cleen, bon suarre! — Buona sera|- Miracoli! Entrava nella camera dellinfermo, fregandosi le mani: - Bon suarre, mossiur Cleen, bon suarre! - Buona sera
novelle05_08_pirandello_f000277|— rispondeva in italiano il convalescente, sorridendo, staccando e quasi incidendo con la pronunzia le due parole. — Come come?|- rispondeva in italiano il convalescente, sorridendo, staccando e quasi incidendo con la pronunzia le due parole. - Come come?
novelle05_08_pirandello_f000278|— esclamava allora don Pietro stupito, guardando Venerina che rideva, e poi donna Rosolina che stava seria|- esclamava allora don Pietro stupito, guardando Venerina che rideva, e poi donna Rosolina che stava seria
novelle05_08_pirandello_f000279|seduta, intozzata su di sé, con le labbra strette e le palpebre gravi, semichiuse.|seduta, intozzata su di sé, con le labbra strette e le palpebre gravi, semichiuse.
novelle05_08_pirandello_f000280|A poco a poco Venerina era riuscita a insegnare allo straniero qualche frase italiana e un po’ di nomenclatura elementare, con un mezzo semplicissimo.|A poco a poco Venerina era riuscita a insegnare allo straniero qualche frase italiana e un po di nomenclatura elementare, con un mezzo semplicissimo.
novelle05_08_pirandello_f000281|Gl’indicava un oggetto nella camera e lo costringeva a ripeterne più e più volte il nome|Glindicava un oggetto nella camera e lo costringeva a ripeterne più e più volte il nome
novelle05_08_pirandello_f000282|finché non lo pronunziasse correttamente: — bicchiere|finché non lo pronunziasse correttamente: - bicchiere
novelle05_08_pirandello_f000283|letto, seggiola, finestra… — E che risate quando egli sbagliava, risate che diventavano fragorose se s’accorgeva che la zia zitellona|letto, seggiola, finestra - E che risate quando egli sbagliava, risate che diventavano fragorose se saccorgeva che la zia zitellona
novelle05_08_pirandello_f000284|legnosa nella sua pudibonda severità, per non cedere al contagio del riso si torturava le labbra|legnosa nella sua pudibonda severità, per non cedere al contagio del riso si torturava le labbra
novelle05_08_pirandello_f000285|massime quando l’infermo accompagnava con gesti comicissimi quelle parole staccate|massime quando linfermo accompagnava con gesti comicissimi quelle parole staccate
novelle05_08_pirandello_f000286|telegrafando cosí a segni le parti sostanziali del discorso che gli mancavano.|telegrafando cosí a segni le parti sostanziali del discorso che gli mancavano.
novelle05_08_pirandello_f000287|Ma presto egli poté anche dire: aprire, chiudere finestra, prendere bicchiere, e anche voglio andare letto.|Ma presto egli poté anche dire: aprire, chiudere finestra, prendere bicchiere, e anche voglio andare letto.
novelle05_08_pirandello_f000288|Se non che, imparato quel voglio, cominciò a farne frequentissimo uso|Se non che, imparato quel voglio, cominciò a farne frequentissimo uso
novelle05_08_pirandello_f000289|e l’impegno che metteva nel superare lo stento della pronunzia, dava un più reciso tono di comando alla parola.|e limpegno che metteva nel superare lo stento della pronunzia, dava un più reciso tono di comando alla parola.
novelle05_08_pirandello_f000290|Venerina ne rideva, ma pensò d’attenuare quel tono insegnando all’infermo di premettere ogni volta a quel voglio un prego.|Venerina ne rideva, ma pensò dattenuare quel tono insegnando allinfermo di premettere ogni volta a quel voglio un prego.
novelle05_08_pirandello_f000291|Prego, sí, ma poiché egli non riusciva a pronunziare correttamente questa nuova parola|Prego, sí, ma poiché egli non riusciva a pronunziare correttamente questa nuova parola
novelle05_08_pirandello_f000292|quando voleva qualche cosa, aspettava che Venerina si voltasse a guardarlo|quando voleva qualche cosa, aspettava che Venerina si voltasse a guardarlo
novelle05_08_pirandello_f000293|e allora congiungeva le mani in segno di preghiera e quindi spiccicava più che mai imperioso e reciso il suo voglio.|e allora congiungeva le mani in segno di preghiera e quindi spiccicava più che mai imperioso e reciso il suo voglio.
novelle05_08_pirandello_f000294|La premessa di quel segno di preghiera era assolutamente necessaria ogni qual volta egli voleva presso di sé lo stipetto che il compagno gli aveva portato dal piroscafo,|La premessa di quel segno di preghiera era assolutamente necessaria ogni qual volta egli voleva presso di sé lo stipetto che il compagno gli aveva portato dal piroscafo,
novelle05_08_pirandello_f000295|il giorno in cui ne era sceso moribondo.|il giorno in cui ne era sceso moribondo.
novelle05_08_pirandello_f000296|Venerina glielo porgeva ogni volta di malanimo e senza il garbo consueto.|Venerina glielo porgeva ogni volta di malanimo e senza il garbo consueto.
novelle05_08_pirandello_f000297|Quella cassetta rappresentava per lui la patria lontana: c’erano tutti i suoi ricordi e tante lettere e alcuni ritratti.|Quella cassetta rappresentava per lui la patria lontana: cerano tutti i suoi ricordi e tante lettere e alcuni ritratti.
novelle05_08_pirandello_f000298|Guardandolo obliquamente, mentr’egli rileggeva qualcuna di quelle lettere|Guardandolo obliquamente, mentregli rileggeva qualcuna di quelle lettere
novelle05_08_pirandello_f000299|o se ne stava astratto, con gli occhi invagati, Venerina lo vedeva quasi sotto un altro aspetto|o se ne stava astratto, con gli occhi invagati, Venerina lo vedeva quasi sotto un altro aspetto
novelle05_08_pirandello_f000300|come se fosse avvolto in un’altra aria che lo allontanasse da lei all’improvviso|come se fosse avvolto in unaltra aria che lo allontanasse da lei allimprovviso
novelle05_08_pirandello_f000301|e notava tante particolarità della diversa natura di lui, non mai prima notate.|e notava tante particolarità della diversa natura di lui, non mai prima notate.
novelle05_08_pirandello_f000302|Quella cassetta, in cui egli frugava con tanta insistenza|Quella cassetta, in cui egli frugava con tanta insistenza
novelle05_08_pirandello_f000303|le richiamava davanti agli occhi l’immagine di quell’altro marinajo che lo aveva sollevato dalla barella come un bambino per deporlo sul letto|le richiamava davanti agli occhi limmagine di quellaltro marinajo che lo aveva sollevato dalla barella come un bambino per deporlo sul letto
novelle05_08_pirandello_f000304|lí, e poi se n’era andato, piangendo.|lí, e poi se nera andato, piangendo.
novelle05_08_pirandello_f000305|Ed ella si era presa tanta cura di quell’abbandonato! Chi era egli? Donde veniva?|Ed ella si era presa tanta cura di quellabbandonato! Chi era egli? Donde veniva?
novelle05_08_pirandello_f000306|Quali ricordi custodiva con tanto amore in quella cassetta?|Quali ricordi custodiva con tanto amore in quella cassetta?
novelle05_08_pirandello_f000307|Venerina scrollava a un tratto le spalle con un moto di dispetto, dicendo a se stessa: — Che me n’importa?|Venerina scrollava a un tratto le spalle con un moto di dispetto, dicendo a se stessa: - Che me nimporta?
novelle05_08_pirandello_f000308|— e lo lasciava lí solo nella camera, a pascersi di quei suoi segreti ricordi|- e lo lasciava lí solo nella camera, a pascersi di quei suoi segreti ricordi
novelle05_08_pirandello_f000309|e si tirava con sé la zia, che la seguiva stordita di quella risoluzione repentina: — Che facciamo? — Nulla.|e si tirava con sé la zia, che la seguiva stordita di quella risoluzione repentina: - Che facciamo? - Nulla.
novelle05_08_pirandello_f000310|Ce n’andiamo! Venerina ricadeva d’un tratto, in quei momenti, nel suo tedio neghittoso|Ce nandiamo! Venerina ricadeva dun tratto, in quei momenti, nel suo tedio neghittoso
novelle05_08_pirandello_f000311|inasprito da una sorda stizza o aggravato da una pena d’indefiniti desiderii: la casa le appariva vuota di nuovo|inasprito da una sorda stizza o aggravato da una pena dindefiniti desiderii: la casa le appariva vuota di nuovo
novelle05_08_pirandello_f000312|vuota la vita, e sbuffava: non voleva far nulla, più nulla!|vuota la vita, e sbuffava: non voleva far nulla, più nulla!
novelle05_09_pirandello_f000001|Novelle per un anno di luigi pirandello|Novelle per un anno di luigi pirandello
novelle05_09_pirandello_f000002|LONTANO SECONDO PARTE CAPITULO QUATTRO.|LONTANO SECONDO PARTE CAPITULO QUATTRO.
novelle05_09_pirandello_f000003|Lars Cleen, appena solo, si sentiva come caduto in un altro mondo, più luminoso|Lars Cleen, appena solo, si sentiva come caduto in un altro mondo, più luminoso
novelle05_09_pirandello_f000004|di cui non conosceva che tre abitanti soli e una casa, anzi una camera.|di cui non conosceva che tre abitanti soli e una casa, anzi una camera.
novelle05_09_pirandello_f000005|Non si rendeva ragione di quei dispettucci di Venerina.|Non si rendeva ragione di quei dispettucci di Venerina.
novelle05_09_pirandello_f000006|Non si rendeva ragione di nulla.|Non si rendeva ragione di nulla.
novelle05_09_pirandello_f000007|Tendeva l’orecchio ai rumori della via, si sforzava d’intendere;|Tendeva lorecchio ai rumori della via, si sforzava dintendere;
novelle05_09_pirandello_f000008|ma nessuna sensazione della vita di fuori riusciva a destare in lui un’immagine precisa.|ma nessuna sensazione della vita di fuori riusciva a destare in lui unimmagine precisa.
novelle05_09_pirandello_f000009|La campana… sí, ma egli vedeva col pensiero una chiesa del suo remoto paese! Un fischio di sirena|La campana sí, ma egli vedeva col pensiero una chiesa del suo remoto paese! Un fischio di sirena
novelle05_09_pirandello_f000010|ed egli vedeva l’Hammerfest perduto nei mari lontani.|ed egli vedeva lHammerfest perduto nei mari lontani.
novelle05_09_pirandello_f000011|E com’era restato una sera, nel silenzio, alla vista della luna, nel vano della finestra! Era pure|E comera restato una sera, nel silenzio, alla vista della luna, nel vano della finestra! Era pure
novelle05_09_pirandello_f000012|era pure la stessa luna ch’egli tante volte in patria, per mare, aveva veduta;|era pure la stessa luna chegli tante volte in patria, per mare, aveva veduta;
novelle05_09_pirandello_f000013|ma gli era parso che lí, in quel paese ignoto, ella parlasse ai tetti di quelle case|ma gli era parso che lí, in quel paese ignoto, ella parlasse ai tetti di quelle case
novelle05_09_pirandello_f000014|al campanile di quella chiesa, quasi un altro linguaggio di luce|al campanile di quella chiesa, quasi un altro linguaggio di luce
novelle05_09_pirandello_f000015|e l’aveva guardata a lungo, con un senso di sgomento angoscioso, sentendo più acuta che mai la pena dell’abbandono, il proprio isolamento.|e laveva guardata a lungo, con un senso di sgomento angoscioso, sentendo più acuta che mai la pena dellabbandono, il proprio isolamento.
novelle05_09_pirandello_f000016|Viveva nel vago, nell’indefinito, come in una sfera vaporosa di sogni.|Viveva nel vago, nellindefinito, come in una sfera vaporosa di sogni.
novelle05_09_pirandello_f000017|Un giorno, finalmente, s’accorse che sul coperchio della cassetta erano scritte col gesso tre parole: — bet! bet! bet! — cosí.|Un giorno, finalmente, saccorse che sul coperchio della cassetta erano scritte col gesso tre parole: - bet! bet! bet! - cosí.
novelle05_09_pirandello_f000018|Domandò col gesto a Venerina che cosa volessero significare, e Venerina, pronta: — Tu|Domandò col gesto a Venerina che cosa volessero significare, e Venerina, pronta: - Tu
novelle05_09_pirandello_f000019|bet! Lars Cleen restò a guardarla con gli occhi chiari ridenti e smarriti.|bet! Lars Cleen restò a guardarla con gli occhi chiari ridenti e smarriti.
novelle05_09_pirandello_f000020|Non comprendeva, o meglio non sapeva credere che… No, no – e con le mani le fece segno che avesse pietà di lui che tra poco doveva partire.|Non comprendeva, o meglio non sapeva credere che No, no - e con le mani le fece segno che avesse pietà di lui che tra poco doveva partire.
novelle05_09_pirandello_f000021|Venerina scrollò le spalle e lo salutò con la mano.|Venerina scrollò le spalle e lo salutò con la mano.
novelle05_09_pirandello_f000022|— Buon viaggio! — No, no, — fece di nuovo il Cleen col capo|- Buon viaggio! - No, no, - fece di nuovo il Cleen col capo
novelle05_09_pirandello_f000023|e la chiamò a sé col gesto: aprí la cassetta e ne trasse una veduta fotografica di Trondhjem.|e la chiamò a sé col gesto: aprí la cassetta e ne trasse una veduta fotografica di Trondhjem.
novelle05_09_pirandello_f000024|Vi si vedeva, tra gli alberi, la maestosa cattedrale marmorea sovrastante tutti gli altri edifici|Vi si vedeva, tra gli alberi, la maestosa cattedrale marmorea sovrastante tutti gli altri edifici
novelle05_09_pirandello_f000025|col camposanto prossimo, ove i fedeli superstiti si recano ogni sabato a ornare di fiori le tombe dei loro morti.|col camposanto prossimo, ove i fedeli superstiti si recano ogni sabato a ornare di fiori le tombe dei loro morti.
novelle05_09_pirandello_f000026|Ella non riuscí a comprendere perché le mostrasse quella veduta.|Ella non riuscí a comprendere perché le mostrasse quella veduta.
novelle05_09_pirandello_f000027|— Ma mère, ici, — s’affannava a dirle il Cleen, indicandole col dito il cimitero, lí, all’ombra del magnifico tempio.|- Ma mère, ici, - saffannava a dirle il Cleen, indicandole col dito il cimitero, lí, allombra del magnifico tempio.
novelle05_09_pirandello_f000028|Anche lui, come don Pietro, non era molto padrone della lingua francese, che del resto non serviva affatto con Venerina.|Anche lui, come don Pietro, non era molto padrone della lingua francese, che del resto non serviva affatto con Venerina.
novelle05_09_pirandello_f000029|Trasse allora dalla cassetta un’altra fotografia: il ritratto d’una giovine.|Trasse allora dalla cassetta unaltra fotografia: il ritratto duna giovine.
novelle05_09_pirandello_f000030|Subito Venerina vi fissò gli occhi, impallidendo.|Subito Venerina vi fissò gli occhi, impallidendo.
novelle05_09_pirandello_f000031|Ma il Cleen si pose accanto al volto il ritratto, per farle vedere che quella giovine gli somigliava.|Ma il Cleen si pose accanto al volto il ritratto, per farle vedere che quella giovine gli somigliava.
novelle05_09_pirandello_f000032|— Ma soeur, — aggiunse.|- Ma soeur, - aggiunse.
novelle05_09_pirandello_f000033|Questa volta Venerina comprese e s’ilarò tutta.|Questa volta Venerina comprese e silarò tutta.
novelle05_09_pirandello_f000034|Se poi quella sorella fosse fidanzata o già moglie del giovane marinajo che aveva recato la cassetta|Se poi quella sorella fosse fidanzata o già moglie del giovane marinajo che aveva recato la cassetta
novelle05_09_pirandello_f000035|Venerina non si curò più che tanto d’indovinare.|Venerina non si curò più che tanto dindovinare.
novelle05_09_pirandello_f000036|Le bastò sapere che L’arso era celibe.|Le bastò sapere che Larso era celibe.
novelle05_09_pirandello_f000037|Sí: ma non doveva ripartire fra pochi giorni?|Sí: ma non doveva ripartire fra pochi giorni?
novelle05_09_pirandello_f000038|Era già in grado di uscir di casa e di recarsi a piedi, sul tramonto, al Molo Vecchio.|Era già in grado di uscir di casa e di recarsi a piedi, sul tramonto, al Molo Vecchio.
novelle05_09_pirandello_f000039|Una frotta di monellacci scalzi, stracciati, alcuni ignudi nati, abbrustiti dal sole|Una frotta di monellacci scalzi, stracciati, alcuni ignudi nati, abbrustiti dal sole
novelle05_09_pirandello_f000040|seguiva ogni volta Lars Cleen in quelle sue passeggiate: lo spiavano|seguiva ogni volta Lars Cleen in quelle sue passeggiate: lo spiavano
novelle05_09_pirandello_f000041|scambiandosi ad alta voce osservazioni e commenti che presto si mutavano in lazzi.|scambiandosi ad alta voce osservazioni e commenti che presto si mutavano in lazzi.
novelle05_09_pirandello_f000042|Egli, stordito, abbagliato nell’aria che grillava di luce, si voltava ora verso l’uno ora verso l’altro, sorridendo;|Egli, stordito, abbagliato nellaria che grillava di luce, si voltava ora verso luno ora verso laltro, sorridendo;
novelle05_09_pirandello_f000043|talora gli toccava di minacciare col bastone i più insolenti;|talora gli toccava di minacciare col bastone i più insolenti;
novelle05_09_pirandello_f000044|poi sedeva sul muricciuolo della banchina a guardare i bastimenti ormeggiati e il mare infiammato dal riflesso delle nuvole vespertine.|poi sedeva sul muricciuolo della banchina a guardare i bastimenti ormeggiati e il mare infiammato dal riflesso delle nuvole vespertine.
novelle05_09_pirandello_f000045|La gente si fermava a osservarlo, mentre egli se ne stava in quell’atteggiamento, tra smarrito ed estatico: lo guardava|La gente si fermava a osservarlo, mentre egli se ne stava in quellatteggiamento, tra smarrito ed estatico: lo guardava
