novelle05_12_pirandello_f000155|poiché dagli anni il Brivio non risentiva il minimo danno né nel corpo vivacissimo e nervoso|poiché dagli anni il Brivio non risentiva il minimo danno né nel corpo vivacissimo e nervoso
novelle05_12_pirandello_f000156|né tanto meno poi nell’animo dotato d’infaticabile energia, d’irrequieta alacrità.|né tanto meno poi nellanimo dotato dinfaticabile energia, dirrequieta alacrità.
novelle05_12_pirandello_f000157|Di ben altro Anna, ora per la prima volta|Di ben altro Anna, ora per la prima volta
novelle05_12_pirandello_f000158|guardando (senza neppur sospettarlo) nella sua vita con gli occhi di quella morta, trovava da lagnarsi del marito.|guardando senza neppur sospettarlo nella sua vita con gli occhi di quella morta, trovava da lagnarsi del marito.
novelle05_12_pirandello_f000159|Sí, era vero: della noncuranza quasi sdegnosa di lui ella si era altre volte sentita ferire; ma non mai come quel giorno;|Sí, era vero: della noncuranza quasi sdegnosa di lui ella si era altre volte sentita ferire; ma non mai come quel giorno;
novelle05_12_pirandello_f000160|e ora per la prima volta si sentiva cosí angosciosamente sola, divisa dai suoi parenti|e ora per la prima volta si sentiva cosí angosciosamente sola, divisa dai suoi parenti
novelle05_12_pirandello_f000161|i quali le pareva in quel momento la avessero abbandonata lí|i quali le pareva in quel momento la avessero abbandonata lí
novelle05_12_pirandello_f000162|quasi che, sposando il Brivio, avesse già qualcosa di comune con quella morta e non fosse più degna d’altra compagnia.|quasi che, sposando il Brivio, avesse già qualcosa di comune con quella morta e non fosse più degna daltra compagnia.
novelle05_12_pirandello_f000163|E il marito che avrebbe dovuto consolarla|E il marito che avrebbe dovuto consolarla
novelle05_12_pirandello_f000164|il marito stesso pareva non volesse darle alcun merito del sacrifizio ch’ella gli aveva fatto del suo amore filiale e fraterno|il marito stesso pareva non volesse darle alcun merito del sacrifizio chella gli aveva fatto del suo amore filiale e fraterno
novelle05_12_pirandello_f000165|come se a lei non fosse costato nulla, come se a quel sacrifizio egli avesse avuto diritto|come se a lei non fosse costato nulla, come se a quel sacrifizio egli avesse avuto diritto
novelle05_12_pirandello_f000166|e per ciò nessun dovere avesse ora di compensarnela.|e per ciò nessun dovere avesse ora di compensarnela.
novelle05_12_pirandello_f000167|Diritto, sí, ma perché lei se ne era cosí perdutamente innamorata allora;|Diritto, sí, ma perché lei se ne era cosí perdutamente innamorata allora;
novelle05_12_pirandello_f000168|dunque il dovere per lui adesso di compensarla.|dunque il dovere per lui adesso di compensarla.
novelle05_12_pirandello_f000169|E invece… — Sempre cosí! — parve ad Anna di sentirsi sospirare dalle labbra dolenti della morta.|E invece - Sempre cosí! - parve ad Anna di sentirsi sospirare dalle labbra dolenti della morta.
novelle05_12_pirandello_f000170|Riaccese il lume e di nuovo, contemplando l’immagine, fu attratta dall’espressione di quegli occhi.|Riaccese il lume e di nuovo, contemplando limmagine, fu attratta dallespressione di quegli occhi.
novelle05_12_pirandello_f000171|Anche lei dunque, davvero, aveva sofferto per lui?|Anche lei dunque, davvero, aveva sofferto per lui?
novelle05_12_pirandello_f000172|anche lei, anche lei, accorgendosi di non essere amata, aveva sentito quel vuoto angoscioso? — Sí? sí?|anche lei, anche lei, accorgendosi di non essere amata, aveva sentito quel vuoto angoscioso? - Sí? sí?
novelle05_12_pirandello_f000173|— domandò Anna, soffocata dal pianto, all’immagine.|- domandò Anna, soffocata dal pianto, allimmagine.
novelle05_12_pirandello_f000174|E le parve allora che quegli occhi buoni, intensi di passione, la commiserassero a lor volta|E le parve allora che quegli occhi buoni, intensi di passione, la commiserassero a lor volta
novelle05_12_pirandello_f000175|la compiangessero di quell’abbandono, del sacrifizio non rimeritato|la compiangessero di quellabbandono, del sacrifizio non rimeritato
novelle05_12_pirandello_f000176|dell’amore che le restava chiuso in seno quasi tesoro in uno scrigno|dellamore che le restava chiuso in seno quasi tesoro in uno scrigno
novelle05_12_pirandello_f000177|di cui egli avesse le chiavi, ma per non servirsene mai, come l’avaro.|di cui egli avesse le chiavi, ma per non servirsene mai, come lavaro.
novelle05_13_pirandello_f000001|Novelle per un anno di luigi pirandello|Novelle per un anno di luigi pirandello
novelle05_13_pirandello_f000002|TRA DUE OMBRE.|TRA DUE OMBRE.
novelle05_13_pirandello_f000003|Stridore di catene e scambio di saluti e d’augurii|Stridore di catene e scambio di saluti e daugurii
novelle05_13_pirandello_f000004|ultime raccomandazioni e grida di richiamo tra i passeggeri di terza classe e la gente che s’affollava su lo scalo dell’Immacolatella o sulle barchette ballanti attorno al piroscafo in parterza.|ultime raccomandazioni e grida di richiamo tra i passeggeri di terza classe e la gente che saffollava su lo scalo dellImmacolatella o sulle barchette ballanti attorno al piroscafo in parterza.
novelle05_13_pirandello_f000005|— De vení cu tte! de vení cu tte! — No! no! t’ ’o ddico! — E nun avé paura! — Core mio, core ’e mamma, stenne ’e mmane! — Addò sta? addò sta?|- De vení cu tte! de vení cu tte! - No! no! t o ddico! - E nun avé paura! - Core mio, core e mamma, stenne e mmane! - Addò sta? addò sta?
novelle05_13_pirandello_f000006|— Mo sta cca! — Allegramente! E tra tanta confusione, per accrescere l’agitazione di chi partiva|- Mo sta cca! - Allegramente! E tra tanta confusione, per accrescere lagitazione di chi partiva
novelle05_13_pirandello_f000007|il suono titillante dei mandolini d’una banda di musici girovaghi.|il suono titillante dei mandolini duna banda di musici girovaghi.
novelle05_13_pirandello_f000008|— Faustino! Dio mio, guarda Niní… guarda Bicetta… — gridava al Sangelli la moglie che non si moveva per timore del mal di mare|- Faustino! Dio mio, guarda Niní guarda Bicetta - gridava al Sangelli la moglie che non si moveva per timore del mal di mare
novelle05_13_pirandello_f000009|prima ancora che il piroscafo si mettesse in movimento.|prima ancora che il piroscafo si mettesse in movimento.
novelle05_13_pirandello_f000010|Non c’era stato verso d’indurla ad andare a sedere sul piano di coperta destinato alla prima classe, a pruavía.|Non cera stato verso dindurla ad andare a sedere sul piano di coperta destinato alla prima classe, a pruavía.
novelle05_13_pirandello_f000011|S’era buttata come una balla sul sedile del lucernario della camera di poppa;|Sera buttata come una balla sul sedile del lucernario della camera di poppa;
novelle05_13_pirandello_f000012|e cosí grassa come s’era fatta pochi anni dopo il matrimonio, bionda e pallida, con gli occhi azzurri ovati|e cosí grassa come sera fatta pochi anni dopo il matrimonio, bionda e pallida, con gli occhi azzurri ovati
novelle05_13_pirandello_f000013|non si curava nemmeno dello spettacolo che dava con quel suo ridicolo sgomento|non si curava nemmeno dello spettacolo che dava con quel suo ridicolo sgomento
novelle05_13_pirandello_f000014|aggrappata con la mano tozza piena d’anelli al bracciuolo di legno del sedile, quasi che, tenendolo cosí|aggrappata con la mano tozza piena danelli al bracciuolo di legno del sedile, quasi che, tenendolo cosí
novelle05_13_pirandello_f000015|volesse impedire lo scotimento fitto fitto e continuo della macchina già sotto pressione.|volesse impedire lo scotimento fitto fitto e continuo della macchina già sotto pressione.
novelle05_13_pirandello_f000016|Strillava lamentosamente per Bicetta, per Niní, per Carluccio, ma non osava neppure girare un po’ la testa per vedere dove fossero.|Strillava lamentosamente per Bicetta, per Niní, per Carluccio, ma non osava neppure girare un po la testa per vedere dove fossero.
novelle05_13_pirandello_f000017|L’ampio velo turchino attorno al cappello di paglia, col vento, le sbatteva in faccia;|Lampio velo turchino attorno al cappello di paglia, col vento, le sbatteva in faccia;
novelle05_13_pirandello_f000018|lo lasciava sbattere, pur di non muoversi;|lo lasciava sbattere, pur di non muoversi;
novelle05_13_pirandello_f000019|e teneva fissi gli occhi spaventati a una manica a vento lí presso, suo incubo forse, ma anche riparo e protezione.|e teneva fissi gli occhi spaventati a una manica a vento lí presso, suo incubo forse, ma anche riparo e protezione.
novelle05_13_pirandello_f000020|— Carluccio, Dio mio, dov’è? Faustino! Faustino! E Bicetta?|- Carluccio, Dio mio, dovè? Faustino! Faustino! E Bicetta?
novelle05_13_pirandello_f000021|Con l’aria che batteva viva, da terra là sopra coperta e che si portava via il fumo della ciminiera tra il cordame dell’alberatura, nel chiarore aperto e fresco|Con laria che batteva viva, da terra là sopra coperta e che si portava via il fumo della ciminiera tra il cordame dellalberatura, nel chiarore aperto e fresco
novelle05_13_pirandello_f000022|tutto lampeggiante dei riflessi del sole al tramonto sul mare un po’ mosso a ogni sollevarsi dei parasoli|tutto lampeggiante dei riflessi del sole al tramonto sul mare un po mosso a ogni sollevarsi dei parasoli
novelle05_13_pirandello_f000023|quei tre benedetti ragazzi, che non erano stati mai su un piroscafo, parevano impazziti;|quei tre benedetti ragazzi, che non erano stati mai su un piroscafo, parevano impazziti;
novelle05_13_pirandello_f000024|si ficcavano tra la gente, da per tutto, tra le scale sul passavanti, le lapazze, i ponti di sbarco, sotto le lance;|si ficcavano tra la gente, da per tutto, tra le scale sul passavanti, le lapazze, i ponti di sbarco, sotto le lance;
novelle05_13_pirandello_f000025|volevano veder tutto, e correvano davvero il rischio anche di precipitar giú in mare.|volevano veder tutto, e correvano davvero il rischio anche di precipitar giú in mare.
novelle05_13_pirandello_f000026|Faustino Sangelli, andando loro dietro, si sentiva intanto finir lo stomaco a quelle raccomandazioni della moglie.|Faustino Sangelli, andando loro dietro, si sentiva intanto finir lo stomaco a quelle raccomandazioni della moglie.
novelle05_13_pirandello_f000027|Non gli era parso mai tanto ridicolo il suo nome in diminutivo sulle labbra di quella donna cosí grassa|Non gli era parso mai tanto ridicolo il suo nome in diminutivo sulle labbra di quella donna cosí grassa
novelle05_13_pirandello_f000028|né mai tanto sgradevole la voce di lei.|né mai tanto sgradevole la voce di lei.
novelle05_13_pirandello_f000029|Avrebbe voluto gridarle: — E sta’ zitta! Non vedi che sto badando a loro?|Avrebbe voluto gridarle: - E sta zitta! Non vedi che sto badando a loro?
novelle05_13_pirandello_f000030|Ma aveva sulle labbra, rassegato, un sorriso freddo e fatuo|Ma aveva sulle labbra, rassegato, un sorriso freddo e fatuo
novelle05_13_pirandello_f000031|come di chi si presti a far cosa che a lui veramente non appartenga o non prema molto.|come di chi si presti a far cosa che a lui veramente non appartenga o non prema molto.
novelle05_13_pirandello_f000032|Oh Dio, come? I figliuoli? Non gli premevano i figliuoli? Sí, gli premevano.|Oh Dio, come? I figliuoli? Non gli premevano i figliuoli? Sí, gli premevano.
novelle05_13_pirandello_f000033|Ma in quel momento, Faustino Sangelli – il quale aveva già trentasei anni e qualche pelo bianco, più d’uno|Ma in quel momento, Faustino Sangelli - il quale aveva già trentasei anni e qualche pelo bianco, più duno
novelle05_13_pirandello_f000034|nella barba e alle tempie – si sentiva proprio costretto a sorridere in quel modo|nella barba e alle tempie - si sentiva proprio costretto a sorridere in quel modo
novelle05_13_pirandello_f000035|di quel mezzo sorriso freddo e fatuo, tra di compiacenza e di rassegnazione. Non poteva farne a meno.|di quel mezzo sorriso freddo e fatuo, tra di compiacenza e di rassegnazione. Non poteva farne a meno.
novelle05_13_pirandello_f000036|Avrebbe seguitato a sorridere cosí, anche se Carluccio o Niní o Bicetta fossero caduti – non in mare|Avrebbe seguitato a sorridere cosí, anche se Carluccio o Niní o Bicetta fossero caduti - non in mare
novelle05_13_pirandello_f000037|no, Dio liberi! – ma lí sopra coperta e si fossero messi a piangere.|no, Dio liberi! - ma lí sopra coperta e si fossero messi a piangere.
novelle05_13_pirandello_f000038|Perché non sorrideva lui cosí, propriamente;|Perché non sorrideva lui cosí, propriamente;
novelle05_13_pirandello_f000039|ma un altro Faustino Sangelli, di circa diciott’anni, e dunque senza quella barba, e dunque senza né quella moglie né quei figliuoli.|ma un altro Faustino Sangelli, di circa diciottanni, e dunque senza quella barba, e dunque senza né quella moglie né quei figliuoli.
novelle05_13_pirandello_f000040|Questo gli avveniva per il fatto che, tra la gente che quella sera partiva da Napoli col piroscafo per la Sicilia|Questo gli avveniva per il fatto che, tra la gente che quella sera partiva da Napoli col piroscafo per la Sicilia
novelle05_13_pirandello_f000041|aveva intraveduto e riconosciuto subito un suo lontano parente|aveva intraveduto e riconosciuto subito un suo lontano parente
novelle05_13_pirandello_f000042|un tal Silvestro Crispo, già tutto grigio e più ispido e più cupo di quando, tanti e tanti anni addietro, lui, Faustino Sangelli|un tal Silvestro Crispo, già tutto grigio e più ispido e più cupo di quando, tanti e tanti anni addietro, lui, Faustino Sangelli
novelle05_13_pirandello_f000043|allor quasi ragazzo imberbe, studentello matricolino di lettere all’Università di Palermo|allor quasi ragazzo imberbe, studentello matricolino di lettere allUniversità di Palermo
novelle05_13_pirandello_f000044|gli aveva tolto l’amore di Lillí, loro comune cugina|gli aveva tolto lamore di Lillí, loro comune cugina
novelle05_13_pirandello_f000045|di cui tutti e due allora erano perdutamente innamorati e quel poveretto aveva tentato di uccidersi|di cui tutti e due allora erano perdutamente innamorati e quel poveretto aveva tentato di uccidersi
novelle05_13_pirandello_f000046|chiudendosi in camera una notte col braciere acceso.|chiudendosi in camera una notte col braciere acceso.
novelle05_13_pirandello_f000047|Ora Lillí da otto anni era moglie di colui;|Ora Lillí da otto anni era moglie di colui;
novelle05_13_pirandello_f000048|e Faustino Sangelli sapeva che, nonostante l’età, si conservava ancora bellissima e fresca.|e Faustino Sangelli sapeva che, nonostante letà, si conservava ancora bellissima e fresca.
novelle05_13_pirandello_f000049|Tutti i ricordi scottanti, gli errori, i rimorsi della prima gioventú, improvvisamente|Tutti i ricordi scottanti, gli errori, i rimorsi della prima gioventú, improvvisamente
novelle05_13_pirandello_f000050|alla vista di quell’uomo, gli avevano fatto un tale impeto dentro, che n’era come stordito.|alla vista di quelluomo, gli avevano fatto un tale impeto dentro, che nera come stordito.
novelle05_13_pirandello_f000051|Al solo pensiero che quel Silvestro Crispo potesse vederlo, invecchiato e cosí dietro a quei tre ragazzi mal vestiti|Al solo pensiero che quel Silvestro Crispo potesse vederlo, invecchiato e cosí dietro a quei tre ragazzi mal vestiti
novelle05_13_pirandello_f000052|e con quella moglie grassa e ridicola che strillava di là|e con quella moglie grassa e ridicola che strillava di là
novelle05_13_pirandello_f000053|si sentiva vaneggiare in un avvilimento di vergogna, acre e insopportabile, al quale reagiva seguitando a sorridere a quel modo|si sentiva vaneggiare in un avvilimento di vergogna, acre e insopportabile, al quale reagiva seguitando a sorridere a quel modo
novelle05_13_pirandello_f000054|mentre avvertiva con una lucidità che gl’incuteva quasi ribrezzo, che non soltanto lui qual era adesso|mentre avvertiva con una lucidità che glincuteva quasi ribrezzo, che non soltanto lui qual era adesso
novelle05_13_pirandello_f000055|ma lui anche qual era stato tant’anni addietro, sedici anni addietro|ma lui anche qual era stato tantanni addietro, sedici anni addietro
novelle05_13_pirandello_f000056|viveva tuttora e sentiva e ragionava con quegli stessi pensieri|viveva tuttora e sentiva e ragionava con quegli stessi pensieri
novelle05_13_pirandello_f000057|con quegli stessi sentimenti, che già da tanto tempo credeva spenti o cancellati in sé;|con quegli stessi sentimenti, che già da tanto tempo credeva spenti o cancellati in sé;
novelle05_13_pirandello_f000058|ma cosí vivo, cosí «presentemente» vivo che, quasi non parendogli più vero in quel momento tutto ciò che lo circondava|ma cosí vivo, cosí presentemente vivo che, quasi non parendogli più vero in quel momento tutto ciò che lo circondava
novelle05_13_pirandello_f000059|e pur non potendo negarne a se stesso la realtà, non potendo negare per esempio che quei tre ragazzi là fossero suoi;|e pur non potendo negarne a se stesso la realtà, non potendo negare per esempio che quei tre ragazzi là fossero suoi;
novelle05_13_pirandello_f000060|ecco qua, sorrideva, proprio come se non fossero;|ecco qua, sorrideva, proprio come se non fossero;
novelle05_13_pirandello_f000061|proprio come se lui non fosse questo Faustino d’adesso, ma quello: diviso in due vite distanti e contemporanee;|proprio come se lui non fosse questo Faustino dadesso, ma quello: diviso in due vite distanti e contemporanee;
novelle05_13_pirandello_f000062|vere tutt’e due, e vane tutte e due nello stesso tempo;|vere tutte due, e vane tutte e due nello stesso tempo;
novelle05_13_pirandello_f000063|e di là quella biondona pallida, di cui gli arrivava la voce sgraziata: «Faustino! Faustino!» — e qua|e di là quella biondona pallida, di cui gli arrivava la voce sgraziata: Faustino! Faustino! - e qua
novelle05_13_pirandello_f000064|fuggente e ammiccante tra il rimescolío dei passeggeri sopra coperta, Lillí, Lillí di ventidue anni, bella come quando di nascosto|fuggente e ammiccante tra il rimescolío dei passeggeri sopra coperta, Lillí, Lillí di ventidue anni, bella come quando di nascosto
novelle05_13_pirandello_f000065|da lontano, per tentarlo, tenendo socchiuso l’uscio della sua cameretta si scopriva il seno tra il candor delle trine e con la mano faceva appena appena l’atto d’offrirglielo e subito con la stessa mano se lo nascondeva.|da lontano, per tentarlo, tenendo socchiuso luscio della sua cameretta si scopriva il seno tra il candor delle trine e con la mano faceva appena appena latto doffrirglielo e subito con la stessa mano se lo nascondeva.
novelle05_13_pirandello_f000066|Aveva quattr’anni più di lui, Lillí.|Aveva quattranni più di lui, Lillí.
novelle05_13_pirandello_f000067|E che passione, che frenesie, prima ch’ella accondiscendesse a fidanzarsi con lui|E che passione, che frenesie, prima chella accondiscendesse a fidanzarsi con lui
novelle05_13_pirandello_f000068|corteggiata da tanti, anche da quel povero Silvestro Crispo|corteggiata da tanti, anche da quel povero Silvestro Crispo
novelle05_13_pirandello_f000069|che s’affannava in tutti i modi a lavorare per farsi uno stato e ottener subito la mano di lei!|che saffannava in tutti i modi a lavorare per farsi uno stato e ottener subito la mano di lei!
novelle05_13_pirandello_f000070|Ma allora Lillí non si curava di nessuno dei due: di Silvestro Crispo,|Ma allora Lillí non si curava di nessuno dei due: di Silvestro Crispo,
novelle05_13_pirandello_f000071|perché troppo rozzo, ispido e brutto; di lui, perché troppo ragazzo;|perché troppo rozzo, ispido e brutto; di lui, perché troppo ragazzo;
novelle05_13_pirandello_f000072|e s’univa perfidamente a tutti i parenti che se lo prendevano a godere per lo spettacolo che dava loro con quella sua passione precoce e della gelosia che lo assaliva appena vedeva qualcuno ottenere i sorrisi di lei.|e suniva perfidamente a tutti i parenti che se lo prendevano a godere per lo spettacolo che dava loro con quella sua passione precoce e della gelosia che lo assaliva appena vedeva qualcuno ottenere i sorrisi di lei.
novelle05_13_pirandello_f000073|Finché, all’improvviso, chi sa perché|Finché, allimprovviso, chi sa perché
novelle05_13_pirandello_f000074|forse per qualche dispetto o per qualche disinganno inatteso o per prendersi una subita rivincita su qualcuno|forse per qualche dispetto o per qualche disinganno inatteso o per prendersi una subita rivincita su qualcuno
novelle05_13_pirandello_f000075|ella gli s’era accostata amorosa, gli s’era promessa, ma a patto che subito egli si fosse apertamente fidanzato con lei.|ella gli sera accostata amorosa, gli sera promessa, ma a patto che subito egli si fosse apertamente fidanzato con lei.
novelle05_13_pirandello_f000076|Lí per lí, gli era parso di toccare il cielo col dito.|Lí per lí, gli era parso di toccare il cielo col dito.
novelle05_13_pirandello_f000077|Per più d’un mese aveva dovuto combattere per strappare il consenso al padre|Per più dun mese aveva dovuto combattere per strappare il consenso al padre
novelle05_13_pirandello_f000078|il quale saggiamente gli aveva fatto osservare ch’era troppo intempestivo per lui un impegno di quel genere;|il quale saggiamente gli aveva fatto osservare chera troppo intempestivo per lui un impegno di quel genere;
novelle05_13_pirandello_f000079|che la cugina aveva quattr’anni più di lui, e che egli, ancora studente, avrebbe dovuto aspettare per lo meno altri sei anni per farla sua.|che la cugina aveva quattranni più di lui, e che egli, ancora studente, avrebbe dovuto aspettare per lo meno altri sei anni per farla sua.
novelle05_13_pirandello_f000080|Ostinato, dopo molte promesse e giuramenti, era riuscito a spuntarla.|Ostinato, dopo molte promesse e giuramenti, era riuscito a spuntarla.
novelle05_13_pirandello_f000081|Se non che, subito dopo, nel vedersi presentare a tutti, cosí ancor quasi ragazzo, senza uno stato, come promesso sposo di Lillí|Se non che, subito dopo, nel vedersi presentare a tutti, cosí ancor quasi ragazzo, senza uno stato, come promesso sposo di Lillí
novelle05_13_pirandello_f000082|s’era sentito ridicolo agli occhi di tutti e specialmente di quegli altri giovanotti che|sera sentito ridicolo agli occhi di tutti e specialmente di quegli altri giovanotti che
novelle05_13_pirandello_f000083|corrisposti, avevano per qualche tempo amoreggiato con la sua fidanzata.|corrisposti, avevano per qualche tempo amoreggiato con la sua fidanzata.
novelle05_13_pirandello_f000084|La passione, cosí cocente quand’era nascosta, contrariata e derisa, aveva perduto a un tratto il fervore, tutta la poesia;|La passione, cosí cocente quandera nascosta, contrariata e derisa, aveva perduto a un tratto il fervore, tutta la poesia;
novelle05_13_pirandello_f000085|e poco dopo egli se n’era scappato dalla Sicilia per troncare quel fidanzamento|e poco dopo egli se nera scappato dalla Sicilia per troncare quel fidanzamento
novelle05_13_pirandello_f000086|ch’era stato intanto il colpo di grazia per quel Silvestro Crispo.|chera stato intanto il colpo di grazia per quel Silvestro Crispo.
novelle05_13_pirandello_f000087|Nel vedersi posposto a un giovanottino ancor imberbe, senza né arte né parte, lui che già lavorava, lui che era già uomo;|Nel vedersi posposto a un giovanottino ancor imberbe, senza né arte né parte, lui che già lavorava, lui che era già uomo;
novelle05_13_pirandello_f000088|sdegnato, disperato, aveva voluto uccidersi;|sdegnato, disperato, aveva voluto uccidersi;
novelle05_13_pirandello_f000089|ed era stato salvato per miracolo.|ed era stato salvato per miracolo.
novelle05_13_pirandello_f000090|Ora eccolo là! Marito di Lillí.|Ora eccolo là! Marito di Lillí.
novelle05_13_pirandello_f000091|Padre (sapeva anche questo, Faustino Sangelli), padre d’un bambino, di cui gli avevano tanto vantato la bellezza. Bello come mamma.|Padre sapeva anche questo, Faustino Sangelli, padre dun bambino, di cui gli avevano tanto vantato la bellezza. Bello come mamma.
novelle05_13_pirandello_f000092|Dunque, forse felice, quell’uomo lí.|Dunque, forse felice, quelluomo lí.
novelle05_13_pirandello_f000093|Mentre lui… Ecco, perché, correndo appresso a quei bambini non belli e mal vestiti|Mentre lui Ecco, perché, correndo appresso a quei bambini non belli e mal vestiti
novelle05_13_pirandello_f000094|aveva bisogno di sorridere a quel modo Faustino Sangelli in quel momento;|aveva bisogno di sorridere a quel modo Faustino Sangelli in quel momento;
novelle05_13_pirandello_f000095|bisogno, proprio bisogno di veder viva, di ventidue anni, là, fuggente e ammiccante|bisogno, proprio bisogno di veder viva, di ventidue anni, là, fuggente e ammiccante
novelle05_13_pirandello_f000096|tra il rimescolío dei passeggeri Lillí, Lillí che accennava|tra il rimescolío dei passeggeri Lillí, Lillí che accennava
novelle05_13_pirandello_f000097|cosí fuggendo e riparandosi dietro le spalle dei passeggeri|cosí fuggendo e riparandosi dietro le spalle dei passeggeri
novelle05_13_pirandello_f000098|di scoprirsi ancora il seno e far con la mano appena appena l’atto d’offrirglielo e subito con la stessa mano l’atto di nasconderselo.|di scoprirsi ancora il seno e far con la mano appena appena latto doffrirglielo e subito con la stessa mano latto di nasconderselo.
novelle05_13_pirandello_f000099|Ah, tante volte, tante volte, ebbro d’amore, gliel’aveva baciato, lui, quel piccolo seno! E ora voleva che quell’uomo lí lo sapesse. Sí, sí.|Ah, tante volte, tante volte, ebbro damore, glielaveva baciato, lui, quel piccolo seno! E ora voleva che quelluomo lí lo sapesse. Sí, sí.
novelle05_13_pirandello_f000100|Sorrideva a quel modo per farglielo sapere.|Sorrideva a quel modo per farglielo sapere.
